15:56:30.370498 IP 127.0.0.1.41462 > 127.0.0.1.8000: tcp 0
15:56:30.370514 IP 127.0.0.1.8000 > 127.0.0.1.41462: tcp 0
15:56:30.370522 IP 127.0.0.1.41462 > 127.0.0.1.8000: tcp 0
15:56:30.370574 IP 127.0.0.1.41462 > 127.0.0.1.8000: tcp 294
15:56:30.370583 IP 127.0.0.1.8000 > 127.0.0.1.41462: tcp 0
15:56:30.371263 IP 127.0.0.1.8000 > 127.0.0.1.41462: tcp 17
15:56:30.371352 IP 127.0.0.1.41462 > 127.0.0.1.8000: tcp 0
15:56:30.371363 IP 127.0.0.1.8000 > 127.0.0.1.41462: tcp 136
15:56:30.371376 IP 127.0.0.1.41462 > 127.0.0.1.8000: tcp 0
15:56:30.371382 IP 127.0.0.1.8000 > 127.0.0.1.41462: tcp 226
15:56:30.371392 IP 127.0.0.1.41462 > 127.0.0.1.8000: tcp 0
15:56:30.808931 IP 127.0.0.1.41462 > 127.0.0.1.8000: tcp 275
15:56:30.809583 IP 127.0.0.1.8000 > 127.0.0.1.41462: tcp 29
15:56:30.809609 IP 127.0.0.1.41462 > 127.0.0.1.8000: tcp 0
15:56:30.809874 IP 127.0.0.1.8000 > 127.0.0.1.41462: tcp 38
15:56:30.809889 IP 127.0.0.1.41462 > 127.0.0.1.8000: tcp 0
15:56:30.809966 IP 127.0.0.1.8000 > 127.0.0.1.41462: tcp 37
15:56:30.809974 IP 127.0.0.1.41462 > 127.0.0.1.8000: tcp 0
15:56:30.810005 IP 127.0.0.1.8000 > 127.0.0.1.41462: tcp 25
15:56:30.810012 IP 127.0.0.1.41462 > 127.0.0.1.8000: tcp 0
15:56:30.810041 IP 127.0.0.1.8000 > 127.0.0.1.41462: tcp 19
15:56:30.810049 IP 127.0.0.1.41462 > 127.0.0.1.8000: tcp 0
15:56:30.810078 IP 127.0.0.1.8000 > 127.0.0.1.41462: tcp 2
15:56:30.810085 IP 127.0.0.1.41462 > 127.0.0.1.8000: tcp 0
15:56:30.810113 IP 127.0.0.1.8000 > 127.0.0.1.41462: tcp 195
15:56:30.810120 IP 127.0.0.1.41462 > 127.0.0.1.8000: tcp 0
15:56:30.810194 IP 127.0.0.1.8000 > 127.0.0.1.41462: tcp 0
15:56:30.810253 IP 127.0.0.1.41462 > 127.0.0.1.8000: tcp 0
15:56:30.810268 IP 127.0.0.1.8000 > 127.0.0.1.41462: tcp 0
15:56:30.838075 IP 127.0.0.1.41463 > 127.0.0.1.8000: tcp 0
15:56:30.838094 IP 127.0.0.1.8000 > 127.0.0.1.41463: tcp 0
15:56:30.838105 IP 127.0.0.1.41463 > 127.0.0.1.8000: tcp 0
15:56:30.838403 IP 127.0.0.1.41463 > 127.0.0.1.8000: tcp 305
15:56:30.838620 IP 127.0.0.1.8000 > 127.0.0.1.41463: tcp 0
15:56:30.839327 IP 127.0.0.1.8000 > 127.0.0.1.41463: tcp 29
15:56:30.839349 IP 127.0.0.1.41463 > 127.0.0.1.8000: tcp 0
15:56:30.839610 IP 127.0.0.1.8000 > 127.0.0.1.41463: tcp 38
15:56:30.839626 IP 127.0.0.1.41463 > 127.0.0.1.8000: tcp 0
15:56:30.839744 IP 127.0.0.1.8000 > 127.0.0.1.41463: tcp 37
15:56:30.839757 IP 127.0.0.1.41463 > 127.0.0.1.8000: tcp 0
15:56:30.839850 IP 127.0.0.1.8000 > 127.0.0.1.41463: tcp 25
15:56:30.839863 IP 127.0.0.1.41463 > 127.0.0.1.8000: tcp 0
15:56:30.839954 IP 127.0.0.1.8000 > 127.0.0.1.41463: tcp 19
15:56:30.839968 IP 127.0.0.1.41463 > 127.0.0.1.8000: tcp 0
15:56:30.840061 IP 127.0.0.1.8000 > 127.0.0.1.41463: tcp 2
15:56:30.840075 IP 127.0.0.1.41463 > 127.0.0.1.8000: tcp 0
15:56:30.840164 IP 127.0.0.1.8000 > 127.0.0.1.41463: tcp 195
15:56:30.840177 IP 127.0.0.1.41463 > 127.0.0.1.8000: tcp 0
15:56:30.840305 IP 127.0.0.1.8000 > 127.0.0.1.41463: tcp 0
15:56:30.840397 IP 127.0.0.1.41463 > 127.0.0.1.8000: tcp 0
15:56:30.840411 IP 127.0.0.1.8000 > 127.0.0.1.41463: tcp 0
15:56:31.849343 IP 127.0.0.1.41464 > 127.0.0.1.8000: tcp 0
15:56:31.849358 IP 127.0.0.1.8000 > 127.0.0.1.41464: tcp 0
15:56:31.849366 IP 127.0.0.1.41464 > 127.0.0.1.8000: tcp 0
15:56:31.849447 IP 127.0.0.1.41464 > 127.0.0.1.8000: tcp 340
15:56:31.849455 IP 127.0.0.1.8000 > 127.0.0.1.41464: tcp 0
15:56:31.849861 IP 127.0.0.1.8000 > 127.0.0.1.41464: tcp 17
15:56:31.849878 IP 127.0.0.1.41464 > 127.0.0.1.8000: tcp 0
15:56:31.849911 IP 127.0.0.1.8000 > 127.0.0.1.41464: tcp 38
15:56:31.849916 IP 127.0.0.1.41464 > 127.0.0.1.8000: tcp 0
15:56:31.849944 IP 127.0.0.1.8000 > 127.0.0.1.41464: tcp 37
15:56:31.849949 IP 127.0.0.1.41464 > 127.0.0.1.8000: tcp 0
15:56:31.849964 IP 127.0.0.1.8000 > 127.0.0.1.41464: tcp 26
15:56:31.849969 IP 127.0.0.1.41464 > 127.0.0.1.8000: tcp 0
15:56:31.849989 IP 127.0.0.1.8000 > 127.0.0.1.41464: tcp 21
15:56:31.849995 IP 127.0.0.1.41464 > 127.0.0.1.8000: tcp 0
15:56:31.850019 IP 127.0.0.1.8000 > 127.0.0.1.41464: tcp 46
15:56:31.850025 IP 127.0.0.1.41464 > 127.0.0.1.8000: tcp 0
15:56:31.850039 IP 127.0.0.1.8000 > 127.0.0.1.41464: tcp 2
15:56:31.850044 IP 127.0.0.1.41464 > 127.0.0.1.8000: tcp 0
15:56:31.850071 IP 127.0.0.1.8000 > 127.0.0.1.41464: tcp 554
15:56:31.850077 IP 127.0.0.1.41464 > 127.0.0.1.8000: tcp 0
15:57:09.356072 IP 127.0.0.1.44044 > 127.0.0.1.50007: UDP, length 5
15:57:09.356091 IP 127.0.0.1 > 127.0.0.1: ICMP 127.0.0.1 udp port 50007 unreachable, length 41
15:57:36.099542 IP 127.0.0.1.41464 > 127.0.0.1.8000: tcp 320
15:57:36.100064 IP 127.0.0.1.8000 > 127.0.0.1.41464: tcp 17
15:57:36.100083 IP 127.0.0.1.41464 > 127.0.0.1.8000: tcp 0
15:57:36.100103 IP 127.0.0.1.8000 > 127.0.0.1.41464: tcp 38
15:57:36.100109 IP 127.0.0.1.41464 > 127.0.0.1.8000: tcp 0
15:57:36.100136 IP 127.0.0.1.8000 > 127.0.0.1.41464: tcp 37
15:57:36.100141 IP 127.0.0.1.41464 > 127.0.0.1.8000: tcp 0
15:57:36.100156 IP 127.0.0.1.8000 > 127.0.0.1.41464: tcp 40
15:57:36.100161 IP 127.0.0.1.41464 > 127.0.0.1.8000: tcp 0
15:57:36.100175 IP 127.0.0.1.8000 > 127.0.0.1.41464: tcp 21
15:57:36.100180 IP 127.0.0.1.41464 > 127.0.0.1.8000: tcp 0
15:57:36.100193 IP 127.0.0.1.8000 > 127.0.0.1.41464: tcp 2
15:57:36.100198 IP 127.0.0.1.41464 > 127.0.0.1.8000: tcp 0
15:57:36.100214 IP 127.0.0.1.8000 > 127.0.0.1.41464: tcp 224
15:57:36.100219 IP 127.0.0.1.41464 > 127.0.0.1.8000: tcp 0
15:58:19.893605 IP 127.0.0.1.42720 > 127.0.0.1.25: tcp 0
15:58:19.893624 IP 127.0.0.1.25 > 127.0.0.1.42720: tcp 0
15:58:19.893636 IP 127.0.0.1.42720 > 127.0.0.1.25: tcp 0
15:58:20.263127 IP 127.0.0.1.25 > 127.0.0.1.42720: tcp 48
15:58:20.263208 IP 127.0.0.1.42720 > 127.0.0.1.25: tcp 0
15:58:20.263702 IP 127.0.0.1.42720 > 127.0.0.1.25: tcp 18
15:58:20.263720 IP 127.0.0.1.25 > 127.0.0.1.42720: tcp 0
15:58:20.263817 IP 127.0.0.1.25 > 127.0.0.1.42720: tcp 142
15:58:20.265006 IP 127.0.0.1.42720 > 127.0.0.1.25: tcp 21
15:58:20.265117 IP 127.0.0.1.25 > 127.0.0.1.42720: tcp 14
15:58:20.265238 IP 127.0.0.1.42720 > 127.0.0.1.25: tcp 12
15:58:20.265349 IP 127.0.0.1.25 > 127.0.0.1.42720: tcp 40
15:58:20.265711 IP 127.0.0.1.42720 > 127.0.0.1.25: tcp 6
15:58:20.265770 IP 127.0.0.1.25 > 127.0.0.1.42720: tcp 14
15:58:20.269418 IP 127.0.0.1.42720 > 127.0.0.1.25: tcp 0
15:58:20.269621 IP 127.0.0.1.25 > 127.0.0.1.42720: tcp 0
15:58:20.269642 IP 127.0.0.1.42720 > 127.0.0.1.25: tcp 0
15:59:31.086022 IP 127.0.0.1.41464 > 127.0.0.1.8000: tcp 0
15:59:31.086200 IP 127.0.0.1.8000 > 127.0.0.1.41464: tcp 0
15:59:31.086219 IP 127.0.0.1.41464 > 127.0.0.1.8000: tcp 0
15:59:32.450163 IP 127.0.0.1.48497 > 127.0.0.1.8010: tcp 0
15:59:32.450176 IP 127.0.0.1.8010 > 127.0.0.1.48497: tcp 0
15:59:32.450183 IP 127.0.0.1.48497 > 127.0.0.1.8010: tcp 0
15:59:32.450376 IP 127.0.0.1.48497 > 127.0.0.1.8010: tcp 294
15:59:32.450404 IP 127.0.0.1.8010 > 127.0.0.1.48497: tcp 0
15:59:32.450874 IP 127.0.0.1.8010 > 127.0.0.1.48497: tcp 17
15:59:32.450889 IP 127.0.0.1.48497 > 127.0.0.1.8010: tcp 0
15:59:32.450977 IP 127.0.0.1.8010 > 127.0.0.1.48497: tcp 38
15:59:32.450984 IP 127.0.0.1.48497 > 127.0.0.1.8010: tcp 0
15:59:32.451055 IP 127.0.0.1.8010 > 127.0.0.1.48497: tcp 37
15:59:32.451063 IP 127.0.0.1.48497 > 127.0.0.1.8010: tcp 0
15:59:32.451112 IP 127.0.0.1.8010 > 127.0.0.1.48497: tcp 40
15:59:32.451118 IP 127.0.0.1.48497 > 127.0.0.1.8010: tcp 0
15:59:32.451163 IP 127.0.0.1.8010 > 127.0.0.1.48497: tcp 21
15:59:32.451169 IP 127.0.0.1.48497 > 127.0.0.1.8010: tcp 0
15:59:32.451219 IP 127.0.0.1.8010 > 127.0.0.1.48497: tcp 2
15:59:32.451225 IP 127.0.0.1.48497 > 127.0.0.1.8010: tcp 0
15:59:32.451276 IP 127.0.0.1.8010 > 127.0.0.1.48497: tcp 224
15:59:32.451282 IP 127.0.0.1.48497 > 127.0.0.1.8010: tcp 0
15:59:32.564292 IP 127.0.0.1.48497 > 127.0.0.1.8010: tcp 275
15:59:32.564815 IP 127.0.0.1.8010 > 127.0.0.1.48497: tcp 29
15:59:32.564835 IP 127.0.0.1.48497 > 127.0.0.1.8010: tcp 0
15:59:32.564857 IP 127.0.0.1.8010 > 127.0.0.1.48497: tcp 38
15:59:32.564862 IP 127.0.0.1.48497 > 127.0.0.1.8010: tcp 0
15:59:32.564889 IP 127.0.0.1.8010 > 127.0.0.1.48497: tcp 37
15:59:32.564895 IP 127.0.0.1.48497 > 127.0.0.1.8010: tcp 0
15:59:32.564910 IP 127.0.0.1.8010 > 127.0.0.1.48497: tcp 25
15:59:32.564915 IP 127.0.0.1.48497 > 127.0.0.1.8010: tcp 0
15:59:32.564929 IP 127.0.0.1.8010 > 127.0.0.1.48497: tcp 19
15:59:32.564933 IP 127.0.0.1.48497 > 127.0.0.1.8010: tcp 0
15:59:32.564947 IP 127.0.0.1.8010 > 127.0.0.1.48497: tcp 2
15:59:32.564951 IP 127.0.0.1.48497 > 127.0.0.1.8010: tcp 0
15:59:32.564963 IP 127.0.0.1.8010 > 127.0.0.1.48497: tcp 195
15:59:32.564970 IP 127.0.0.1.48497 > 127.0.0.1.8010: tcp 0
15:59:32.565023 IP 127.0.0.1.8010 > 127.0.0.1.48497: tcp 0
15:59:32.565225 IP 127.0.0.1.48497 > 127.0.0.1.8010: tcp 0
15:59:32.565237 IP 127.0.0.1.8010 > 127.0.0.1.48497: tcp 0
15:59:32.571820 IP 127.0.0.1.48498 > 127.0.0.1.8010: tcp 0
15:59:32.571834 IP 127.0.0.1.8010 > 127.0.0.1.48498: tcp 0
15:59:32.571842 IP 127.0.0.1.48498 > 127.0.0.1.8010: tcp 0
15:59:32.571895 IP 127.0.0.1.48498 > 127.0.0.1.8010: tcp 305
15:59:32.571904 IP 127.0.0.1.8010 > 127.0.0.1.48498: tcp 0
15:59:32.572453 IP 127.0.0.1.8010 > 127.0.0.1.48498: tcp 29
15:59:32.572469 IP 127.0.0.1.48498 > 127.0.0.1.8010: tcp 0
15:59:32.572494 IP 127.0.0.1.8010 > 127.0.0.1.48498: tcp 38
15:59:32.572500 IP 127.0.0.1.48498 > 127.0.0.1.8010: tcp 0
15:59:32.572526 IP 127.0.0.1.8010 > 127.0.0.1.48498: tcp 37
15:59:32.572531 IP 127.0.0.1.48498 > 127.0.0.1.8010: tcp 0
15:59:32.572545 IP 127.0.0.1.8010 > 127.0.0.1.48498: tcp 25
15:59:32.572551 IP 127.0.0.1.48498 > 127.0.0.1.8010: tcp 0
15:59:32.572564 IP 127.0.0.1.8010 > 127.0.0.1.48498: tcp 19
15:59:32.572569 IP 127.0.0.1.48498 > 127.0.0.1.8010: tcp 0
15:59:32.572583 IP 127.0.0.1.8010 > 127.0.0.1.48498: tcp 2
15:59:32.572589 IP 127.0.0.1.48498 > 127.0.0.1.8010: tcp 0
15:59:32.572602 IP 127.0.0.1.8010 > 127.0.0.1.48498: tcp 195
15:59:32.572607 IP 127.0.0.1.48498 > 127.0.0.1.8010: tcp 0
15:59:32.572639 IP 127.0.0.1.8010 > 127.0.0.1.48498: tcp 0
15:59:32.572907 IP 127.0.0.1.48498 > 127.0.0.1.8010: tcp 0
15:59:32.572921 IP 127.0.0.1.8010 > 127.0.0.1.48498: tcp 0
15:59:34.346749 IP 127.0.0.1.48499 > 127.0.0.1.8010: tcp 0
15:59:34.346764 IP 127.0.0.1.8010 > 127.0.0.1.48499: tcp 0
15:59:34.346772 IP 127.0.0.1.48499 > 127.0.0.1.8010: tcp 0
15:59:34.346975 IP 127.0.0.1.48499 > 127.0.0.1.8010: tcp 340
15:59:34.347097 IP 127.0.0.1.8010 > 127.0.0.1.48499: tcp 0
15:59:34.347473 IP 127.0.0.1.8010 > 127.0.0.1.48499: tcp 17
15:59:34.347484 IP 127.0.0.1.48499 > 127.0.0.1.8010: tcp 0
15:59:34.347580 IP 127.0.0.1.8010 > 127.0.0.1.48499: tcp 38
15:59:34.347587 IP 127.0.0.1.48499 > 127.0.0.1.8010: tcp 0
15:59:34.347652 IP 127.0.0.1.8010 > 127.0.0.1.48499: tcp 37
15:59:34.347659 IP 127.0.0.1.48499 > 127.0.0.1.8010: tcp 0
15:59:34.347707 IP 127.0.0.1.8010 > 127.0.0.1.48499: tcp 26
15:59:34.347713 IP 127.0.0.1.48499 > 127.0.0.1.8010: tcp 0
15:59:34.347757 IP 127.0.0.1.8010 > 127.0.0.1.48499: tcp 21
15:59:34.347763 IP 127.0.0.1.48499 > 127.0.0.1.8010: tcp 0
15:59:34.347819 IP 127.0.0.1.8010 > 127.0.0.1.48499: tcp 46
15:59:34.347825 IP 127.0.0.1.48499 > 127.0.0.1.8010: tcp 0
15:59:34.347841 IP 127.0.0.1.8010 > 127.0.0.1.48499: tcp 2
15:59:34.347847 IP 127.0.0.1.48499 > 127.0.0.1.8010: tcp 0
15:59:34.347882 IP 127.0.0.1.8010 > 127.0.0.1.48499: tcp 554
15:59:34.347891 IP 127.0.0.1.48499 > 127.0.0.1.8010: tcp 0
15:59:36.401709 IP 127.0.0.1.48499 > 127.0.0.1.8010: tcp 390
15:59:36.402435 IP 127.0.0.1.8010 > 127.0.0.1.48499: tcp 17
15:59:36.402470 IP 127.0.0.1.48499 > 127.0.0.1.8010: tcp 0
15:59:36.402512 IP 127.0.0.1.8010 > 127.0.0.1.48499: tcp 38
15:59:36.402521 IP 127.0.0.1.48499 > 127.0.0.1.8010: tcp 0
15:59:36.402576 IP 127.0.0.1.8010 > 127.0.0.1.48499: tcp 37
15:59:36.402585 IP 127.0.0.1.48499 > 127.0.0.1.8010: tcp 0
15:59:36.402619 IP 127.0.0.1.8010 > 127.0.0.1.48499: tcp 26
15:59:36.402627 IP 127.0.0.1.48499 > 127.0.0.1.8010: tcp 0
15:59:36.402666 IP 127.0.0.1.8010 > 127.0.0.1.48499: tcp 21
15:59:36.402675 IP 127.0.0.1.48499 > 127.0.0.1.8010: tcp 0
15:59:36.402727 IP 127.0.0.1.8010 > 127.0.0.1.48499: tcp 46
15:59:36.402736 IP 127.0.0.1.48499 > 127.0.0.1.8010: tcp 0
15:59:36.402766 IP 127.0.0.1.8010 > 127.0.0.1.48499: tcp 2
15:59:36.402775 IP 127.0.0.1.48499 > 127.0.0.1.8010: tcp 0
15:59:36.402824 IP 127.0.0.1.8010 > 127.0.0.1.48499: tcp 554
16:00:09.246994 IP 127.0.0.1.48499 > 127.0.0.1.8010: tcp 390
16:00:09.247916 IP 127.0.0.1.8010 > 127.0.0.1.48499: tcp 17
16:00:09.247954 IP 127.0.0.1.48499 > 127.0.0.1.8010: tcp 0
16:00:09.247994 IP 127.0.0.1.8010 > 127.0.0.1.48499: tcp 38
16:00:09.248001 IP 127.0.0.1.48499 > 127.0.0.1.8010: tcp 0
16:00:09.248040 IP 127.0.0.1.8010 > 127.0.0.1.48499: tcp 37
16:00:09.248046 IP 127.0.0.1.48499 > 127.0.0.1.8010: tcp 0
16:00:09.248105 IP 127.0.0.1.8010 > 127.0.0.1.48499: tcp 26
16:00:09.248111 IP 127.0.0.1.48499 > 127.0.0.1.8010: tcp 0
16:00:09.248142 IP 127.0.0.1.8010 > 127.0.0.1.48499: tcp 21
16:00:09.248147 IP 127.0.0.1.48499 > 127.0.0.1.8010: tcp 0
16:00:09.248180 IP 127.0.0.1.8010 > 127.0.0.1.48499: tcp 46
16:00:09.248185 IP 127.0.0.1.48499 > 127.0.0.1.8010: tcp 0
16:00:09.248201 IP 127.0.0.1.8010 > 127.0.0.1.48499: tcp 2
16:00:09.248207 IP 127.0.0.1.48499 > 127.0.0.1.8010: tcp 0
16:00:09.248236 IP 127.0.0.1.8010 > 127.0.0.1.48499: tcp 554
16:00:09.248241 IP 127.0.0.1.48499 > 127.0.0.1.8010: tcp 0
16:00:29.532168 IP 127.0.0.1.42735 > 127.0.0.1.25: tcp 0
16:00:29.532194 IP 127.0.0.1.25 > 127.0.0.1.42735: tcp 0
16:00:29.532207 IP 127.0.0.1.42735 > 127.0.0.1.25: tcp 0
16:00:29.555528 IP 127.0.0.1.25 > 127.0.0.1.42735: tcp 48
16:00:29.555604 IP 127.0.0.1.42735 > 127.0.0.1.25: tcp 0
16:00:29.556067 IP 127.0.0.1.42735 > 127.0.0.1.25: tcp 18
16:00:29.556080 IP 127.0.0.1.25 > 127.0.0.1.42735: tcp 0
16:00:29.556197 IP 127.0.0.1.25 > 127.0.0.1.42735: tcp 142
16:00:29.557370 IP 127.0.0.1.42735 > 127.0.0.1.25: tcp 21
16:00:29.557499 IP 127.0.0.1.25 > 127.0.0.1.42735: tcp 14
16:00:29.557738 IP 127.0.0.1.42735 > 127.0.0.1.25: tcp 12
16:00:29.557834 IP 127.0.0.1.25 > 127.0.0.1.42735: tcp 40
16:00:29.557869 IP 127.0.0.1.42735 > 127.0.0.1.25: tcp 6
16:00:29.557902 IP 127.0.0.1.25 > 127.0.0.1.42735: tcp 14
16:00:29.560489 IP 127.0.0.1.42735 > 127.0.0.1.25: tcp 0
16:00:29.560634 IP 127.0.0.1.25 > 127.0.0.1.42735: tcp 0
16:00:29.560647 IP 127.0.0.1.42735 > 127.0.0.1.25: tcp 0
16:01:21.490674 IP 127.0.0.1.35949 > 127.0.0.1.50007: UDP, length 5
16:01:22.906290 IP 127.0.0.1.35949 > 127.0.0.1.50007: UDP, length 5
16:01:25.290211 IP 127.0.0.1.35949 > 127.0.0.1.50007: UDP, length 7
16:01:35.007668 IP 127.0.0.1.48499 > 127.0.0.1.8010: tcp 320
16:01:35.008237 IP 127.0.0.1.8010 > 127.0.0.1.48499: tcp 17
16:01:35.008259 IP 127.0.0.1.48499 > 127.0.0.1.8010: tcp 0
16:01:35.008713 IP 127.0.0.1.8010 > 127.0.0.1.48499: tcp 38
16:01:35.008729 IP 127.0.0.1.48499 > 127.0.0.1.8010: tcp 0
16:01:35.008777 IP 127.0.0.1.8010 > 127.0.0.1.48499: tcp 37
16:01:35.008784 IP 127.0.0.1.48499 > 127.0.0.1.8010: tcp 0
16:01:35.008820 IP 127.0.0.1.8010 > 127.0.0.1.48499: tcp 40
16:01:35.008826 IP 127.0.0.1.48499 > 127.0.0.1.8010: tcp 0
16:01:35.008848 IP 127.0.0.1.8010 > 127.0.0.1.48499: tcp 21
16:01:35.008854 IP 127.0.0.1.48499 > 127.0.0.1.8010: tcp 0
16:01:35.008875 IP 127.0.0.1.8010 > 127.0.0.1.48499: tcp 2
16:01:35.008881 IP 127.0.0.1.48499 > 127.0.0.1.8010: tcp 0
16:01:35.008906 IP 127.0.0.1.8010 > 127.0.0.1.48499: tcp 224
16:01:35.008912 IP 127.0.0.1.48499 > 127.0.0.1.8010: tcp 0
16:01:36.039853 IP 127.0.0.1.48499 > 127.0.0.1.8010: tcp 320
16:01:36.040399 IP 127.0.0.1.8010 > 127.0.0.1.48499: tcp 17
16:01:36.040421 IP 127.0.0.1.48499 > 127.0.0.1.8010: tcp 0
16:01:36.040706 IP 127.0.0.1.8010 > 127.0.0.1.48499: tcp 38
16:01:36.040718 IP 127.0.0.1.48499 > 127.0.0.1.8010: tcp 0
16:01:36.040762 IP 127.0.0.1.8010 > 127.0.0.1.48499: tcp 37
16:01:36.040769 IP 127.0.0.1.48499 > 127.0.0.1.8010: tcp 0
16:01:36.040795 IP 127.0.0.1.8010 > 127.0.0.1.48499: tcp 40
16:01:36.040801 IP 127.0.0.1.48499 > 127.0.0.1.8010: tcp 0
16:01:36.040841 IP 127.0.0.1.8010 > 127.0.0.1.48499: tcp 21
16:01:36.040847 IP 127.0.0.1.48499 > 127.0.0.1.8010: tcp 0
16:01:36.040924 IP 127.0.0.1.8010 > 127.0.0.1.48499: tcp 2
16:01:36.040931 IP 127.0.0.1.48499 > 127.0.0.1.8010: tcp 0
16:01:36.040958 IP 127.0.0.1.8010 > 127.0.0.1.48499: tcp 224
16:01:36.040964 IP 127.0.0.1.48499 > 127.0.0.1.8010: tcp 0
16:01:36.512107 IP 127.0.0.1.48499 > 127.0.0.1.8010: tcp 320
16:01:36.512700 IP 127.0.0.1.8010 > 127.0.0.1.48499: tcp 17
16:01:36.512722 IP 127.0.0.1.48499 > 127.0.0.1.8010: tcp 0
16:01:36.512998 IP 127.0.0.1.8010 > 127.0.0.1.48499: tcp 38
16:01:36.513007 IP 127.0.0.1.48499 > 127.0.0.1.8010: tcp 0
16:01:36.513039 IP 127.0.0.1.8010 > 127.0.0.1.48499: tcp 37
16:01:36.513045 IP 127.0.0.1.48499 > 127.0.0.1.8010: tcp 0
16:01:36.513062 IP 127.0.0.1.8010 > 127.0.0.1.48499: tcp 40
16:01:36.513066 IP 127.0.0.1.48499 > 127.0.0.1.8010: tcp 0
16:01:36.513081 IP 127.0.0.1.8010 > 127.0.0.1.48499: tcp 21
16:01:36.513086 IP 127.0.0.1.48499 > 127.0.0.1.8010: tcp 0
16:01:36.513099 IP 127.0.0.1.8010 > 127.0.0.1.48499: tcp 2
16:01:36.513106 IP 127.0.0.1.48499 > 127.0.0.1.8010: tcp 0
16:01:36.513125 IP 127.0.0.1.8010 > 127.0.0.1.48499: tcp 224
16:01:36.513130 IP 127.0.0.1.48499 > 127.0.0.1.8010: tcp 0
16:01:37.861868 IP 127.0.0.1.48499 > 127.0.0.1.8010: tcp 390
16:01:37.862358 IP 127.0.0.1.8010 > 127.0.0.1.48499: tcp 17
16:01:37.862387 IP 127.0.0.1.48499 > 127.0.0.1.8010: tcp 0
16:01:37.862424 IP 127.0.0.1.8010 > 127.0.0.1.48499: tcp 38
16:01:37.862431 IP 127.0.0.1.48499 > 127.0.0.1.8010: tcp 0
16:01:37.862466 IP 127.0.0.1.8010 > 127.0.0.1.48499: tcp 37
16:01:37.862473 IP 127.0.0.1.48499 > 127.0.0.1.8010: tcp 0
16:01:37.862496 IP 127.0.0.1.8010 > 127.0.0.1.48499: tcp 26
16:01:37.862502 IP 127.0.0.1.48499 > 127.0.0.1.8010: tcp 0
16:01:37.862530 IP 127.0.0.1.8010 > 127.0.0.1.48499: tcp 21
16:01:37.862536 IP 127.0.0.1.48499 > 127.0.0.1.8010: tcp 0
16:01:37.862568 IP 127.0.0.1.8010 > 127.0.0.1.48499: tcp 46
16:01:37.862574 IP 127.0.0.1.48499 > 127.0.0.1.8010: tcp 0
16:01:37.862757 IP 127.0.0.1.8010 > 127.0.0.1.48499: tcp 2
16:01:37.862764 IP 127.0.0.1.48499 > 127.0.0.1.8010: tcp 0
16:01:37.862831 IP 127.0.0.1.8010 > 127.0.0.1.48499: tcp 554
16:01:37.862839 IP 127.0.0.1.48499 > 127.0.0.1.8010: tcp 0
16:01:51.714697 IP 127.0.0.1.39402 > 127.0.0.1.50007: UDP, length 4
16:01:52.177997 IP 127.0.0.1.39402 > 127.0.0.1.50007: UDP, length 5
16:01:52.650210 IP 127.0.0.1.39402 > 127.0.0.1.50007: UDP, length 7
16:01:53.185967 IP 127.0.0.1.39402 > 127.0.0.1.50007: UDP, length 5
16:01:54.050173 IP 127.0.0.1.39402 > 127.0.0.1.50007: UDP, length 10
16:01:54.402206 IP 127.0.0.1.39402 > 127.0.0.1.50007: UDP, length 3
16:01:54.850209 IP 127.0.0.1.39402 > 127.0.0.1.50007: UDP, length 5
16:01:55.074231 IP 127.0.0.1.39402 > 127.0.0.1.50007: UDP, length 1
16:01:55.306364 IP 127.0.0.1.39402 > 127.0.0.1.50007: UDP, length 3
16:01:55.474171 IP 127.0.0.1.39402 > 127.0.0.1.50007: UDP, length 2
16:01:55.674238 IP 127.0.0.1.39402 > 127.0.0.1.50007: UDP, length 1
16:01:55.850226 IP 127.0.0.1.39402 > 127.0.0.1.50007: UDP, length 2
16:01:56.034356 IP 127.0.0.1.39402 > 127.0.0.1.50007: UDP, length 1
16:01:56.210149 IP 127.0.0.1.39402 > 127.0.0.1.50007: UDP, length 3
16:01:56.394213 IP 127.0.0.1.39402 > 127.0.0.1.50007: UDP, length 2
16:01:56.594050 IP 127.0.0.1.39402 > 127.0.0.1.50007: UDP, length 1
16:01:56.762077 IP 127.0.0.1.39402 > 127.0.0.1.50007: UDP, length 2
16:01:57.122223 IP 127.0.0.1.39402 > 127.0.0.1.50007: UDP, length 3
16:01:57.314222 IP 127.0.0.1.39402 > 127.0.0.1.50007: UDP, length 1
16:01:57.770268 IP 127.0.0.1.39402 > 127.0.0.1.50007: UDP, length 5
16:01:57.970215 IP 127.0.0.1.39402 > 127.0.0.1.50007: UDP, length 1
16:01:58.186143 IP 127.0.0.1.39402 > 127.0.0.1.50007: UDP, length 2
16:01:58.370171 IP 127.0.0.1.39402 > 127.0.0.1.50007: UDP, length 2
16:01:58.530200 IP 127.0.0.1.39402 > 127.0.0.1.50007: UDP, length 1
16:01:58.714016 IP 127.0.0.1.39402 > 127.0.0.1.50007: UDP, length 2
16:01:58.890205 IP 127.0.0.1.39402 > 127.0.0.1.50007: UDP, length 1
16:01:59.066219 IP 127.0.0.1.39402 > 127.0.0.1.50007: UDP, length 2
16:01:59.226195 IP 127.0.0.1.39402 > 127.0.0.1.50007: UDP, length 1
16:01:59.402253 IP 127.0.0.1.39402 > 127.0.0.1.50007: UDP, length 2
16:01:59.578062 IP 127.0.0.1.39402 > 127.0.0.1.50007: UDP, length 1
16:01:59.754121 IP 127.0.0.1.39402 > 127.0.0.1.50007: UDP, length 3
16:01:59.906250 IP 127.0.0.1.39402 > 127.0.0.1.50007: UDP, length 0
16:02:00.082114 IP 127.0.0.1.39402 > 127.0.0.1.50007: UDP, length 3
16:02:00.242361 IP 127.0.0.1.39402 > 127.0.0.1.50007: UDP, length 0
16:02:00.426099 IP 127.0.0.1.39402 > 127.0.0.1.50007: UDP, length 3
16:02:00.594161 IP 127.0.0.1.39402 > 127.0.0.1.50007: UDP, length 1
16:02:00.778302 IP 127.0.0.1.39402 > 127.0.0.1.50007: UDP, length 2
16:02:00.954206 IP 127.0.0.1.39402 > 127.0.0.1.50007: UDP, length 2
16:02:01.138227 IP 127.0.0.1.39402 > 127.0.0.1.50007: UDP, length 1
16:02:01.314206 IP 127.0.0.1.39402 > 127.0.0.1.50007: UDP, length 2
16:02:01.482160 IP 127.0.0.1.39402 > 127.0.0.1.50007: UDP, length 1
16:02:01.642585 IP 127.0.0.1.39402 > 127.0.0.1.50007: UDP, length 2
16:02:01.818079 IP 127.0.0.1.39402 > 127.0.0.1.50007: UDP, length 1
16:02:01.970265 IP 127.0.0.1.39402 > 127.0.0.1.50007: UDP, length 2
16:02:02.146109 IP 127.0.0.1.39402 > 127.0.0.1.50007: UDP, length 1
16:02:02.305944 IP 127.0.0.1.39402 > 127.0.0.1.50007: UDP, length 2
16:02:02.482200 IP 127.0.0.1.39402 > 127.0.0.1.50007: UDP, length 1
16:02:02.641937 IP 127.0.0.1.39402 > 127.0.0.1.50007: UDP, length 2
16:02:12.194716 IP 127.0.0.1.45468 > 127.0.0.1.50007: UDP, length 5
16:02:12.714336 IP 127.0.0.1.45468 > 127.0.0.1.50007: UDP, length 5
16:02:13.225954 IP 127.0.0.1.45468 > 127.0.0.1.50007: UDP, length 5
16:02:13.874100 IP 127.0.0.1.45468 > 127.0.0.1.50007: UDP, length 5
16:02:15.474226 IP 127.0.0.1.45468 > 127.0.0.1.50007: UDP, length 6
16:03:28.418435 IP 127.0.0.1.45468 > 127.0.0.1.50007: UDP, length 3
16:03:28.874162 IP 127.0.0.1.45468 > 127.0.0.1.50007: UDP, length 3
16:03:29.258287 IP 127.0.0.1.45468 > 127.0.0.1.50007: UDP, length 2
16:03:29.842306 IP 127.0.0.1.45468 > 127.0.0.1.50007: UDP, length 3
16:03:30.314056 IP 127.0.0.1.45468 > 127.0.0.1.50007: UDP, length 3
16:03:30.850199 IP 127.0.0.1.45468 > 127.0.0.1.50007: UDP, length 4
16:03:31.410263 IP 127.0.0.1.45468 > 127.0.0.1.50007: UDP, length 3
16:03:31.842255 IP 127.0.0.1.45468 > 127.0.0.1.50007: UDP, length 3
16:03:32.088973 IP 127.0.0.1.48499 > 127.0.0.1.8010: tcp 0
16:03:32.089155 IP 127.0.0.1.8010 > 127.0.0.1.48499: tcp 0
16:03:32.089174 IP 127.0.0.1.48499 > 127.0.0.1.8010: tcp 0
16:03:33.362042 IP 127.0.0.1.45468 > 127.0.0.1.50007: UDP, length 4
