04:35:08.469153 STP 802.1d, Config, Flags [none], bridge-id 8016.00:12:43:31:26:80.8006, length 43
04:35:08.521787 IP6 fe80::20e6:e6d3:da56:b65e > ff02::1:fff9:fc1f: ICMP6, neighbor solicitation, who has fe80::b506:5cbc:41f9:fc1f, length 32
04:35:08.521884 IP6 fe80::20e6:e6d3:da56:b65e > ff02::1:ffdc:bdb7: ICMP6, neighbor solicitation, who has fe80::201a:13ee:f3dc:bdb7, length 32
04:35:08.544774 IP 172.16.82.165.1534 > 172.16.83.255.1534: UDP, length 8
04:35:08.825331 IP6 fe80::d953:461d:f6dc:1216.546 > ff02::1:2.547: UDP, length 89
04:35:09.206784 IP6 fe80::c90:c7be:26d7:5b29.61291 > ff02::c.1900: UDP, length 146
04:35:09.209068 IP6 fe80::c90:c7be:26d7:5b29 > ff02::1:ffdc:bdb7: ICMP6, neighbor solicitation, who has fe80::201a:13ee:f3dc:bdb7, length 32
04:35:09.750259 IP6 fe80::bc77:dac7:4a38:eb7d.546 > ff02::1:2.547: UDP, length 89
04:35:09.788427 IP6 fe80::7c0f:d71b:3b7f:93e9.546 > ff02::1:2.547: UDP, length 88
04:35:09.815068 IP6 fe80::20e6:e6d3:da56:b65e.63223 > ff02::c.1900: UDP, length 146
04:35:10.068820 IP6 fe80::c90:c7be:26d7:5b29 > ff02::1:ffdc:bdb7: ICMP6, neighbor solicitation, who has fe80::201a:13ee:f3dc:bdb7, length 32
04:35:10.469283 STP 802.1d, Config, Flags [none], bridge-id 8016.00:12:43:31:26:80.8006, length 43
04:35:10.539737 
04:35:10.699641 IP 172.16.82.190.5353 > 224.0.0.251.5353: UDP, length 39
04:35:11.068592 IP6 fe80::c90:c7be:26d7:5b29 > ff02::1:ffdc:bdb7: ICMP6, neighbor solicitation, who has fe80::201a:13ee:f3dc:bdb7, length 32
04:35:12.206505 IP6 fe80::c90:c7be:26d7:5b29.61291 > ff02::c.1900: UDP, length 146
04:35:12.469427 STP 802.1d, Config, Flags [none], bridge-id 8016.00:12:43:31:26:80.8006, length 43
04:35:12.815295 IP6 fe80::20e6:e6d3:da56:b65e.63223 > ff02::c.1900: UDP, length 146
04:35:13.788747 IP6 fe80::7c0f:d71b:3b7f:93e9.546 > ff02::1:2.547: UDP, length 88
04:35:13.906460 IP 172.16.82.20.49151 > 199.47.218.160.443: tcp 245
04:35:13.906655 IP 199.47.218.160.443 > 172.16.82.20.49151: tcp 0
04:35:13.908825 IP 172.16.82.20.44224 > 172.16.68.12.53: UDP, length 39
04:35:13.909639 IP 172.16.68.12.53 > 172.16.82.20.44224: UDP, length 226
04:35:13.913016 IP 172.16.82.20.36496 > 199.47.219.160.443: tcp 0
04:35:13.913190 IP 199.47.219.160.443 > 172.16.82.20.36496: tcp 0
04:35:13.913222 IP 172.16.82.20.36496 > 199.47.219.160.443: tcp 0
04:35:13.916547 IP 172.16.82.20.36496 > 199.47.219.160.443: tcp 96
04:35:13.916687 IP 199.47.219.160.443 > 172.16.82.20.36496: tcp 0
04:35:14.083631 IP 172.16.82.239.138 > 172.16.83.255.138: UDP, length 201
04:35:14.469509 STP 802.1d, Config, Flags [none], bridge-id 8016.00:12:43:31:26:80.8006, length 43
04:35:14.904889 IP 172.16.82.20.59607 > 213.146.189.236.20241: tcp 0
04:35:14.905202 IP 172.16.82.20.39784 > 213.146.189.235.33211: tcp 0
04:35:14.905467 IP 172.16.82.20.45545 > 149.13.32.250.54499: tcp 0
04:35:14.911200 IP 172.16.82.20.40346 > 111.221.74.30.443: tcp 4
04:35:14.911344 IP 111.221.74.30.443 > 172.16.82.20.40346: tcp 0
04:35:14.911360 IP 172.16.82.20.40346 > 111.221.74.30.443: tcp 168
04:35:14.911535 IP 111.221.74.30.443 > 172.16.82.20.40346: tcp 0
04:35:15.157015 IP 111.221.74.30.443 > 172.16.82.20.40346: tcp 4
04:35:15.157039 IP 172.16.82.20.40346 > 111.221.74.30.443: tcp 0
04:35:15.157552 IP 111.221.74.30.443 > 172.16.82.20.40346: tcp 1412
04:35:15.157557 IP 172.16.82.20.40346 > 111.221.74.30.443: tcp 0
04:35:15.206583 IP6 fe80::c90:c7be:26d7:5b29.61291 > ff02::c.1900: UDP, length 146
04:35:15.248878 IP 111.221.74.30.443 > 172.16.82.20.40346: tcp 248
04:35:15.248898 IP 172.16.82.20.40346 > 111.221.74.30.443: tcp 0
04:35:15.353938 IP 172.16.82.20.40346 > 111.221.74.30.443: tcp 3
04:35:15.354095 IP 111.221.74.30.443 > 172.16.82.20.40346: tcp 0
04:35:15.354117 IP 172.16.82.20.40346 > 111.221.74.30.443: tcp 57
04:35:15.354331 IP 111.221.74.30.443 > 172.16.82.20.40346: tcp 0
04:35:15.377814 IP 111.221.74.30.443 > 172.16.82.20.40346: tcp 4
04:35:15.377835 IP 172.16.82.20.40346 > 111.221.74.30.443: tcp 0
04:35:15.378325 IP 111.221.74.30.443 > 172.16.82.20.40346: tcp 1412
04:35:15.378336 IP 172.16.82.20.40346 > 111.221.74.30.443: tcp 0
04:35:15.393159 IP 111.221.74.30.443 > 172.16.82.20.40346: tcp 1412
04:35:15.393182 IP 172.16.82.20.40346 > 111.221.74.30.443: tcp 0
04:35:15.470487 IP 111.221.74.30.443 > 172.16.82.20.40346: tcp 500
04:35:15.470512 IP 172.16.82.20.40346 > 111.221.74.30.443: tcp 0
04:35:15.555588 IP 199.47.219.160.443 > 172.16.82.20.36496: tcp 1412
04:35:15.555613 IP 172.16.82.20.36496 > 199.47.219.160.443: tcp 0
04:35:15.555769 IP 199.47.219.160.443 > 172.16.82.20.36496: tcp 1460
04:35:15.555780 IP 172.16.82.20.36496 > 199.47.219.160.443: tcp 0
04:35:15.555959 IP 199.47.219.160.443 > 172.16.82.20.36496: tcp 960
04:35:15.555968 IP 172.16.82.20.36496 > 199.47.219.160.443: tcp 0
04:35:15.594318 IP 172.16.82.20.36496 > 199.47.219.160.443: tcp 198
04:35:15.594493 IP 199.47.219.160.443 > 172.16.82.20.36496: tcp 0
04:35:15.827382 IP 111.221.74.30.443 > 172.16.82.20.40346: tcp 3
04:35:15.827413 IP 172.16.82.20.40346 > 111.221.74.30.443: tcp 0
04:35:15.924690 IP 199.47.219.160.443 > 172.16.82.20.36496: tcp 234
04:35:15.924724 IP 172.16.82.20.36496 > 199.47.219.160.443: tcp 0
04:35:15.926328 IP 172.16.82.20.36496 > 199.47.219.160.443: tcp 245
04:35:15.926502 IP 199.47.219.160.443 > 172.16.82.20.36496: tcp 0
04:35:15.926523 IP 172.16.82.20.36496 > 199.47.219.160.443: tcp 437
04:35:15.926749 IP 199.47.219.160.443 > 172.16.82.20.36496: tcp 0
04:35:15.957217 IP 111.221.74.30.443 > 172.16.82.20.40346: tcp 9
04:35:15.957243 IP 172.16.82.20.40346 > 111.221.74.30.443: tcp 0
04:35:15.992729 IP 172.16.82.20.50793 > 58.27.86.51.443: tcp 0
04:35:15.993109 IP 58.27.86.51.443 > 172.16.82.20.50793: tcp 0
04:35:15.993132 IP 172.16.82.20.50793 > 58.27.86.51.443: tcp 0
04:35:15.993176 IP 172.16.82.20.45940 > 210.212.26.8.443: tcp 0
04:35:15.993406 IP 210.212.26.8.443 > 172.16.82.20.45940: tcp 0
04:35:15.993419 IP 172.16.82.20.45940 > 210.212.26.8.443: tcp 0
04:35:15.993461 IP 172.16.82.20.45938 > 210.212.26.8.443: tcp 0
04:35:15.993691 IP 210.212.26.8.443 > 172.16.82.20.45938: tcp 0
04:35:15.993703 IP 172.16.82.20.45938 > 210.212.26.8.443: tcp 0
04:35:15.993892 IP 172.16.82.20.45939 > 210.212.26.8.443: tcp 0
04:35:15.994052 IP 210.212.26.8.443 > 172.16.82.20.45939: tcp 0
04:35:15.994064 IP 172.16.82.20.45939 > 210.212.26.8.443: tcp 0
04:35:15.994169 IP 172.16.82.20.45942 > 210.212.26.8.443: tcp 0
04:35:15.994342 IP 210.212.26.8.443 > 172.16.82.20.45942: tcp 0
04:35:15.994353 IP 172.16.82.20.45942 > 210.212.26.8.443: tcp 0
04:35:15.994436 IP 172.16.82.20.45943 > 210.212.26.8.443: tcp 0
04:35:15.994577 IP 210.212.26.8.443 > 172.16.82.20.45943: tcp 0
04:35:15.994588 IP 172.16.82.20.45943 > 210.212.26.8.443: tcp 0
04:35:15.995295 IP 172.16.82.20.44263 > 203.106.85.19.443: tcp 0
04:35:15.995441 IP 203.106.85.19.443 > 172.16.82.20.44263: tcp 0
04:35:15.995454 IP 172.16.82.20.44263 > 203.106.85.19.443: tcp 0
04:35:15.995568 IP 172.16.82.20.37939 > 184.26.205.177.443: tcp 0
04:35:15.995745 IP 184.26.205.177.443 > 172.16.82.20.37939: tcp 0
04:35:15.995759 IP 172.16.82.20.37939 > 184.26.205.177.443: tcp 0
04:35:16.143601 IP 199.47.218.147.80 > 172.16.82.20.45481: tcp 179
04:35:16.143632 IP 172.16.82.20.45481 > 199.47.218.147.80: tcp 0
04:35:16.145453 IP 172.16.82.20.45481 > 199.47.218.147.80: tcp 418
04:35:16.145840 IP 199.47.218.147.80 > 172.16.82.20.45481: tcp 0
04:35:16.179595 IP6 fe80::3978:b61b:56ab:d7ed.546 > ff02::1:2.547: UDP, length 89
04:35:16.475170 STP 802.1d, Config, Flags [none], bridge-id 8016.00:12:43:31:26:80.8006, length 43
04:35:16.660078 IP 172.16.82.20.56960 > 239.255.255.250.1900: UDP, length 133
04:35:16.660129 IP 172.16.82.20.56960 > 239.255.255.250.1900: UDP, length 132
04:35:16.660175 IP 172.16.82.20.39238 > 239.255.255.250.1900: UDP, length 133
04:35:16.660206 IP 172.16.82.20.39238 > 239.255.255.250.1900: UDP, length 132
04:35:16.660472 IP 172.16.82.20.38486 > 172.16.83.254.5351: UDP, length 12
04:35:16.735528 IP 199.47.219.160.443 > 172.16.82.20.36496: tcp 581
04:35:16.772861 IP 172.16.82.20.36496 > 199.47.219.160.443: tcp 0
04:35:16.816751 IP6 fe80::20e6:e6d3:da56:b65e.63223 > ff02::c.1900: UDP, length 146
04:35:16.818157 IP6 fe80::20e6:e6d3:da56:b65e > ff02::1:fff9:fc1f: ICMP6, neighbor solicitation, who has fe80::b506:5cbc:41f9:fc1f, length 32
04:35:16.818496 IP6 fe80::20e6:e6d3:da56:b65e > ff02::1:ffdc:bdb7: ICMP6, neighbor solicitation, who has fe80::201a:13ee:f3dc:bdb7, length 32
04:35:16.842879 IP 199.47.218.147.80 > 172.16.82.20.45481: tcp 178
04:35:16.848759 IP 172.16.82.20.36496 > 199.47.219.160.443: tcp 245
04:35:16.848939 IP 199.47.219.160.443 > 172.16.82.20.36496: tcp 0
04:35:16.848961 IP 172.16.82.20.36496 > 199.47.219.160.443: tcp 117
04:35:16.849134 IP 199.47.219.160.443 > 172.16.82.20.36496: tcp 0
04:35:16.850172 IP 172.16.82.20.57234 > 199.47.219.159.443: tcp 229
04:35:16.850335 IP 199.47.219.159.443 > 172.16.82.20.57234: tcp 0
04:35:16.853028 IP 172.16.82.20.54064 > 172.16.68.12.53: UDP, length 39
04:35:16.853966 IP 172.16.68.12.53 > 172.16.82.20.54064: UDP, length 226
04:35:16.853980 ARP, Request who-has 172.16.82.20 tell 172.16.82.119, length 46
04:35:16.853988 ARP, Reply 172.16.82.20 is-at 00:25:64:da:85:e5, length 28
04:35:16.854213 IP 172.16.82.20.52100 > 199.47.216.172.443: tcp 0
04:35:16.854347 IP 172.16.82.119.1900 > 172.16.82.20.39238: UDP, length 456
04:35:16.854359 IP 199.47.216.172.443 > 172.16.82.20.52100: tcp 0
04:35:16.854382 IP 172.16.82.20.52100 > 199.47.216.172.443: tcp 0
04:35:16.855714 IP 172.16.82.20.52100 > 199.47.216.172.443: tcp 96
04:35:16.855876 IP 199.47.216.172.443 > 172.16.82.20.52100: tcp 0
04:35:16.880853 IP 172.16.82.20.45481 > 199.47.218.147.80: tcp 0
04:35:16.954868 IP 172.16.82.20.38486 > 172.16.83.254.5351: UDP, length 12
04:35:16.978207 IP 172.16.82.20.34820 > 172.16.68.12.53: UDP, length 34
04:35:16.979125 IP 172.16.68.12.53 > 172.16.82.20.34820: UDP, length 120
04:35:17.060242 IP 172.16.82.20.39763 > 172.16.68.12.53: UDP, length 44
04:35:17.060465 IP 172.16.82.20.42095 > 172.16.68.12.53: UDP, length 29
04:35:17.061769 IP 172.16.68.12.53 > 172.16.82.20.42095: UDP, length 45
04:35:17.061993 IP 172.16.82.20.53133 > 172.16.68.12.53: UDP, length 35
04:35:17.062143 IP 172.16.82.20.34486 > 172.16.68.12.53: UDP, length 40
04:35:17.062266 IP 172.16.82.20.35563 > 172.16.68.12.53: UDP, length 62
04:35:17.062638 IP 172.16.82.20.58598 > 69.46.36.6.80: tcp 0
04:35:17.062730 IP 172.16.82.20.58599 > 69.46.36.6.80: tcp 0
04:35:17.062809 IP 172.16.82.20.58600 > 69.46.36.6.80: tcp 0
04:35:17.062867 IP 69.46.36.6.80 > 172.16.82.20.58599: tcp 0
04:35:17.062895 IP 172.16.82.20.58599 > 69.46.36.6.80: tcp 0
04:35:17.062965 IP 69.46.36.6.80 > 172.16.82.20.58598: tcp 0
04:35:17.062979 IP 172.16.82.20.58598 > 69.46.36.6.80: tcp 0
04:35:17.063065 IP 69.46.36.6.80 > 172.16.82.20.58600: tcp 0
04:35:17.063078 IP 172.16.82.20.58600 > 69.46.36.6.80: tcp 0
04:35:17.063515 IP 172.16.68.12.53 > 172.16.82.20.53133: UDP, length 82
04:35:17.063770 IP 172.16.82.20.53666 > 172.16.68.12.53: UDP, length 33
04:35:17.063956 IP 172.16.68.12.53 > 172.16.82.20.35563: UDP, length 139
04:35:17.064032 IP 172.16.82.20.39116 > 209.85.175.191.80: tcp 0
04:35:17.064104 IP 172.16.82.20.39117 > 209.85.175.191.80: tcp 0
04:35:17.064167 IP 172.16.82.20.39118 > 209.85.175.191.80: tcp 0
04:35:17.064210 IP 209.85.175.191.80 > 172.16.82.20.39116: tcp 0
04:35:17.064234 IP 172.16.82.20.39116 > 209.85.175.191.80: tcp 0
04:35:17.064265 IP 172.16.82.20.36501 > 74.125.236.106.80: tcp 0
04:35:17.064306 IP 209.85.175.191.80 > 172.16.82.20.39118: tcp 0
04:35:17.064319 IP 172.16.82.20.39118 > 209.85.175.191.80: tcp 0
04:35:17.064327 IP 172.16.82.20.36502 > 74.125.236.106.80: tcp 0
04:35:17.064363 IP 209.85.175.191.80 > 172.16.82.20.39117: tcp 0
04:35:17.064375 IP 172.16.82.20.39117 > 209.85.175.191.80: tcp 0
04:35:17.064387 IP 172.16.82.20.36503 > 74.125.236.106.80: tcp 0
04:35:17.064459 IP 74.125.236.106.80 > 172.16.82.20.36502: tcp 0
04:35:17.064476 IP 172.16.82.20.36502 > 74.125.236.106.80: tcp 0
04:35:17.064515 IP 74.125.236.106.80 > 172.16.82.20.36501: tcp 0
04:35:17.064527 IP 172.16.82.20.36501 > 74.125.236.106.80: tcp 0
04:35:17.064662 IP 74.125.236.106.80 > 172.16.82.20.36503: tcp 0
04:35:17.064678 IP 172.16.82.20.36503 > 74.125.236.106.80: tcp 0
04:35:17.064770 IP 172.16.82.20.59533 > 172.16.68.12.53: UDP, length 34
04:35:17.065513 IP 172.16.68.12.53 > 172.16.82.20.59533: UDP, length 50
04:35:17.065818 IP 172.16.82.20.43041 > 172.16.68.12.53: UDP, length 32
04:35:17.066000 IP 172.16.82.20.42925 > 69.171.224.53.80: tcp 0
04:35:17.066096 IP 172.16.82.20.42926 > 69.171.224.53.80: tcp 0
04:35:17.066158 IP 69.171.224.53.80 > 172.16.82.20.42925: tcp 0
04:35:17.066183 IP 172.16.82.20.42925 > 69.171.224.53.80: tcp 0
04:35:17.066243 IP 172.16.82.20.42927 > 69.171.224.53.80: tcp 0
04:35:17.066331 IP 172.16.82.20.46538 > 69.171.224.53.443: tcp 0
04:35:17.066373 IP 69.171.224.53.80 > 172.16.82.20.42927: tcp 0
04:35:17.066387 IP 172.16.82.20.42927 > 69.171.224.53.80: tcp 0
04:35:17.066392 IP 69.171.224.53.80 > 172.16.82.20.42926: tcp 0
04:35:17.066405 IP 172.16.82.20.42926 > 69.171.224.53.80: tcp 0
04:35:17.066494 IP 172.16.82.20.46539 > 69.171.224.53.443: tcp 0
04:35:17.066507 IP 69.171.224.53.443 > 172.16.82.20.46538: tcp 0
04:35:17.066517 IP 172.16.82.20.46538 > 69.171.224.53.443: tcp 0
04:35:17.066596 IP 172.16.68.12.53 > 172.16.82.20.43041: UDP, length 132
04:35:17.066653 IP 69.171.224.53.443 > 172.16.82.20.46539: tcp 0
04:35:17.066666 IP 172.16.82.20.46539 > 69.171.224.53.443: tcp 0
04:35:17.066935 IP 172.16.82.20.48932 > 172.16.68.12.53: UDP, length 42
04:35:17.066985 IP 172.16.82.20.46540 > 69.171.224.53.443: tcp 0
04:35:17.067120 IP 172.16.82.20.38710 > 74.125.236.113.80: tcp 0
04:35:17.067154 IP 69.171.224.53.443 > 172.16.82.20.46540: tcp 0
04:35:17.067170 IP 172.16.82.20.46540 > 69.171.224.53.443: tcp 0
04:35:17.067252 IP 172.16.82.20.38711 > 74.125.236.113.80: tcp 0
04:35:17.067337 IP 172.16.82.20.38712 > 74.125.236.113.80: tcp 0
04:35:17.067360 IP 74.125.236.113.80 > 172.16.82.20.38710: tcp 0
04:35:17.067374 IP 172.16.82.20.38710 > 74.125.236.113.80: tcp 0
04:35:17.067403 IP 74.125.236.113.80 > 172.16.82.20.38711: tcp 0
04:35:17.067414 IP 172.16.82.20.38711 > 74.125.236.113.80: tcp 0
04:35:17.067505 IP 172.16.82.20.38713 > 74.125.236.113.80: tcp 0
04:35:17.067609 IP 74.125.236.113.80 > 172.16.82.20.38712: tcp 0
04:35:17.067626 IP 172.16.82.20.38712 > 74.125.236.113.80: tcp 0
04:35:17.067652 IP 74.125.236.113.80 > 172.16.82.20.38713: tcp 0
04:35:17.067660 IP 172.16.82.20.38713 > 74.125.236.113.80: tcp 0
04:35:17.067693 IP 172.16.68.12.53 > 172.16.82.20.48932: UDP, length 141
04:35:17.069471 IP 172.16.82.20.47774 > 184.26.194.110.443: tcp 0
04:35:17.069541 IP 172.16.82.20.47775 > 184.26.194.110.443: tcp 0
04:35:17.069586 IP 172.16.82.20.47776 > 184.26.194.110.443: tcp 0
04:35:17.069652 IP 184.26.194.110.443 > 172.16.82.20.47774: tcp 0
04:35:17.069671 IP 172.16.82.20.47774 > 184.26.194.110.443: tcp 0
04:35:17.069688 IP 184.26.194.110.443 > 172.16.82.20.47775: tcp 0
04:35:17.069693 IP 172.16.82.20.47775 > 184.26.194.110.443: tcp 0
04:35:17.069729 IP 184.26.194.110.443 > 172.16.82.20.47776: tcp 0
04:35:17.069736 IP 172.16.82.20.47776 > 184.26.194.110.443: tcp 0
04:35:17.071018 IP 172.16.82.20.46538 > 69.171.224.53.443: tcp 188
04:35:17.071180 IP 69.171.224.53.443 > 172.16.82.20.46538: tcp 0
04:35:17.071241 IP 172.16.82.20.46539 > 69.171.224.53.443: tcp 188
04:35:17.071405 IP 172.16.82.20.46540 > 69.171.224.53.443: tcp 188
04:35:17.071421 IP 69.171.224.53.443 > 172.16.82.20.46539: tcp 0
04:35:17.071571 IP 69.171.224.53.443 > 172.16.82.20.46540: tcp 0
04:35:17.071611 IP 172.16.82.20.47774 > 184.26.194.110.443: tcp 196
04:35:17.071775 IP 184.26.194.110.443 > 172.16.82.20.47774: tcp 0
04:35:17.072544 IP 172.16.82.20.47775 > 184.26.194.110.443: tcp 196
04:35:17.072723 IP 184.26.194.110.443 > 172.16.82.20.47775: tcp 0
04:35:17.072791 IP 172.16.82.20.47776 > 184.26.194.110.443: tcp 196
04:35:17.072970 IP 184.26.194.110.443 > 172.16.82.20.47776: tcp 0
04:35:17.073432 IP 172.16.82.20.38710 > 74.125.236.113.80: tcp 1314
04:35:17.073964 IP 74.125.236.113.80 > 172.16.82.20.38710: tcp 0
04:35:17.097649 IP 172.16.68.12.53 > 172.16.82.20.34486: UDP, length 150
04:35:17.097916 IP 172.16.82.20.41503 > 58.27.22.162.80: tcp 0
04:35:17.097980 IP 172.16.82.20.41504 > 58.27.22.162.80: tcp 0
04:35:17.098035 IP 172.16.82.20.41505 > 58.27.22.162.80: tcp 0
04:35:17.098155 IP 58.27.22.162.80 > 172.16.82.20.41504: tcp 0
04:35:17.098178 IP 172.16.82.20.41504 > 58.27.22.162.80: tcp 0
04:35:17.098196 IP 58.27.22.162.80 > 172.16.82.20.41503: tcp 0
04:35:17.098201 IP 172.16.82.20.41503 > 58.27.22.162.80: tcp 0
04:35:17.098306 IP 58.27.22.162.80 > 172.16.82.20.41505: tcp 0
04:35:17.098315 IP 172.16.82.20.41505 > 58.27.22.162.80: tcp 0
04:35:17.152495 IP 172.16.68.12.53 > 172.16.82.20.39763: UDP, length 127
04:35:17.152810 IP 172.16.82.20.44470 > 173.194.36.11.80: tcp 0
04:35:17.152940 IP 172.16.82.20.44471 > 173.194.36.11.80: tcp 0
04:35:17.152985 IP 173.194.36.11.80 > 172.16.82.20.44470: tcp 0
04:35:17.153013 IP 172.16.82.20.44470 > 173.194.36.11.80: tcp 0
04:35:17.153020 IP 172.16.82.20.44472 > 173.194.36.11.80: tcp 0
04:35:17.153082 IP 172.16.82.20.44473 > 173.194.36.11.80: tcp 0
04:35:17.153142 IP 172.16.82.20.44474 > 173.194.36.11.80: tcp 0
04:35:17.153193 IP 173.194.36.11.80 > 172.16.82.20.44472: tcp 0
04:35:17.153205 IP 172.16.82.20.44472 > 173.194.36.11.80: tcp 0
04:35:17.153265 IP 173.194.36.11.80 > 172.16.82.20.44474: tcp 0
04:35:17.153274 IP 172.16.82.20.44474 > 173.194.36.11.80: tcp 0
04:35:17.153279 IP 173.194.36.11.80 > 172.16.82.20.44471: tcp 0
04:35:17.153285 IP 172.16.82.20.44471 > 173.194.36.11.80: tcp 0
04:35:17.153318 IP 173.194.36.11.80 > 172.16.82.20.44473: tcp 0
04:35:17.153330 IP 172.16.82.20.44473 > 173.194.36.11.80: tcp 0
04:35:17.153441 IP 172.16.82.20.44470 > 173.194.36.11.80: tcp 904
04:35:17.153753 IP 173.194.36.11.80 > 172.16.82.20.44470: tcp 0
04:35:17.161024 IP 172.16.68.12.53 > 172.16.82.20.53666: UDP, length 80
04:35:17.161263 IP 172.16.82.20.39143 > 209.85.175.191.80: tcp 0
04:35:17.161333 IP 172.16.82.20.39144 > 209.85.175.191.80: tcp 0
04:35:17.161395 IP 172.16.82.20.39145 > 209.85.175.191.80: tcp 0
04:35:17.161477 IP 172.16.82.20.39146 > 209.85.175.191.80: tcp 0
04:35:17.161511 IP 209.85.175.191.80 > 172.16.82.20.39144: tcp 0
04:35:17.161532 IP 172.16.82.20.39144 > 209.85.175.191.80: tcp 0
04:35:17.161552 IP 209.85.175.191.80 > 172.16.82.20.39143: tcp 0
04:35:17.161554 IP 172.16.82.20.39147 > 209.85.175.191.80: tcp 0
04:35:17.161560 IP 172.16.82.20.39143 > 209.85.175.191.80: tcp 0
04:35:17.161608 IP 209.85.175.191.80 > 172.16.82.20.39146: tcp 0
04:35:17.161614 IP 172.16.82.20.39148 > 209.85.175.191.80: tcp 0
04:35:17.161618 IP 172.16.82.20.39146 > 209.85.175.191.80: tcp 0
04:35:17.161688 IP 209.85.175.191.80 > 172.16.82.20.39145: tcp 0
04:35:17.161701 IP 172.16.82.20.39145 > 209.85.175.191.80: tcp 0
04:35:17.161760 IP 209.85.175.191.80 > 172.16.82.20.39148: tcp 0
04:35:17.161769 IP 172.16.82.20.39148 > 209.85.175.191.80: tcp 0
04:35:17.161805 IP 209.85.175.191.80 > 172.16.82.20.39147: tcp 0
04:35:17.161814 IP 172.16.82.20.39147 > 209.85.175.191.80: tcp 0
04:35:17.347224 IP 74.125.236.113.80 > 172.16.82.20.38710: tcp 215
04:35:17.347250 IP 172.16.82.20.38710 > 74.125.236.113.80: tcp 0
04:35:17.455740 IP 172.16.82.20.38486 > 172.16.83.254.5351: UDP, length 12
04:35:17.455991 IP 172.16.83.254 > 172.16.82.20: ICMP host 172.16.83.254 unreachable - admin prohibited filter, length 36
04:35:17.521407 IP6 fe80::20e6:e6d3:da56:b65e > ff02::1:fff9:fc1f: ICMP6, neighbor solicitation, who has fe80::b506:5cbc:41f9:fc1f, length 32
04:35:17.521502 IP6 fe80::20e6:e6d3:da56:b65e > ff02::1:ffdc:bdb7: ICMP6, neighbor solicitation, who has fe80::201a:13ee:f3dc:bdb7, length 32
04:35:17.529599 IP 199.47.219.160.443 > 172.16.82.20.36496: tcp 373
04:35:17.529630 IP 172.16.82.20.36496 > 199.47.219.160.443: tcp 0
04:35:17.560351 IP 111.221.74.30.443 > 172.16.82.20.40346: tcp 3
04:35:17.560376 IP 172.16.82.20.40346 > 111.221.74.30.443: tcp 0
04:35:17.652076 IP 111.221.74.30.443 > 172.16.82.20.40346: tcp 10
04:35:17.652102 IP 172.16.82.20.40346 > 111.221.74.30.443: tcp 0
04:35:17.652251 IP 172.16.82.20.40346 > 111.221.74.30.443: tcp 4
04:35:17.689749 IP 111.221.74.30.443 > 172.16.82.20.40346: tcp 0
04:35:17.815301 IP 172.16.82.119.1900 > 172.16.82.20.56960: UDP, length 456
04:35:17.908865 IP 172.16.82.20.59607 > 213.146.189.236.20241: tcp 0
04:35:17.908886 IP 172.16.82.20.39784 > 213.146.189.235.33211: tcp 0
04:35:17.908893 IP 172.16.82.20.45545 > 149.13.32.250.54499: tcp 0
04:35:18.003026 IP 172.16.82.20.40816 > 172.16.68.12.53: UDP, length 37
04:35:18.003893 IP 172.16.68.12.53 > 172.16.82.20.40816: UDP, length 237
04:35:18.004286 IP 172.16.82.20.49668 > 74.125.236.99.443: tcp 0
04:35:18.004468 IP 74.125.236.99.443 > 172.16.82.20.49668: tcp 0
04:35:18.004490 IP 172.16.82.20.49668 > 74.125.236.99.443: tcp 0
04:35:18.004791 IP 172.16.82.20.49668 > 74.125.236.99.443: tcp 403
04:35:18.004991 IP 74.125.236.99.443 > 172.16.82.20.49668: tcp 0
04:35:18.125592 IP 172.16.82.20.36189 > 172.16.68.12.53: UDP, length 35
04:35:18.125815 IP 184.26.194.110.443 > 172.16.82.20.47775: tcp 1412
04:35:18.125838 IP 172.16.82.20.47775 > 184.26.194.110.443: tcp 0
04:35:18.126069 IP 184.26.194.110.443 > 172.16.82.20.47775: tcp 409
04:35:18.126082 IP 172.16.82.20.47775 > 184.26.194.110.443: tcp 0
04:35:18.126161 IP 172.16.82.20.49506 > 172.16.68.12.53: UDP, length 35
04:35:18.126382 IP 172.16.82.20.46099 > 172.16.68.12.53: UDP, length 47
04:35:18.127804 IP 172.16.68.12.53 > 172.16.82.20.49506: UDP, length 67
04:35:18.127930 IP 172.16.68.12.53 > 172.16.82.20.46099: UDP, length 133
04:35:18.128525 IP 172.16.82.20.50989 > 67.215.253.139.80: tcp 0
04:35:18.128625 IP 172.16.82.20.50990 > 67.215.253.139.80: tcp 0
04:35:18.128707 IP 67.215.253.139.80 > 172.16.82.20.50989: tcp 0
04:35:18.128732 IP 172.16.82.20.50989 > 67.215.253.139.80: tcp 0
04:35:18.128804 IP 172.16.82.20.44814 > 74.125.236.109.80: tcp 0
04:35:18.128905 IP 172.16.82.20.44815 > 74.125.236.109.80: tcp 0
04:35:18.128947 IP 74.125.236.109.80 > 172.16.82.20.44814: tcp 0
04:35:18.128964 IP 172.16.82.20.44814 > 74.125.236.109.80: tcp 0
04:35:18.128969 IP 67.215.253.139.80 > 172.16.82.20.50990: tcp 0
04:35:18.128977 IP 172.16.82.20.50990 > 67.215.253.139.80: tcp 0
04:35:18.129183 IP 74.125.236.109.80 > 172.16.82.20.44815: tcp 0
04:35:18.129198 IP 172.16.82.20.44815 > 74.125.236.109.80: tcp 0
04:35:18.133425 IP 184.26.194.110.443 > 172.16.82.20.47774: tcp 1412
04:35:18.133449 IP 172.16.82.20.47774 > 184.26.194.110.443: tcp 0
04:35:18.133653 IP 184.26.194.110.443 > 172.16.82.20.47774: tcp 409
04:35:18.133668 IP 172.16.82.20.47774 > 184.26.194.110.443: tcp 0
04:35:18.147358 IP 184.26.194.110.443 > 172.16.82.20.47776: tcp 1412
04:35:18.147382 IP 172.16.82.20.47776 > 184.26.194.110.443: tcp 0
04:35:18.147580 IP 184.26.194.110.443 > 172.16.82.20.47776: tcp 409
04:35:18.147588 IP 172.16.82.20.47776 > 184.26.194.110.443: tcp 0
04:35:18.166015 IP 74.125.236.99.443 > 172.16.82.20.49668: tcp 160
04:35:18.166037 IP 172.16.82.20.49668 > 74.125.236.99.443: tcp 0
04:35:18.166782 IP 172.16.82.20.49668 > 74.125.236.99.443: tcp 83
04:35:18.166932 IP 74.125.236.99.443 > 172.16.82.20.49668: tcp 0
04:35:18.167193 IP 172.16.82.20.49668 > 74.125.236.99.443: tcp 53
04:35:18.167338 IP 74.125.236.99.443 > 172.16.82.20.49668: tcp 0
04:35:18.168275 IP 172.16.82.20.49668 > 74.125.236.99.443: tcp 1460
04:35:18.168285 IP 172.16.82.20.49668 > 74.125.236.99.443: tcp 135
04:35:18.168354 IP 172.16.82.20.49668 > 74.125.236.99.443: tcp 324
04:35:18.168730 IP 74.125.236.99.443 > 172.16.82.20.49668: tcp 0
04:35:18.168750 IP 74.125.236.99.443 > 172.16.82.20.49668: tcp 0
04:35:18.168767 IP 74.125.236.99.443 > 172.16.82.20.49668: tcp 0
04:35:18.198921 IP 74.125.236.99.443 > 172.16.82.20.49668: tcp 45
04:35:18.236864 IP 172.16.82.20.49668 > 74.125.236.99.443: tcp 0
04:35:18.327154 IP 173.194.36.11.80 > 172.16.82.20.44470: tcp 389
04:35:18.327179 IP 172.16.82.20.44470 > 173.194.36.11.80: tcp 0
04:35:18.327422 IP 172.16.82.20.47775 > 184.26.194.110.443: tcp 198
04:35:18.327596 IP 173.194.36.11.80 > 172.16.82.20.44470: tcp 1460
04:35:18.327606 IP 172.16.82.20.44470 > 173.194.36.11.80: tcp 0
04:35:18.327709 IP 173.194.36.11.80 > 172.16.82.20.44470: tcp 1364
04:35:18.327718 IP 172.16.82.20.44470 > 173.194.36.11.80: tcp 0
04:35:18.327723 IP 184.26.194.110.443 > 172.16.82.20.47775: tcp 0
04:35:18.328124 IP 173.194.36.11.80 > 172.16.82.20.44470: tcp 1274
04:35:18.328138 IP 172.16.82.20.44470 > 173.194.36.11.80: tcp 0
04:35:18.334039 IP 172.16.82.20.47774 > 184.26.194.110.443: tcp 198
04:35:18.334243 IP 184.26.194.110.443 > 172.16.82.20.47774: tcp 0
04:35:18.348691 IP 172.16.82.20.47776 > 184.26.194.110.443: tcp 198
04:35:18.348884 IP 184.26.194.110.443 > 172.16.82.20.47776: tcp 0
04:35:18.399802 IP 199.47.216.172.443 > 172.16.82.20.52100: tcp 1412
04:35:18.399839 IP 172.16.82.20.52100 > 199.47.216.172.443: tcp 0
04:35:18.400026 IP 199.47.216.172.443 > 172.16.82.20.52100: tcp 1460
04:35:18.400033 IP 172.16.82.20.52100 > 199.47.216.172.443: tcp 0
04:35:18.400317 IP 199.47.216.172.443 > 172.16.82.20.52100: tcp 960
04:35:18.400324 IP 172.16.82.20.52100 > 199.47.216.172.443: tcp 0
04:35:18.412803 IP 173.194.36.11.80 > 172.16.82.20.44470: tcp 1412
04:35:18.412830 IP 172.16.82.20.44470 > 173.194.36.11.80: tcp 0
04:35:18.413295 IP 173.194.36.11.80 > 172.16.82.20.44470: tcp 1460
04:35:18.413303 IP 172.16.82.20.44470 > 173.194.36.11.80: tcp 0
04:35:18.413409 IP 173.194.36.11.80 > 172.16.82.20.44470: tcp 1364
04:35:18.413413 IP 172.16.82.20.44470 > 173.194.36.11.80: tcp 0
04:35:18.413532 IP 173.194.36.11.80 > 172.16.82.20.44470: tcp 1460
04:35:18.413537 IP 172.16.82.20.44470 > 173.194.36.11.80: tcp 0
04:35:18.413654 IP 173.194.36.11.80 > 172.16.82.20.44470: tcp 1460
04:35:18.413659 IP 172.16.82.20.44470 > 173.194.36.11.80: tcp 0
04:35:18.413762 IP 173.194.36.11.80 > 172.16.82.20.44470: tcp 1038
04:35:18.413766 IP 172.16.82.20.44470 > 173.194.36.11.80: tcp 0
04:35:18.436785 IP 172.16.82.20.49668 > 74.125.236.99.443: tcp 1460
04:35:18.436821 IP 172.16.82.20.49668 > 74.125.236.99.443: tcp 133
04:35:18.436891 IP 172.16.82.20.49668 > 74.125.236.99.443: tcp 384
04:35:18.437359 IP 74.125.236.99.443 > 172.16.82.20.49668: tcp 0
04:35:18.440401 IP 172.16.82.20.52100 > 199.47.216.172.443: tcp 198
04:35:18.440592 IP 199.47.216.172.443 > 172.16.82.20.52100: tcp 0
04:35:18.466249 IP 172.16.82.20.38486 > 172.16.83.254.5351: UDP, length 12
04:35:18.466515 IP 172.16.83.254 > 172.16.82.20: ICMP host 172.16.83.254 unreachable - admin prohibited filter, length 36
04:35:18.469823 STP 802.1d, Config, Flags [none], bridge-id 8016.00:12:43:31:26:80.8006, length 43
04:35:18.473867 IP 74.125.236.99.443 > 172.16.82.20.49668: tcp 0
04:35:18.514308 IP 172.16.82.20.33895 > 208.80.154.225.80: tcp 0
04:35:18.514515 IP 208.80.154.225.80 > 172.16.82.20.33895: tcp 0
04:35:18.514540 IP 172.16.82.20.33895 > 208.80.154.225.80: tcp 0
04:35:18.514908 IP 172.16.82.20.38109 > 172.16.68.12.53: UDP, length 33
04:35:18.515139 IP 172.16.82.20.33896 > 208.80.154.225.80: tcp 0
04:35:18.515210 IP 172.16.82.20.33897 > 208.80.154.225.80: tcp 0
04:35:18.515375 IP 208.80.154.225.80 > 172.16.82.20.33897: tcp 0
04:35:18.515392 IP 172.16.82.20.33897 > 208.80.154.225.80: tcp 0
04:35:18.515401 IP 208.80.154.225.80 > 172.16.82.20.33896: tcp 0
04:35:18.515406 IP 172.16.82.20.33896 > 208.80.154.225.80: tcp 0
04:35:18.515754 IP 172.16.68.12.53 > 172.16.82.20.38109: UDP, length 49
04:35:18.515958 IP 172.16.82.20.51495 > 172.16.68.12.53: UDP, length 30
04:35:18.516038 IP 172.16.82.20.49050 > 128.9.144.147.80: tcp 0
04:35:18.516081 IP 172.16.82.20.49051 > 128.9.144.147.80: tcp 0
04:35:18.516119 IP 172.16.82.20.49052 > 128.9.144.147.80: tcp 0
04:35:18.516157 IP 172.16.82.20.49053 > 128.9.144.147.80: tcp 0
04:35:18.516205 IP 128.9.144.147.80 > 172.16.82.20.49051: tcp 0
04:35:18.516221 IP 172.16.82.20.49051 > 128.9.144.147.80: tcp 0
04:35:18.516321 IP 128.9.144.147.80 > 172.16.82.20.49053: tcp 0
04:35:18.516329 IP 172.16.82.20.49053 > 128.9.144.147.80: tcp 0
04:35:18.516349 IP 128.9.144.147.80 > 172.16.82.20.49050: tcp 0
04:35:18.516356 IP 172.16.82.20.49050 > 128.9.144.147.80: tcp 0
04:35:18.516359 IP 128.9.144.147.80 > 172.16.82.20.49052: tcp 0
04:35:18.516363 IP 172.16.82.20.49052 > 128.9.144.147.80: tcp 0
04:35:18.516984 IP 172.16.82.20.49051 > 128.9.144.147.80: tcp 710
04:35:18.517255 IP 128.9.144.147.80 > 172.16.82.20.49051: tcp 0
04:35:18.521468 IP6 fe80::20e6:e6d3:da56:b65e > ff02::1:fff9:fc1f: ICMP6, neighbor solicitation, who has fe80::b506:5cbc:41f9:fc1f, length 32
04:35:18.521562 IP6 fe80::20e6:e6d3:da56:b65e > ff02::1:ffdc:bdb7: ICMP6, neighbor solicitation, who has fe80::201a:13ee:f3dc:bdb7, length 32
04:35:18.529936 IP 173.194.36.11.80 > 172.16.82.20.44470: tcp 1412
04:35:18.529959 IP 172.16.82.20.44470 > 173.194.36.11.80: tcp 0
04:35:18.530369 IP 173.194.36.11.80 > 172.16.82.20.44470: tcp 1412
04:35:18.530380 IP 172.16.82.20.44470 > 173.194.36.11.80: tcp 0
04:35:18.530611 IP 173.194.36.11.80 > 172.16.82.20.44470: tcp 1460
04:35:18.530620 IP 172.16.82.20.44470 > 173.194.36.11.80: tcp 0
04:35:18.530732 IP 173.194.36.11.80 > 172.16.82.20.44470: tcp 1460
04:35:18.530739 IP 172.16.82.20.44470 > 173.194.36.11.80: tcp 0
04:35:18.530855 IP 173.194.36.11.80 > 172.16.82.20.44470: tcp 1460
04:35:18.530864 IP 172.16.82.20.44470 > 173.194.36.11.80: tcp 0
04:35:18.530979 IP 173.194.36.11.80 > 172.16.82.20.44470: tcp 1460
04:35:18.530987 IP 172.16.82.20.44470 > 173.194.36.11.80: tcp 0
04:35:18.531102 IP 173.194.36.11.80 > 172.16.82.20.44470: tcp 1460
04:35:18.531108 IP 172.16.82.20.44470 > 173.194.36.11.80: tcp 0
04:35:18.531192 IP 173.194.36.11.80 > 172.16.82.20.44470: tcp 1062
04:35:18.531197 IP 172.16.82.20.44470 > 173.194.36.11.80: tcp 0
04:35:18.540330 IP 184.26.194.110.443 > 172.16.82.20.47775: tcp 59
04:35:18.540370 IP 172.16.82.20.47775 > 184.26.194.110.443: tcp 0
04:35:18.544644 IP 184.26.194.110.443 > 172.16.82.20.47774: tcp 59
04:35:18.544681 IP 172.16.82.20.47774 > 184.26.194.110.443: tcp 0
04:35:18.565791 IP 184.26.194.110.443 > 172.16.82.20.47776: tcp 59
04:35:18.565832 IP 172.16.82.20.47776 > 184.26.194.110.443: tcp 0
04:35:18.568682 IP 172.16.68.12.53 > 172.16.82.20.51495: UDP, length 113
04:35:18.568977 IP 172.16.82.20.45058 > 61.246.63.72.80: tcp 0
04:35:18.569019 IP 172.16.82.20.45059 > 61.246.63.72.80: tcp 0
04:35:18.569053 IP 172.16.82.20.45060 > 61.246.63.72.80: tcp 0
04:35:18.569200 IP 61.246.63.72.80 > 172.16.82.20.45059: tcp 0
04:35:18.569218 IP 172.16.82.20.45059 > 61.246.63.72.80: tcp 0
04:35:18.569265 IP 61.246.63.72.80 > 172.16.82.20.45058: tcp 0
04:35:18.569271 IP 172.16.82.20.45058 > 61.246.63.72.80: tcp 0
04:35:18.569370 IP 61.246.63.72.80 > 172.16.82.20.45060: tcp 0
04:35:18.569378 IP 172.16.82.20.45060 > 61.246.63.72.80: tcp 0
04:35:18.585612 IP 172.16.82.20.39144 > 209.85.175.191.80: tcp 1075
04:35:18.586006 IP 209.85.175.191.80 > 172.16.82.20.39144: tcp 0
04:35:18.586366 IP 172.16.82.20.38710 > 74.125.236.113.80: tcp 1183
04:35:18.586830 IP 74.125.236.113.80 > 172.16.82.20.38710: tcp 0
04:35:18.588188 IP 172.16.82.20.39143 > 209.85.175.191.80: tcp 1153
04:35:18.588687 IP 209.85.175.191.80 > 172.16.82.20.39143: tcp 0
04:35:18.615830 IP 173.194.36.11.80 > 172.16.82.20.44470: tcp 1412
04:35:18.615861 IP 172.16.82.20.44470 > 173.194.36.11.80: tcp 0
04:35:18.615937 IP 173.194.36.11.80 > 172.16.82.20.44470: tcp 1460
04:35:18.615942 IP 172.16.82.20.44470 > 173.194.36.11.80: tcp 0
04:35:18.616060 IP 173.194.36.11.80 > 172.16.82.20.44470: tcp 1460
04:35:18.616065 IP 172.16.82.20.44470 > 173.194.36.11.80: tcp 0
04:35:18.616182 IP 173.194.36.11.80 > 172.16.82.20.44470: tcp 1460
04:35:18.616187 IP 172.16.82.20.44470 > 173.194.36.11.80: tcp 0
04:35:18.616306 IP 173.194.36.11.80 > 172.16.82.20.44470: tcp 1460
04:35:18.616312 IP 172.16.82.20.44470 > 173.194.36.11.80: tcp 0
04:35:18.616430 IP 173.194.36.11.80 > 172.16.82.20.44470: tcp 1460
04:35:18.616436 IP 172.16.82.20.44470 > 173.194.36.11.80: tcp 0
04:35:18.616551 IP 173.194.36.11.80 > 172.16.82.20.44470: tcp 1460
04:35:18.616556 IP 172.16.82.20.44470 > 173.194.36.11.80: tcp 0
04:35:18.616609 IP 173.194.36.11.80 > 172.16.82.20.44470: tcp 700
04:35:18.616614 IP 172.16.82.20.44470 > 173.194.36.11.80: tcp 0
04:35:18.642789 IP 69.171.224.53.443 > 172.16.82.20.46540: tcp 1412
04:35:18.642822 IP 172.16.82.20.46540 > 69.171.224.53.443: tcp 0
04:35:18.643087 IP 69.171.224.53.443 > 172.16.82.20.46540: tcp 552
04:35:18.643094 IP 172.16.82.20.46540 > 69.171.224.53.443: tcp 0
04:35:18.644949 IP 69.171.224.53.443 > 172.16.82.20.46539: tcp 1412
04:35:18.644981 IP 172.16.82.20.46539 > 69.171.224.53.443: tcp 0
04:35:18.645232 IP 69.171.224.53.443 > 172.16.82.20.46539: tcp 552
04:35:18.645240 IP 172.16.82.20.46539 > 69.171.224.53.443: tcp 0
04:35:18.646738 IP 69.171.224.53.443 > 172.16.82.20.46538: tcp 1412
04:35:18.646761 IP 172.16.82.20.46538 > 69.171.224.53.443: tcp 0
04:35:18.647030 IP 69.171.224.53.443 > 172.16.82.20.46538: tcp 552
04:35:18.647038 IP 172.16.82.20.46538 > 69.171.224.53.443: tcp 0
04:35:18.683671 IP 74.125.236.99.443 > 172.16.82.20.49668: tcp 302
04:35:18.683704 IP 172.16.82.20.49668 > 74.125.236.99.443: tcp 0
04:35:18.683919 IP 74.125.236.99.443 > 172.16.82.20.49668: tcp 327
04:35:18.683932 IP 172.16.82.20.49668 > 74.125.236.99.443: tcp 0
04:35:18.696321 IP 172.16.82.20.49668 > 74.125.236.99.443: tcp 1460
04:35:18.696599 IP 172.16.82.20.49668 > 74.125.236.99.443: tcp 133
04:35:18.696707 IP 172.16.82.20.49668 > 74.125.236.99.443: tcp 245
04:35:18.696949 IP 74.125.236.99.443 > 172.16.82.20.49668: tcp 0
04:35:18.696968 IP 74.125.236.99.443 > 172.16.82.20.49668: tcp 0
04:35:18.696982 IP 74.125.236.99.443 > 172.16.82.20.49668: tcp 0
04:35:18.725411 IP 172.16.68.12.53 > 172.16.82.20.36189: UDP, length 65
04:35:18.725773 IP 172.16.82.20.56233 > 173.242.116.69.80: tcp 0
04:35:18.725872 IP 172.16.82.20.56234 > 173.242.116.69.80: tcp 0
04:35:18.725952 IP 172.16.82.20.56235 > 173.242.116.69.80: tcp 0
04:35:18.726030 IP 172.16.82.20.56236 > 173.242.116.69.80: tcp 0
04:35:18.726108 IP 173.242.116.69.80 > 172.16.82.20.56234: tcp 0
04:35:18.726109 IP 172.16.82.20.56237 > 173.242.116.69.80: tcp 0
04:35:18.726134 IP 172.16.82.20.56234 > 173.242.116.69.80: tcp 0
04:35:18.726202 IP 172.16.82.20.56238 > 173.242.116.69.80: tcp 0
04:35:18.726214 IP 173.242.116.69.80 > 172.16.82.20.56236: tcp 0
04:35:18.726223 IP 172.16.82.20.56236 > 173.242.116.69.80: tcp 0
04:35:18.726281 IP 173.242.116.69.80 > 172.16.82.20.56233: tcp 0
04:35:18.726294 IP 172.16.82.20.56233 > 173.242.116.69.80: tcp 0
04:35:18.726299 IP 173.242.116.69.80 > 172.16.82.20.56235: tcp 0
04:35:18.726306 IP 172.16.82.20.56235 > 173.242.116.69.80: tcp 0
04:35:18.726362 IP 173.242.116.69.80 > 172.16.82.20.56237: tcp 0
04:35:18.726375 IP 172.16.82.20.56237 > 173.242.116.69.80: tcp 0
04:35:18.726548 IP 173.242.116.69.80 > 172.16.82.20.56238: tcp 0
04:35:18.726561 IP 172.16.82.20.56238 > 173.242.116.69.80: tcp 0
04:35:18.726598 IP 172.16.82.20.56234 > 173.242.116.69.80: tcp 608
04:35:18.727000 IP 173.242.116.69.80 > 172.16.82.20.56234: tcp 0
04:35:18.731993 IP 173.194.36.11.80 > 172.16.82.20.44470: tcp 1412
04:35:18.732006 IP 172.16.82.20.44470 > 173.194.36.11.80: tcp 0
04:35:18.732116 IP 173.194.36.11.80 > 172.16.82.20.44470: tcp 1460
04:35:18.732123 IP 172.16.82.20.44470 > 173.194.36.11.80: tcp 0
04:35:18.732237 IP 173.194.36.11.80 > 172.16.82.20.44470: tcp 1460
04:35:18.732248 IP 172.16.82.20.44470 > 173.194.36.11.80: tcp 0
04:35:18.732363 IP 173.194.36.11.80 > 172.16.82.20.44470: tcp 1460
04:35:18.732370 IP 172.16.82.20.44470 > 173.194.36.11.80: tcp 0
04:35:18.732486 IP 173.194.36.11.80 > 172.16.82.20.44470: tcp 1460
04:35:18.732609 IP 173.194.36.11.80 > 172.16.82.20.44470: tcp 1460
04:35:18.732709 IP 173.194.36.11.80 > 172.16.82.20.44470: tcp 1214
04:35:18.732867 IP 173.194.36.11.80 > 172.16.82.20.44470: tcp 1460
04:35:18.732977 IP 173.194.36.11.80 > 172.16.82.20.44470: tcp 1460
04:35:18.734562 IP 172.16.82.20.44470 > 173.194.36.11.80: tcp 0
04:35:18.734932 IP 173.194.36.11.80 > 172.16.82.20.44470: tcp 1176
04:35:18.735769 IP 172.16.82.20.44470 > 173.194.36.11.80: tcp 0
04:35:18.747164 IP 199.47.216.172.443 > 172.16.82.20.52100: tcp 234
04:35:18.747194 IP 172.16.82.20.52100 > 199.47.216.172.443: tcp 0
04:35:18.747996 IP 172.16.82.20.52100 > 199.47.216.172.443: tcp 229
04:35:18.748435 IP 199.47.216.172.443 > 172.16.82.20.52100: tcp 0
04:35:18.748456 IP 172.16.82.20.52100 > 199.47.216.172.443: tcp 1109
04:35:18.748884 IP 199.47.216.172.443 > 172.16.82.20.52100: tcp 0
04:35:18.754619 IP 209.85.175.191.80 > 172.16.82.20.39144: tcp 136
04:35:18.754632 IP 172.16.82.20.39144 > 209.85.175.191.80: tcp 0
04:35:18.757907 IP 74.125.236.99.443 > 172.16.82.20.49668: tcp 55
04:35:18.773447 IP 74.125.236.113.80 > 172.16.82.20.38710: tcp 153
04:35:18.773471 IP 172.16.82.20.38710 > 74.125.236.113.80: tcp 0
04:35:18.796857 IP 172.16.82.20.49668 > 74.125.236.99.443: tcp 0
04:35:18.797237 IP 74.125.236.99.443 > 172.16.82.20.49668: tcp 348
04:35:18.797256 IP 172.16.82.20.49668 > 74.125.236.99.443: tcp 0
04:35:18.817453 IP 173.194.36.11.80 > 172.16.82.20.44470: tcp 1412
04:35:18.817511 IP 172.16.82.20.44470 > 173.194.36.11.80: tcp 0
04:35:18.817565 IP 173.194.36.11.80 > 172.16.82.20.44470: tcp 1460
04:35:18.817692 IP 173.194.36.11.80 > 172.16.82.20.44470: tcp 1460
04:35:18.817815 IP 173.194.36.11.80 > 172.16.82.20.44470: tcp 1460
04:35:18.817938 IP 173.194.36.11.80 > 172.16.82.20.44470: tcp 1456
04:35:18.817969 IP 172.16.82.20.44470 > 173.194.36.11.80: tcp 0
04:35:18.843462 IP 172.16.82.20.46540 > 69.171.224.53.443: tcp 186
04:35:18.843638 IP 69.171.224.53.443 > 172.16.82.20.46540: tcp 0
04:35:18.845617 IP 172.16.82.20.46539 > 69.171.224.53.443: tcp 186
04:35:18.845781 IP 69.171.224.53.443 > 172.16.82.20.46539: tcp 0
04:35:18.847728 IP 172.16.82.20.46538 > 69.171.224.53.443: tcp 186
04:35:18.847875 IP 69.171.224.53.443 > 172.16.82.20.46538: tcp 0
04:35:18.864136 IP 172.16.68.12.53 > 172.16.82.7.64989: UDP, length 54
04:35:18.922304 IP 172.16.82.20.54407 > 117.194.224.3.443: tcp 0
04:35:18.922475 IP 117.194.224.3.443 > 172.16.82.20.54407: tcp 0
04:35:18.922499 IP 172.16.82.20.54407 > 117.194.224.3.443: tcp 0
04:35:18.922554 IP 172.16.82.20.47693 > 117.203.135.195.443: tcp 0
04:35:18.922722 IP 117.203.135.195.443 > 172.16.82.20.47693: tcp 0
04:35:18.922736 IP 172.16.82.20.47693 > 117.203.135.195.443: tcp 0
04:35:18.922755 IP 172.16.82.20.56385 > 112.139.180.222.443: tcp 0
04:35:18.922912 IP 112.139.180.222.443 > 172.16.82.20.56385: tcp 0
04:35:18.922924 IP 172.16.82.20.56385 > 112.139.180.222.443: tcp 0
04:35:18.922965 IP 172.16.82.20.58846 > 188.133.238.27.443: tcp 0
04:35:18.923112 IP 188.133.238.27.443 > 172.16.82.20.58846: tcp 0
04:35:18.923129 IP 172.16.82.20.58846 > 188.133.238.27.443: tcp 0
04:35:18.923321 IP 172.16.82.20.54407 > 117.194.224.3.443: tcp 72
04:35:18.923477 IP 172.16.82.20.47693 > 117.203.135.195.443: tcp 72
04:35:18.923494 IP 117.194.224.3.443 > 172.16.82.20.54407: tcp 0
04:35:18.923510 IP 172.16.82.20.54407 > 117.194.224.3.443: tcp 58
04:35:18.923632 IP 172.16.82.20.56385 > 112.139.180.222.443: tcp 72
04:35:18.923637 IP 117.203.135.195.443 > 172.16.82.20.47693: tcp 0
04:35:18.923646 IP 172.16.82.20.47693 > 117.203.135.195.443: tcp 29
04:35:18.923657 IP 117.194.224.3.443 > 172.16.82.20.54407: tcp 0
04:35:18.923694 IP 172.16.82.20.58846 > 188.133.238.27.443: tcp 72
04:35:18.923789 IP 112.139.180.222.443 > 172.16.82.20.56385: tcp 0
04:35:18.923799 IP 172.16.82.20.56385 > 112.139.180.222.443: tcp 66
04:35:18.923804 IP 117.203.135.195.443 > 172.16.82.20.47693: tcp 0
04:35:18.923825 IP 188.133.238.27.443 > 172.16.82.20.58846: tcp 0
04:35:18.923831 IP 172.16.82.20.58846 > 188.133.238.27.443: tcp 72
04:35:18.923934 IP 112.139.180.222.443 > 172.16.82.20.56385: tcp 0
04:35:18.923954 IP 188.133.238.27.443 > 172.16.82.20.58846: tcp 0
