23:05:00.826560 IP 172.16.82.116.55189 > 255.255.255.255.10007: UDP, length 128
23:05:00.828445 IP6 fe80::a119:10c4:b1ea:cb51 > ff02::1:ff91:af26: ICMP6, neighbor solicitation, who has fe80::5803:a1b9:fb91:af26, length 32
23:05:00.832052 IP6 fe80::1018:350b:18fd:d4.58462 > ff02::1:3.5355: UDP, length 24
23:05:00.832334 IP 169.254.0.212.65153 > 224.0.0.252.5355: UDP, length 24
23:05:00.833271 IP 172.16.82.116.55190 > 255.255.255.255.10019: UDP, length 128
23:05:00.836775 IP 172.16.82.164.137 > 172.16.83.255.137: UDP, length 50
23:05:00.839770 IP 172.16.82.210.58452 > 239.255.255.250.1900: UDP, length 133
23:05:00.845589 ARP, Request who-has 172.16.82.229 tell 172.16.83.92, length 46
23:05:00.850479 IP 169.254.0.212.51893 > 239.255.255.250.1900: UDP, length 133
23:05:00.861220 ARP, Request who-has 172.16.82.238 tell 172.16.83.92, length 46
23:05:00.862257 IP 172.16.83.92.58383 > 172.16.82.238.2987: tcp 0
23:05:00.866442 IP 172.16.82.236.137 > 172.16.83.255.137: UDP, length 50
23:05:00.884680 IP 172.16.82.190.137 > 172.16.83.255.137: UDP, length 68
23:05:00.886731 IP 169.254.0.212.1900 > 239.255.255.250.1900: UDP, length 437
23:05:00.886899 IP6 fe80::1018:350b:18fd:d4.1900 > ff02::c.1900: UDP, length 443
23:05:00.887327 IP 169.254.0.212.1900 > 239.255.255.250.1900: UDP, length 446
23:05:00.887458 IP6 fe80::1018:350b:18fd:d4.1900 > ff02::c.1900: UDP, length 452
23:05:00.887665 IP 169.254.0.212.1900 > 239.255.255.250.1900: UDP, length 493
23:05:00.887783 IP6 fe80::1018:350b:18fd:d4.1900 > ff02::c.1900: UDP, length 499
23:05:00.888186 IP 169.254.0.212.1900 > 239.255.255.250.1900: UDP, length 501
23:05:00.888354 IP6 fe80::1018:350b:18fd:d4.1900 > ff02::c.1900: UDP, length 507
23:05:00.894758 IP 172.16.82.181.57395 > 239.255.255.250.1900: UDP, length 133
23:05:00.903959 IP 169.254.0.212.1900 > 239.255.255.250.1900: UDP, length 436
23:05:00.904087 IP6 fe80::1018:350b:18fd:d4.1900 > ff02::c.1900: UDP, length 442
23:05:00.904316 IP 169.254.0.212.1900 > 239.255.255.250.1900: UDP, length 445
23:05:00.904447 IP6 fe80::1018:350b:18fd:d4.1900 > ff02::c.1900: UDP, length 451
23:05:00.904573 IP 169.254.0.212.1900 > 239.255.255.250.1900: UDP, length 492
23:05:00.904696 IP6 fe80::1018:350b:18fd:d4.1900 > ff02::c.1900: UDP, length 498
23:05:00.904833 IP 169.254.0.212.1900 > 239.255.255.250.1900: UDP, length 500
23:05:00.904945 IP6 fe80::1018:350b:18fd:d4.1900 > ff02::c.1900: UDP, length 506
23:05:00.904952 ARP, Request who-has 169.254.0.212 tell 172.16.82.45, length 46
23:05:00.905279 ARP, Request who-has 169.254.0.212 tell 172.16.82.255, length 46
23:05:00.905372 ARP, Request who-has 169.254.0.212 tell 172.16.82.127, length 46
23:05:00.905763 ARP, Request who-has 169.254.0.212 tell 172.16.83.28, length 46
23:05:00.906079 ARP, Request who-has 169.254.0.212 tell 172.16.82.185, length 46
23:05:00.906372 ARP, Request who-has 169.254.0.212 tell 172.16.82.180, length 46
23:05:00.906480 ARP, Request who-has 169.254.0.212 tell 172.16.82.167, length 46
23:05:00.906728 ARP, Request who-has 169.254.0.212 tell 172.16.82.59, length 46
23:05:00.906783 ARP, Request who-has 169.254.0.212 tell 172.16.82.137, length 46
23:05:00.907343 ARP, Request who-has 169.254.0.212 tell 172.16.82.132, length 46
23:05:00.913903 IP 172.16.83.7.1900 > 239.255.255.250.1900: UDP, length 490
23:05:00.915804 IP6 fe80::e59c:f009:554a:495e.1900 > ff02::c.1900: UDP, length 500
23:05:00.927986 IP6 fe80::1018:350b:18fd:d4.58462 > ff02::1:3.5355: UDP, length 24
23:05:00.928107 IP 169.254.0.212.65153 > 224.0.0.252.5355: UDP, length 24
23:05:00.943368 IP 172.16.82.103.64513 > 255.255.255.255.10019: UDP, length 128
23:05:00.950742 ARP, Request who-has 172.16.82.182 tell 172.16.82.255, length 46
23:05:00.953404 IP 172.16.82.103.64514 > 255.255.255.255.10007: UDP, length 128
23:05:00.955958 ARP, Request who-has 172.16.82.255 tell 172.16.82.182, length 46
23:05:00.956139 IP 169.254.0.212.1900 > 239.255.255.250.1900: UDP, length 437
23:05:00.956263 IP6 fe80::1018:350b:18fd:d4.1900 > ff02::c.1900: UDP, length 443
23:05:00.956511 IP 169.254.0.212.1900 > 239.255.255.250.1900: UDP, length 446
23:05:00.956591 IP6 fe80::1018:350b:18fd:d4.1900 > ff02::c.1900: UDP, length 452
23:05:00.956776 IP 169.254.0.212.1900 > 239.255.255.250.1900: UDP, length 493
23:05:00.956889 IP6 fe80::1018:350b:18fd:d4.1900 > ff02::c.1900: UDP, length 499
23:05:00.957140 IP 169.254.0.212.1900 > 239.255.255.250.1900: UDP, length 501
23:05:00.957267 IP6 fe80::1018:350b:18fd:d4.1900 > ff02::c.1900: UDP, length 507
23:05:00.958570 ARP, Request who-has 172.16.82.39 tell 172.16.82.117, length 46
23:05:00.967487 ARP, Request who-has 172.16.82.202 tell 172.16.83.92, length 46
23:05:00.967496 IP6 fe80::108d:dbc7:68be:64e8 > ff02::1:ff91:af26: ICMP6, neighbor solicitation, who has fe80::5803:a1b9:fb91:af26, length 32
23:05:00.967664 IP 169.254.0.212.1900 > 239.255.255.250.1900: UDP, length 436
23:05:00.967798 IP6 fe80::1018:350b:18fd:d4.1900 > ff02::c.1900: UDP, length 442
23:05:00.967917 IP 169.254.0.212.1900 > 239.255.255.250.1900: UDP, length 445
23:05:00.968409 IP6 fe80::1018:350b:18fd:d4.1900 > ff02::c.1900: UDP, length 451
23:05:00.968542 IP 169.254.0.212.1900 > 239.255.255.250.1900: UDP, length 500
23:05:00.968662 IP6 fe80::1018:350b:18fd:d4.1900 > ff02::c.1900: UDP, length 506
23:05:00.968903 IP 169.254.0.212.1900 > 239.255.255.250.1900: UDP, length 492
23:05:00.969047 IP6 fe80::1018:350b:18fd:d4.1900 > ff02::c.1900: UDP, length 498
23:05:00.996891 IP6 fe80::557e:7710:6661:9d69 > ff02::1:ff91:af26: ICMP6, neighbor solicitation, who has fe80::5803:a1b9:fb91:af26, length 32
23:05:01.018382 IP 172.16.83.93.68 > 255.255.255.255.67: UDP, length 300
23:05:01.027327 IP 172.16.83.93.137 > 172.16.83.255.137: UDP, length 50
23:05:01.056093 IP6 fe80::85cd:d2f9:bab6:b50d > ff02::1:ff91:af26: ICMP6, neighbor solicitation, who has fe80::5803:a1b9:fb91:af26, length 32
23:05:01.056796 ARP, Request who-has 172.16.83.254 tell 172.16.82.248, length 46
23:05:01.056806 IP6 fe80::95fd:d93e:f0c8:84cf > ff02::1:ffaf:3ae0: ICMP6, neighbor solicitation, who has fe80::3199:1e6b:94af:3ae0, length 32
23:05:01.058652 ARP, Request who-has 172.16.82.39 tell 172.16.82.160, length 46
23:05:01.074403 IP6 fe80::5130:c8f2:8e34:34a0 > ff02::1:ffaf:3ae0: ICMP6, neighbor solicitation, who has fe80::3199:1e6b:94af:3ae0, length 32
23:05:01.074411 IP6 fe80::5130:c8f2:8e34:34a0 > ff02::1:ff91:af26: ICMP6, neighbor solicitation, who has fe80::5803:a1b9:fb91:af26, length 32
23:05:01.074415 ARP, Request who-has 172.16.83.254 tell 172.16.82.71, length 46
23:05:01.074741 IP6 fe80::3199:1e6b:94af:3ae0 > ff02::1:ff34:34a0: ICMP6, neighbor solicitation, who has fe80::5130:c8f2:8e34:34a0, length 32
23:05:01.076425 IP6 fe80::bc4e:6ef1:284d:8ee > ff02::1:ff8c:2405: ICMP6, neighbor solicitation, who has fe80::f85b:d742:d78c:2405, length 32
23:05:01.077897 ARP, Request who-has 172.16.82.39 tell 172.16.82.14, length 46
23:05:01.081354 IP6 fe80::7c0f:d71b:3b7f:93e9 > ff02::1:ff91:af26: ICMP6, neighbor solicitation, who has fe80::5803:a1b9:fb91:af26, length 32
23:05:01.093986 IP 172.16.82.214.1900 > 239.255.255.250.1900: UDP, length 310
23:05:01.103288 IP6 fe80::4d6c:5b04:de:2a26 > ff02::1:ff91:af26: ICMP6, neighbor solicitation, who has fe80::5803:a1b9:fb91:af26, length 32
23:05:01.124142 IP6 fe80::3199:1e6b:94af:3ae0 > ff02::1:fffd:d4: ICMP6, neighbor solicitation, who has fe80::1018:350b:18fd:d4, length 32
23:05:01.128393 IP 169.254.0.212.137 > 169.254.255.255.137: UDP, length 50
23:05:01.134384 ARP, Request who-has 172.16.82.255 tell 172.16.82.214, length 46
23:05:01.138171 IP 172.16.82.92.50791 > 255.255.255.255.10007: UDP, length 128
23:05:01.156895 IP6 fe80::694d:2f0e:fb0e:327e > ff02::1:ff91:af26: ICMP6, neighbor solicitation, who has fe80::5803:a1b9:fb91:af26, length 32
23:05:01.177643 IP6 fe80::d546:7ce5:b4f6:bf8e > ff02::1:ff91:af26: ICMP6, neighbor solicitation, who has fe80::5803:a1b9:fb91:af26, length 32
23:05:01.201254 IP 172.16.82.10.17500 > 172.16.83.255.17500: UDP, length 121
23:05:01.223523 ARP, Request who-has 172.16.82.39 tell 172.16.82.110, length 46
23:05:01.240937 ARP, Request who-has 172.16.82.39 tell 172.16.82.2, length 46
23:05:01.279344 ARP, Request who-has 172.16.82.39 tell 172.16.82.168, length 46
23:05:01.326236 IP 172.16.82.248.63898 > 239.255.255.250.1900: UDP, length 133
23:05:01.342631 ARP, Request who-has 172.16.82.39 tell 172.16.82.182, length 46
23:05:01.393645 IP6 fe80::3199:1e6b:94af:3ae0 > ff02::1:ff8c:2405: ICMP6, neighbor solicitation, who has fe80::f85b:d742:d78c:2405, length 32
23:05:01.422022 IP6 fe80::54af:a5ad:a2f4:a799 > ff02::1:ff17:31f7: ICMP6, neighbor solicitation, who has fe80::5cc:4375:5217:31f7, length 32
23:05:01.422658 IP6 fe80::5cc:4375:5217:31f7 > ff02::1:fff4:a799: ICMP6, neighbor solicitation, who has fe80::54af:a5ad:a2f4:a799, length 32
23:05:01.433608 ARP, Request who-has 172.16.82.73 tell 172.16.82.141, length 46
23:05:01.435584 IP 172.16.82.164.137 > 172.16.83.255.137: UDP, length 50
23:05:01.436177 IP 172.16.82.110.53592 > 255.255.255.255.10007: UDP, length 128
23:05:01.444526 IP 172.16.82.251.65306 > 255.255.255.255.10007: UDP, length 128
23:05:01.537695 ARP, Request who-has 172.16.82.39 tell 172.16.82.148, length 46
23:05:01.540893 IP 172.16.82.210.137 > 172.16.83.255.137: UDP, length 50
23:05:01.566173 IP 172.16.82.165.17500 > 255.255.255.255.17500: UDP, length 252
23:05:01.569702 IP 172.16.82.165.17500 > 172.16.83.255.17500: UDP, length 252
23:05:01.573951 IP 172.16.82.92.50792 > 255.255.255.255.10019: UDP, length 128
23:05:01.586834 IP 172.16.82.164.137 > 172.16.83.255.137: UDP, length 50
23:05:01.598525 IP6 fe80::45ac:2195:64e4:3fab > ff02::1:ff91:af26: ICMP6, neighbor solicitation, who has fe80::5803:a1b9:fb91:af26, length 32
23:05:01.609627 ARP, Request who-has 172.16.82.39 tell 172.16.82.118, length 46
23:05:01.612177 IP6 fe80::5130:c8f2:8e34:34a0 > ff02::1:ff91:af26: ICMP6, neighbor solicitation, who has fe80::5803:a1b9:fb91:af26, length 32
23:05:01.616295 IP 172.16.82.236.137 > 172.16.83.255.137: UDP, length 50
23:05:01.621928 ARP, Request who-has 172.16.82.39 tell 172.16.82.12, length 46
23:05:01.637668 IP6 fe80::b506:5cbc:41f9:fc1f > ff02::1:fffd:d4: ICMP6, neighbor solicitation, who has fe80::1018:350b:18fd:d4, length 32
23:05:01.643752 IP 172.16.82.251.65307 > 255.255.255.255.10019: UDP, length 128
23:05:01.674492 ARP, Request who-has 172.16.82.220 tell 172.16.82.190, length 46
23:05:01.676506 IP6 fe80::f0f2:d933:13:2d5f > ff02::1:fffd:d4: ICMP6, neighbor solicitation, who has fe80::1018:350b:18fd:d4, length 32
23:05:01.693395 IP6 fe80::5071:fb5e:1eb4:2937 > ff02::1:fffd:d4: ICMP6, neighbor solicitation, who has fe80::1018:350b:18fd:d4, length 32
23:05:01.702938 IP6 fe80::b9ad:49e6:4d1a:35a9 > ff02::1:fff4:a799: ICMP6, neighbor solicitation, who has fe80::54af:a5ad:a2f4:a799, length 32
23:05:01.703337 IP6 fe80::54af:a5ad:a2f4:a799 > ff02::1:ff1a:35a9: ICMP6, neighbor solicitation, who has fe80::b9ad:49e6:4d1a:35a9, length 32
23:05:01.716824 IP 172.16.82.110.53593 > 255.255.255.255.10019: UDP, length 128
23:05:01.773435 IP6 fe80::6430:184a:c613:536f > ff02::1:ff91:af26: ICMP6, neighbor solicitation, who has fe80::5803:a1b9:fb91:af26, length 32
23:05:01.777519 IP 172.16.83.93.137 > 172.16.83.255.137: UDP, length 50
23:05:01.791829 IP6 fe80::bd10:f878:f44d:95ef > ff02::1:ff8c:2405: ICMP6, neighbor solicitation, who has fe80::f85b:d742:d78c:2405, length 32
23:05:01.801461 IP6 fe80::7566:7096:6143:47ef.546 > ff02::1:2.547: UDP, length 89
23:05:01.803044 ARP, Request who-has 172.16.82.148 tell 172.16.82.39, length 46
23:05:01.815421 IP 192.168.1.115.1900 > 172.16.82.181.57395: UDP, length 469
23:05:01.829581 ARP, Request who-has 172.16.82.39 tell 172.16.82.229, length 46
23:05:01.830375 IP6 fe80::9d9b:974e:b475:2b16 > ff02::1:ff91:af26: ICMP6, neighbor solicitation, who has fe80::5803:a1b9:fb91:af26, length 32
23:05:01.836926 IP6 fe80::933:3a0:cf4a:868d > ff02::1:fffd:d4: ICMP6, neighbor solicitation, who has fe80::1018:350b:18fd:d4, length 32
23:05:01.841870 IP 172.16.82.116.55191 > 255.255.255.255.10007: UDP, length 128
23:05:01.847448 IP 192.168.1.115.1900 > 172.16.82.116.65452: UDP, length 469
23:05:01.855244 IP6 fe80::3199:1e6b:94af:3ae0 > ff02::1:fffd:d4: ICMP6, neighbor solicitation, who has fe80::1018:350b:18fd:d4, length 32
23:05:01.864136 IP 172.16.82.116.55192 > 255.255.255.255.10019: UDP, length 128
23:05:01.878104 IP 169.254.0.212.137 > 169.254.255.255.137: UDP, length 50
23:05:01.880062 ARP, Request who-has 172.16.82.39 tell 172.16.82.160, length 46
23:05:01.885708 IP 172.16.82.180.59141 > 239.255.255.250.1900: UDP, length 133
23:05:01.932548 ARP, Request who-has 172.16.82.239 tell 172.16.82.160, length 46
23:05:01.932996 ARP, Request who-has 172.16.82.39 tell 172.16.82.132, length 46
23:05:01.939761 IP6 fe80::557e:7710:6661:9d69 > ff02::1:ffaf:3ae0: ICMP6, neighbor solicitation, who has fe80::3199:1e6b:94af:3ae0, length 32
23:05:01.939779 IP6 fe80::557e:7710:6661:9d69 > ff02::1:ff91:af26: ICMP6, neighbor solicitation, who has fe80::5803:a1b9:fb91:af26, length 32
23:05:01.939956 ARP, Request who-has 172.16.83.254 tell 172.16.82.100, length 46
23:05:01.939966 IP6 fe80::3199:1e6b:94af:3ae0 > ff02::1:ff61:9d69: ICMP6, neighbor solicitation, who has fe80::557e:7710:6661:9d69, length 32
23:05:01.943047 ARP, Request who-has 172.16.82.160 tell 172.16.82.239, length 46
23:05:01.946565 IP 172.16.82.103.64515 > 255.255.255.255.10019: UDP, length 128
23:05:01.946907 ARP, Request who-has 172.16.82.39 tell 172.16.82.155, length 46
23:05:01.953254 IP 172.16.82.103.64516 > 255.255.255.255.10007: UDP, length 128
23:05:01.954776 ARP, Request who-has 172.16.82.39 tell 172.16.82.236, length 46
23:05:01.955284 IP6 fe80::85cd:d2f9:bab6:b50d > ff02::1:ff91:af26: ICMP6, neighbor solicitation, who has fe80::5803:a1b9:fb91:af26, length 32
23:05:01.966021 IP 172.16.82.69.50528 > 239.255.255.250.1900: UDP, length 133
23:05:02.017736 IP 192.168.1.1.67 > 255.255.255.255.68: UDP, length 303
23:05:02.021360 ARP, Request who-has 172.16.82.39 tell 172.16.83.7, length 46
23:05:02.073431 IP 172.16.82.236.137 > 172.16.83.255.137: UDP, length 50
23:05:02.078140 IP6 fe80::108d:dbc7:68be:64e8 > ff02::1:fffd:d4: ICMP6, neighbor solicitation, who has fe80::1018:350b:18fd:d4, length 32
23:05:02.090380 IP 172.16.83.65.52611 > 239.255.255.250.1900: UDP, length 133
23:05:02.101647 IP6 fe80::4d6c:5b04:de:2a26 > ff02::1:ff91:af26: ICMP6, neighbor solicitation, who has fe80::5803:a1b9:fb91:af26, length 32
23:05:02.110143 IP6 fe80::e9e1:d2d9:d09b:1973 > ff02::1:fffd:d4: ICMP6, neighbor solicitation, who has fe80::1018:350b:18fd:d4, length 32
23:05:02.121091 IP6 fe80::c173:39de:d01e:e02d > ff02::1:fffd:d4: ICMP6, neighbor solicitation, who has fe80::1018:350b:18fd:d4, length 32
23:05:02.129154 ARP, Request who-has 172.16.82.39 tell 172.16.83.17, length 46
23:05:02.153668 IP 172.16.82.92.50793 > 255.255.255.255.10007: UDP, length 128
23:05:02.156895 IP6 fe80::694d:2f0e:fb0e:327e > ff02::1:ff91:af26: ICMP6, neighbor solicitation, who has fe80::5803:a1b9:fb91:af26, length 32
23:05:02.173051 IP6 fe80::b9ad:49e6:4d1a:35a9 > ff02::1:fffd:d4: ICMP6, neighbor solicitation, who has fe80::1018:350b:18fd:d4, length 32
23:05:02.184891 IP 172.16.82.164.137 > 172.16.83.255.137: UDP, length 50
23:05:02.200639 ARP, Request who-has 172.16.82.202 tell 172.16.83.92, length 46
23:05:02.215842 IP6 fe80::f0f2:d933:13:2d5f > ff02::1:fffd:d4: ICMP6, neighbor solicitation, who has fe80::1018:350b:18fd:d4, length 32
23:05:02.238614 IP 172.16.83.92.137 > 172.16.83.255.137: UDP, length 50
23:05:02.241267 IP 172.16.82.100.60693 > 239.255.255.250.1900: UDP, length 133
23:05:02.241785 ARP, Request who-has 172.16.82.100 tell 172.16.82.47, length 46
23:05:02.241793 ARP, Request who-has 172.16.82.100 tell 172.16.83.92, length 46
23:05:02.241944 ARP, Request who-has 172.16.82.100 tell 172.16.82.42, length 46
23:05:02.241950 ARP, Request who-has 172.16.82.100 tell 172.16.82.151, length 46
23:05:02.243132 ARP, Request who-has 172.16.82.100 tell 172.16.82.141, length 46
23:05:02.249641 IP6 fe80::b506:5cbc:41f9:fc1f > ff02::1:fffd:d4: ICMP6, neighbor solicitation, who has fe80::1018:350b:18fd:d4, length 32
23:05:02.309013 IP 172.16.82.210.137 > 172.16.83.255.137: UDP, length 50
23:05:02.339094 IP6 fe80::8d0d:8b6:3623:e26e.53270 > ff02::1:3.5355: UDP, length 22
23:05:02.339153 IP 172.16.82.164.59800 > 224.0.0.252.5355: UDP, length 22
23:05:02.340005 IP6 fe80::4043:f4e:9316:a576 > ff02::1:ff23:e26e: ICMP6, neighbor solicitation, who has fe80::8d0d:8b6:3623:e26e, length 32
23:05:02.340355 IP 172.16.82.164.63749 > 224.0.0.252.5355: UDP, length 22
23:05:02.342326 IP6 fe80::8d0d:8b6:3623:e26e.49884 > ff02::1:3.5355: UDP, length 22
23:05:02.342389 IP 172.16.82.164.54943 > 224.0.0.252.5355: UDP, length 22
23:05:02.343429 IP6 fe80::8d0d:8b6:3623:e26e.53970 > ff02::1:3.5355: UDP, length 22
23:05:02.345562 IP 172.16.82.164.137 > 172.16.83.255.137: UDP, length 50
23:05:02.355151 IP6 fe80::3199:1e6b:94af:3ae0 > ff02::1:ff8c:2405: ICMP6, neighbor solicitation, who has fe80::f85b:d742:d78c:2405, length 32
23:05:02.361259 IP6 fe80::5071:fb5e:1eb4:2937 > ff02::1:fffd:d4: ICMP6, neighbor solicitation, who has fe80::1018:350b:18fd:d4, length 32
23:05:02.367343 IP 172.16.82.236.137 > 172.16.83.255.137: UDP, length 50
23:05:02.405659 IP6 fe80::bd10:f878:f44d:95ef > ff02::1:ff8c:2405: ICMP6, neighbor solicitation, who has fe80::f85b:d742:d78c:2405, length 32
23:05:02.432610 IP 172.16.82.73.62182 > 239.255.255.250.1900: UDP, length 133
23:05:02.434681 IP6 fe80::f03c:5c67:dfc4:e43 > ff02::1:fffd:d4: ICMP6, neighbor solicitation, who has fe80::1018:350b:18fd:d4, length 32
23:05:02.438645 IP6 fe80::8d0d:8b6:3623:e26e.54889 > ff02::1:3.5355: UDP, length 22
23:05:02.438714 IP 172.16.82.164.64605 > 224.0.0.252.5355: UDP, length 22
23:05:02.439408 IP6 fe80::8d0d:8b6:3623:e26e.65508 > ff02::1:3.5355: UDP, length 22
23:05:02.441092 IP6 fe80::8d0d:8b6:3623:e26e.57286 > ff02::1:3.5355: UDP, length 22
23:05:02.441153 IP 172.16.82.164.57736 > 224.0.0.252.5355: UDP, length 22
23:05:02.441848 IP6 fe80::8d0d:8b6:3623:e26e.60688 > ff02::1:3.5355: UDP, length 22
23:05:02.450462 IP 172.16.82.110.53594 > 255.255.255.255.10007: UDP, length 128
23:05:02.454443 IP 172.16.82.251.65308 > 255.255.255.255.10007: UDP, length 128
23:05:02.487632 IP6 fe80::933:3a0:cf4a:868d > ff02::1:fffd:d4: ICMP6, neighbor solicitation, who has fe80::1018:350b:18fd:d4, length 32
23:05:02.497033 IP6 fe80::557e:7710:6661:9d69 > ff02::1:ff91:af26: ICMP6, neighbor solicitation, who has fe80::5803:a1b9:fb91:af26, length 32
23:05:02.519373 ARP, Request who-has 169.254.0.212 tell 192.168.1.115, length 46
23:05:02.527499 IP 172.16.83.93.137 > 172.16.83.255.137: UDP, length 50
23:05:02.559259 ARP, Request who-has 172.16.82.39 tell 172.16.82.59, length 46
23:05:02.571341 ARP, Request who-has 172.16.82.141 tell 172.16.82.210, length 46
23:05:02.581973 IP6 fe80::cd4a:2c5d:bd13:7dc8 > ff02::1:fff4:a799: ICMP6, neighbor solicitation, who has fe80::54af:a5ad:a2f4:a799, length 32
23:05:02.582450 IP6 fe80::54af:a5ad:a2f4:a799 > ff02::1:ff13:7dc8: ICMP6, neighbor solicitation, who has fe80::cd4a:2c5d:bd13:7dc8, length 32
23:05:02.584518 IP 172.16.82.92.50794 > 255.255.255.255.10019: UDP, length 128
23:05:02.591569 IP6 fe80::55bd:31a6:9e4c:a4d > ff02::1:fffd:d4: ICMP6, neighbor solicitation, who has fe80::1018:350b:18fd:d4, length 32
23:05:02.612175 IP6 fe80::5130:c8f2:8e34:34a0 > ff02::1:ff91:af26: ICMP6, neighbor solicitation, who has fe80::5803:a1b9:fb91:af26, length 32
23:05:02.615034 IP6 fe80::9d9b:974e:b475:2b16 > ff02::1:ff91:af26: ICMP6, neighbor solicitation, who has fe80::5803:a1b9:fb91:af26, length 32
23:05:02.628117 IP 169.254.0.212.137 > 169.254.255.255.137: UDP, length 50
23:05:02.634833 IP6 fe80::6832:2d23:c106:70e8.546 > ff02::1:2.547: UDP, length 89
23:05:02.646566 ARP, Request who-has 169.254.0.212 tell 172.16.82.91, length 46
23:05:02.655307 IP 172.16.82.251.65309 > 255.255.255.255.10019: UDP, length 128
23:05:02.671655 STP 802.1d, Config, Flags [none], bridge-id 8016.00:12:43:31:26:80.8006, length 43
23:05:02.704113 IP6 fe80::7d09:418e:7c16:67ae.546 > ff02::1:2.547: UDP, length 94
23:05:02.713102 IP 172.16.82.236.65218 > 239.255.255.250.1900: UDP, length 133
23:05:02.731092 IP 172.16.82.110.53595 > 255.255.255.255.10019: UDP, length 128
23:05:02.741361 IP6 fe80::dc5a:8a53:b27c:b1bc > ff02::1:ff91:af26: ICMP6, neighbor solicitation, who has fe80::5803:a1b9:fb91:af26, length 32
23:05:02.781544 IP6 fe80::ddc7:6c9e:b9ad:8213 > ff02::1:ff91:af26: ICMP6, neighbor solicitation, who has fe80::5803:a1b9:fb91:af26, length 32
23:05:02.823651 IP 172.16.82.236.137 > 172.16.83.255.137: UDP, length 50
23:05:02.827629 IP6 fe80::618f:2710:ce92:4aba.546 > ff02::1:2.547: UDP, length 90
23:05:02.853477 IP6 fe80::b9ad:49e6:4d1a:35a9 > ff02::1:fffd:d4: ICMP6, neighbor solicitation, who has fe80::1018:350b:18fd:d4, length 32
23:05:02.855209 IP6 fe80::3199:1e6b:94af:3ae0 > ff02::1:fffd:d4: ICMP6, neighbor solicitation, who has fe80::1018:350b:18fd:d4, length 32
23:05:02.857050 IP 172.16.82.116.64994 > 255.255.255.255.10007: UDP, length 128
23:05:02.868862 ARP, Request who-has 172.16.82.132 tell 172.16.82.255, length 46
23:05:02.870187 ARP, Request who-has 172.16.82.255 tell 172.16.82.132, length 46
23:05:02.875491 IP 172.16.82.116.64995 > 255.255.255.255.10019: UDP, length 128
23:05:02.886838 ARP, Request who-has 172.16.82.39 tell 172.16.82.107, length 46
23:05:02.919377 IP6 fe80::c173:39de:d01e:e02d > ff02::1:fffd:d4: ICMP6, neighbor solicitation, who has fe80::1018:350b:18fd:d4, length 32
23:05:02.935089 IP 172.16.82.164.137 > 172.16.83.255.137: UDP, length 50
23:05:02.944870 IP 172.16.83.7.1900 > 239.255.255.250.1900: UDP, length 434
23:05:02.945166 IP 172.16.82.103.64517 > 255.255.255.255.10019: UDP, length 128
23:05:02.946662 IP6 fe80::e59c:f009:554a:495e.1900 > ff02::c.1900: UDP, length 444
23:05:02.955233 IP6 fe80::85cd:d2f9:bab6:b50d > ff02::1:ff91:af26: ICMP6, neighbor solicitation, who has fe80::5803:a1b9:fb91:af26, length 32
23:05:02.959619 IP 172.16.82.103.64518 > 255.255.255.255.10007: UDP, length 128
23:05:02.964362 ARP, Request who-has 172.16.82.202 tell 172.16.83.92, length 46
23:05:02.964489 IP6 fe80::108d:dbc7:68be:64e8 > ff02::1:fffd:d4: ICMP6, neighbor solicitation, who has fe80::1018:350b:18fd:d4, length 32
23:05:02.995613 IP 172.16.83.92.137 > 172.16.83.255.137: UDP, length 50
23:05:03.002887 IP6 fe80::e9e1:d2d9:d09b:1973 > ff02::1:fffd:d4: ICMP6, neighbor solicitation, who has fe80::1018:350b:18fd:d4, length 32
23:05:03.023936 IP6 fe80::2466:1d00:d731:16bc > ff02::1:ff91:af26: ICMP6, neighbor solicitation, who has fe80::5803:a1b9:fb91:af26, length 32
23:05:03.031166 IP 172.16.83.94.17500 > 255.255.255.255.17500: UDP, length 132
23:05:03.031628 IP 172.16.83.94.17500 > 172.16.83.255.17500: UDP, length 132
23:05:03.040602 IP6 fe80::f03c:5c67:dfc4:e43 > ff02::1:fffd:d4: ICMP6, neighbor solicitation, who has fe80::1018:350b:18fd:d4, length 32
23:05:03.055506 ARP, Request who-has 172.16.82.39 tell 172.16.82.86, length 46
23:05:03.058953 IP 172.16.82.210.137 > 172.16.83.255.137: UDP, length 50
23:05:03.060845 IP6 fe80::bd95:f1d:854f:5fe1 > ff02::1:fffd:d4: ICMP6, neighbor solicitation, who has fe80::1018:350b:18fd:d4, length 32
23:05:03.082418 IP 172.16.82.138.17500 > 255.255.255.255.17500: UDP, length 161
23:05:03.084691 IP 172.16.82.138.17500 > 172.16.83.255.17500: UDP, length 161
23:05:03.099858 IP6 fe80::6430:184a:c613:536f > ff02::1:ffaf:3ae0: ICMP6, neighbor solicitation, who has fe80::3199:1e6b:94af:3ae0, length 32
23:05:03.099908 IP6 fe80::6430:184a:c613:536f > ff02::1:ff91:af26: ICMP6, neighbor solicitation, who has fe80::5803:a1b9:fb91:af26, length 32
23:05:03.099994 ARP, Request who-has 172.16.83.254 tell 172.16.82.10, length 46
23:05:03.100268 IP6 fe80::3199:1e6b:94af:3ae0 > ff02::1:ff13:536f: ICMP6, neighbor solicitation, who has fe80::6430:184a:c613:536f, length 32
23:05:03.117529 IP 172.16.82.236.137 > 172.16.83.255.137: UDP, length 50
23:05:03.125316 ARP, Request who-has 172.16.82.39 tell 172.16.82.120, length 46
23:05:03.131580 ARP, Request who-has 172.16.82.39 tell 172.16.82.38, length 46
23:05:03.148332 ARP, Request who-has 172.16.82.39 tell 172.16.82.11, length 46
23:05:03.157827 IP6 fe80::55bd:31a6:9e4c:a4d > ff02::1:fffd:d4: ICMP6, neighbor solicitation, who has fe80::1018:350b:18fd:d4, length 32
23:05:03.164974 IP 172.16.82.92.50795 > 255.255.255.255.10007: UDP, length 128
23:05:03.215919 IP6 fe80::f0f2:d933:13:2d5f > ff02::1:fffd:d4: ICMP6, neighbor solicitation, who has fe80::1018:350b:18fd:d4, length 32
23:05:03.242967 ARP, Request who-has 172.16.82.100 tell 172.16.82.32, length 46
23:05:03.249698 IP6 fe80::b506:5cbc:41f9:fc1f > ff02::1:fffd:d4: ICMP6, neighbor solicitation, who has fe80::1018:350b:18fd:d4, length 32
23:05:03.263914 IP 172.16.82.141.52072 > 172.16.83.3.2987: tcp 0
23:05:03.284786 IP 172.16.82.123.54381 > 239.255.255.250.1900: UDP, length 133
23:05:03.355157 ARP, Request who-has 169.254.0.212 tell 192.168.1.115, length 46
23:05:03.355168 IP6 fe80::3199:1e6b:94af:3ae0 > ff02::1:ff8c:2405: ICMP6, neighbor solicitation, who has fe80::f85b:d742:d78c:2405, length 32
23:05:03.362116 ARP, Request who-has 169.254.0.212 tell 172.16.82.128, length 46
23:05:03.368379 IP6 fe80::5071:fb5e:1eb4:2937 > ff02::1:fffd:d4: ICMP6, neighbor solicitation, who has fe80::1018:350b:18fd:d4, length 32
23:05:03.370085 IP6 fe80::4af:aeb2:170a:5284.64098 > ff02::1:3.5355: UDP, length 22
23:05:03.370339 IP 172.16.82.202.59968 > 224.0.0.252.5355: UDP, length 22
23:05:03.395016 IP 172.16.82.10.65391 > 239.255.255.250.1900: UDP, length 133
23:05:03.395522 ARP, Request who-has 172.16.82.10 tell 172.16.82.47, length 46
23:05:03.395668 ARP, Request who-has 172.16.82.10 tell 172.16.82.151, length 46
23:05:03.396135 ARP, Request who-has 172.16.82.10 tell 172.16.83.92, length 46
23:05:03.396419 ARP, Request who-has 172.16.82.10 tell 172.16.82.42, length 46
23:05:03.396511 ARP, Request who-has 172.16.82.10 tell 172.16.82.141, length 46
23:05:03.401548 IP6 fe80::8d0d:8b6:3623:e26e > ff02::1:fffd:d4: ICMP6, neighbor solicitation, who has fe80::1018:350b:18fd:d4, length 32
23:05:03.403618 IP6 fe80::d3b:858:d02d:1e52 > ff02::1:fffd:d4: ICMP6, neighbor solicitation, who has fe80::1018:350b:18fd:d4, length 32
23:05:03.405722 IP6 fe80::bd10:f878:f44d:95ef > ff02::1:ff8c:2405: ICMP6, neighbor solicitation, who has fe80::f85b:d742:d78c:2405, length 32
23:05:03.464372 IP 172.16.82.110.53596 > 255.255.255.255.10007: UDP, length 128
23:05:03.469970 IP6 fe80::4af:aeb2:170a:5284.64098 > ff02::1:3.5355: UDP, length 22
23:05:03.470006 IP 172.16.82.202.59968 > 224.0.0.252.5355: UDP, length 22
23:05:03.470890 ARP, Request who-has 172.16.82.220 tell 172.16.82.190, length 46
23:05:03.472907 IP 172.16.82.251.65310 > 255.255.255.255.10007: UDP, length 128
23:05:03.487240 IP6 fe80::933:3a0:cf4a:868d > ff02::1:fffd:d4: ICMP6, neighbor solicitation, who has fe80::1018:350b:18fd:d4, length 32
23:05:03.497025 IP6 fe80::557e:7710:6661:9d69 > ff02::1:ff91:af26: ICMP6, neighbor solicitation, who has fe80::5803:a1b9:fb91:af26, length 32
23:05:03.511352 IP6 fe80::dc5a:8a53:b27c:b1bc > ff02::1:ff91:af26: ICMP6, neighbor solicitation, who has fe80::5803:a1b9:fb91:af26, length 32
23:05:03.572030 IP6 fe80::615d:5aef:d548:71d6.63124 > ff02::1:3.5355: UDP, length 43
23:05:03.572664 IP 172.16.82.177.57607 > 224.0.0.252.5355: UDP, length 43
23:05:03.573480 IP 172.16.82.236.137 > 172.16.83.255.137: UDP, length 50
23:05:03.574645 IP 172.16.82.148.50859 > 255.255.255.255.1211: UDP, length 75
23:05:03.603163 IP 172.16.82.92.50796 > 255.255.255.255.10019: UDP, length 128
23:05:03.613057 IP 172.16.82.37.2425 > 172.16.83.255.2425: UDP, length 111
23:05:03.615068 IP6 fe80::9d9b:974e:b475:2b16 > ff02::1:ff91:af26: ICMP6, neighbor solicitation, who has fe80::5803:a1b9:fb91:af26, length 32
23:05:03.617274 IP 172.16.82.20.2425 > 172.16.82.37.2425: UDP, length 104
23:05:03.627973 IP 172.16.83.93.137 > 172.16.83.255.137: UDP, length 50
23:05:03.649589 IP 172.16.82.116.65452 > 239.255.255.250.1900: UDP, length 133
23:05:03.670175 IP 172.16.82.202.137 > 172.16.83.255.137: UDP, length 50
23:05:03.671753 STP 802.1d, Config, Flags [Topology change], bridge-id 8016.00:12:43:31:26:80.8006, length 43
23:05:03.672095 IP6 fe80::615d:5aef:d548:71d6.63124 > ff02::1:3.5355: UDP, length 43
23:05:03.672238 IP 172.16.82.177.57607 > 224.0.0.252.5355: UDP, length 43
23:05:03.675666 IP 172.16.82.251.65311 > 255.255.255.255.10019: UDP, length 128
23:05:03.690358 IP6 fe80::54af:a5ad:a2f4:a799.54320 > ff02::c.1900: UDP, length 119
23:05:03.690367 IP 172.16.82.39.54323 > 239.255.255.250.1900: UDP, length 125
23:05:03.691585 IP6 fe80::54af:a5ad:a2f4:a799.54320 > ff02::c.1900: UDP, length 117
23:05:03.691795 IP 172.16.82.39.54323 > 239.255.255.250.1900: UDP, length 123
23:05:03.728136 IP6 fe80::ddc7:6c9e:b9ad:8213 > ff02::1:ff91:af26: ICMP6, neighbor solicitation, who has fe80::5803:a1b9:fb91:af26, length 32
23:05:03.744712 IP 172.16.82.110.53597 > 255.255.255.255.10019: UDP, length 128
23:05:03.755860 IP6 fe80::2466:1d00:d731:16bc > ff02::1:ff91:af26: ICMP6, neighbor solicitation, who has fe80::5803:a1b9:fb91:af26, length 32
23:05:03.760398 IP 172.16.83.92.137 > 172.16.83.255.137: UDP, length 50
23:05:03.769553 IP6 fe80::5130:c8f2:8e34:34a0 > ff02::1:ff91:af26: ICMP6, neighbor solicitation, who has fe80::5803:a1b9:fb91:af26, length 32
23:05:03.773543 IP6 fe80::6430:184a:c613:536f > ff02::1:ff91:af26: ICMP6, neighbor solicitation, who has fe80::5803:a1b9:fb91:af26, length 32
23:05:03.809145 IP 172.16.82.210.137 > 172.16.83.255.137: UDP, length 50
23:05:03.840220 IP 172.16.82.210.58452 > 239.255.255.250.1900: UDP, length 133
23:05:03.848833 IP 169.254.0.212.51893 > 239.255.255.250.1900: UDP, length 133
23:05:03.853580 IP6 fe80::b9ad:49e6:4d1a:35a9 > ff02::1:fffd:d4: ICMP6, neighbor solicitation, who has fe80::1018:350b:18fd:d4, length 32
23:05:03.865199 IP 172.16.82.116.62057 > 255.255.255.255.10007: UDP, length 128
23:05:03.867715 IP 172.16.82.236.137 > 172.16.83.255.137: UDP, length 50
23:05:03.873738 ARP, Request who-has 172.16.82.10 tell 172.16.82.177, length 46
23:05:03.874816 ARP, Request who-has 172.16.82.177 tell 172.16.82.10, length 46
23:05:03.879748 IP 172.16.82.116.62058 > 255.255.255.255.10019: UDP, length 128
23:05:03.915858 IP6 fe80::bd95:f1d:854f:5fe1 > ff02::1:fffd:d4: ICMP6, neighbor solicitation, who has fe80::1018:350b:18fd:d4, length 32
23:05:03.919476 IP6 fe80::c173:39de:d01e:e02d > ff02::1:fffd:d4: ICMP6, neighbor solicitation, who has fe80::1018:350b:18fd:d4, length 32
23:05:03.941972 IP6 fe80::8d0d:8b6:3623:e26e > ff02::1:fffd:d4: ICMP6, neighbor solicitation, who has fe80::1018:350b:18fd:d4, length 32
23:05:03.949410 IP 172.16.82.103.64519 > 255.255.255.255.10019: UDP, length 128
23:05:03.954467 IP 172.16.82.103.64520 > 255.255.255.255.10007: UDP, length 128
23:05:03.958803 IP 169.254.0.212.1900 > 239.255.255.250.1900: UDP, length 436
23:05:03.959135 IP6 fe80::1018:350b:18fd:d4.1900 > ff02::c.1900: UDP, length 442
23:05:03.962881 ARP, Request who-has 172.16.82.202 tell 172.16.83.92, length 46
23:05:03.963008 IP6 fe80::108d:dbc7:68be:64e8 > ff02::1:fffd:d4: ICMP6, neighbor solicitation, who has fe80::1018:350b:18fd:d4, length 32
23:05:03.968745 IP 169.254.0.212.1900 > 239.255.255.250.1900: UDP, length 445
23:05:03.968995 IP6 fe80::1018:350b:18fd:d4.1900 > ff02::c.1900: UDP, length 451
23:05:03.969241 IP 169.254.0.212.1900 > 239.255.255.250.1900: UDP, length 492
23:05:03.969752 IP6 fe80::1018:350b:18fd:d4.1900 > ff02::c.1900: UDP, length 498
23:05:03.970113 IP 169.254.0.212.1900 > 239.255.255.250.1900: UDP, length 500
23:05:03.970361 IP6 fe80::1018:350b:18fd:d4.1900 > ff02::c.1900: UDP, length 506
23:05:03.970451 IP6 fe80::2158:ba2e:7ca3:c004 > ff02::1:ff91:af26: ICMP6, neighbor solicitation, who has fe80::5803:a1b9:fb91:af26, length 32
23:05:03.977825 IP6 fe80::9477:b783:149c:805c > ff02::1:fffd:d4: ICMP6, neighbor solicitation, who has fe80::1018:350b:18fd:d4, length 32
23:05:03.991200 ARP, Request who-has 172.16.83.254 tell 172.16.82.202, length 46
23:05:04.003113 IP6 fe80::e9e1:d2d9:d09b:1973 > ff02::1:fffd:d4: ICMP6, neighbor solicitation, who has fe80::1018:350b:18fd:d4, length 32
23:05:04.031133 IP6 fe80::c5a4:399:5ac3:1870 > ff02::1:fffd:d4: ICMP6, neighbor solicitation, who has fe80::1018:350b:18fd:d4, length 32
23:05:04.040773 IP6 fe80::f03c:5c67:dfc4:e43 > ff02::1:fffd:d4: ICMP6, neighbor solicitation, who has fe80::1018:350b:18fd:d4, length 32
23:05:04.064219 IP6 fe80::2805:320b:8765:3b03 > ff02::1:fffd:d4: ICMP6, neighbor solicitation, who has fe80::1018:350b:18fd:d4, length 32
23:05:04.094210 IP 172.16.82.141.52077 > 172.16.83.18.2987: tcp 0
23:05:04.112265 IP6 fe80::d3b:858:d02d:1e52 > ff02::1:fffd:d4: ICMP6, neighbor solicitation, who has fe80::1018:350b:18fd:d4, length 32
23:05:04.123052 ARP, Request who-has 172.16.82.37 tell 172.16.82.202, length 46
23:05:04.124376 IP6 fe80::3199:1e6b:94af:3ae0 > ff02::1:fffd:d4: ICMP6, neighbor solicitation, who has fe80::1018:350b:18fd:d4, length 32
23:05:04.157986 IP6 fe80::55bd:31a6:9e4c:a4d > ff02::1:fffd:d4: ICMP6, neighbor solicitation, who has fe80::1018:350b:18fd:d4, length 32
23:05:04.174663 ARP, Request who-has 172.16.82.220 tell 172.16.82.190, length 46
23:05:04.178984 IP 172.16.82.92.50797 > 255.255.255.255.10007: UDP, length 128
23:05:04.205535 IP6 fe80::9467:3fc9:1447:e718 > ff02::1:ff91:af26: ICMP6, neighbor solicitation, who has fe80::5803:a1b9:fb91:af26, length 32
23:05:04.238487 ARP, Request who-has 172.16.82.118 tell 172.16.82.148, length 46
23:05:04.239836 ARP, Request who-has 172.16.82.148 tell 172.16.82.118, length 46
23:05:04.263412 IP6 fe80::e59c:f009:554a:495e > ff02::1:ffaf:3ae0: ICMP6, neighbor solicitation, who has fe80::3199:1e6b:94af:3ae0, length 32
23:05:04.263421 IP6 fe80::e59c:f009:554a:495e > ff02::1:ff91:af26: ICMP6, neighbor solicitation, who has fe80::5803:a1b9:fb91:af26, length 32
23:05:04.263545 ARP, Request who-has 172.16.83.254 tell 172.16.83.7, length 46
23:05:04.264517 IP6 fe80::3199:1e6b:94af:3ae0 > ff02::1:ff4a:495e: ICMP6, neighbor solicitation, who has fe80::e59c:f009:554a:495e, length 32
23:05:04.286537 ARP, Request who-has 172.16.82.118 tell 172.16.82.2, length 46
23:05:04.287188 ARP, Request who-has 172.16.82.2 tell 172.16.82.118, length 46
23:05:04.325979 IP6 fe80::c544:2ab9:965d:730f.546 > ff02::1:2.547: UDP, length 84
23:05:04.325993 IP 172.16.82.248.63898 > 239.255.255.250.1900: UDP, length 133
23:05:04.355304 ARP, Request who-has 169.254.0.212 tell 192.168.1.115, length 46
23:05:04.367526 IP 172.16.82.236.137 > 172.16.83.255.137: UDP, length 50
23:05:04.377592 IP 172.16.83.93.137 > 172.16.83.255.137: UDP, length 50
23:05:04.395897 ARP, Request who-has 172.16.82.10 tell 172.16.82.32, length 46
23:05:04.408413 IP6 fe80::1018:350b:18fd:d4.546 > ff02::1:2.547: UDP, length 95
23:05:04.415449 IP6 fe80::213e:2cb0:3aa3:389.546 > ff02::1:2.547: UDP, length 88
23:05:04.419944 IP 172.16.82.202.137 > 172.16.83.255.137: UDP, length 50
23:05:04.477926 IP 172.16.82.110.53598 > 255.255.255.255.10007: UDP, length 128
23:05:04.479610 IP 172.16.82.251.52457 > 255.255.255.255.10007: UDP, length 128
23:05:04.487377 IP6 fe80::618f:2710:ce92:4aba > ff02::1:ff91:af26: ICMP6, neighbor solicitation, who has fe80::5803:a1b9:fb91:af26, length 32
23:05:04.496584 ARP, Request who-has 169.254.0.212 tell 172.16.82.117, length 46
23:05:04.504414 ARP, Request who-has 172.16.82.118 tell 172.16.82.59, length 46
23:05:04.505725 ARP, Request who-has 172.16.82.59 tell 172.16.82.118, length 46
23:05:04.505851 IP6 fe80::8cde:eeea:1e2b:4e3.546 > ff02::1:2.547: UDP, length 94
23:05:04.511335 IP6 fe80::dc5a:8a53:b27c:b1bc > ff02::1:ff91:af26: ICMP6, neighbor solicitation, who has fe80::5803:a1b9:fb91:af26, length 32
23:05:04.537233 IP6 fe80::108d:dbc7:68be:64e8 > ff02::1:ff91:af26: ICMP6, neighbor solicitation, who has fe80::5803:a1b9:fb91:af26, length 32
23:05:04.541249 IP 172.16.82.124.17500 > 255.255.255.255.17500: UDP, length 112
23:05:04.544439 IP 172.16.82.124.17500 > 255.255.255.255.17500: UDP, length 112
23:05:04.544564 IP 172.16.82.124.17500 > 255.255.255.255.17500: UDP, length 112
23:05:04.544737 IP 172.16.82.124.17500 > 172.16.83.255.17500: UDP, length 112
23:05:04.546962 IP6 fe80::a8c0:4e9c:b638:147a > ff02::1:fffd:d4: ICMP6, neighbor solicitation, who has fe80::1018:350b:18fd:d4, length 32
23:05:04.566265 IP 172.16.82.210.68 > 255.255.255.255.67: UDP, length 300
23:05:04.570747 IP 172.16.82.210.137 > 172.16.83.255.137: UDP, length 50
23:05:04.573168 ARP, Request who-has 169.254.0.212 tell 172.16.82.14, length 46
23:05:04.577654 IP 172.16.83.7.62126 > 239.255.255.250.1900: UDP, length 133
23:05:04.578025 ARP, Request who-has 172.16.83.7 tell 172.16.83.92, length 46
23:05:04.578245 ARP, Request who-has 172.16.83.7 tell 172.16.82.151, length 46
23:05:04.579933 ARP, Request who-has 172.16.83.7 tell 172.16.82.32, length 46
23:05:04.596077 IP6 fe80::c5a4:399:5ac3:1870 > ff02::1:fffd:d4: ICMP6, neighbor solicitation, who has fe80::1018:350b:18fd:d4, length 32
23:05:04.612169 IP6 fe80::5130:c8f2:8e34:34a0 > ff02::1:ff91:af26: ICMP6, neighbor solicitation, who has fe80::5803:a1b9:fb91:af26, length 32
23:05:04.617318 IP 172.16.82.92.50798 > 255.255.255.255.10019: UDP, length 128
23:05:04.619258 IP 172.16.82.236.137 > 172.16.83.255.137: UDP, length 50
23:05:04.627194 ARP, Request who-has 172.16.82.32 tell 172.16.83.7, length 46
23:05:04.628732 IP 0.0.0.0.68 > 255.255.255.255.67: UDP, length 300
23:05:04.630180 IP 172.16.83.254.67 > 255.255.255.255.68: UDP, length 301
23:05:04.641652 IP6 fe80::b506:5cbc:41f9:fc1f > ff02::1:fffd:d4: ICMP6, neighbor solicitation, who has fe80::1018:350b:18fd:d4, length 32
23:05:04.672789 STP 802.1d, Config, Flags [Topology change], bridge-id 8016.00:12:43:31:26:80.8006, length 43
23:05:04.674748 IP 172.16.82.251.52458 > 255.255.255.255.10019: UDP, length 128
23:05:04.676398 IP6 fe80::8c22:1b1a:8c33:f2ec > ff02::1:ff91:af26: ICMP6, neighbor solicitation, who has fe80::5803:a1b9:fb91:af26, length 32
23:05:04.683099 IP6 fe80::f0f2:d933:13:2d5f > ff02::1:fffd:d4: ICMP6, neighbor solicitation, who has fe80::1018:350b:18fd:d4, length 32
23:05:04.691477 IP6 fe80::5071:fb5e:1eb4:2937 > ff02::1:fffd:d4: ICMP6, neighbor solicitation, who has fe80::1018:350b:18fd:d4, length 32
23:05:04.728372 IP6 fe80::ddc7:6c9e:b9ad:8213 > ff02::1:ff91:af26: ICMP6, neighbor solicitation, who has fe80::5803:a1b9:fb91:af26, length 32
23:05:04.750168 IP 172.16.82.202.54309 > 239.255.255.250.1900: UDP, length 133
23:05:04.750612 ARP, Request who-has 172.16.82.202 tell 172.16.82.42, length 46
23:05:04.750690 ARP, Request who-has 172.16.82.202 tell 172.16.82.47, length 46
23:05:04.750733 ARP, Request who-has 172.16.82.202 tell 172.16.82.151, length 46
23:05:04.755604 IP6 fe80::2466:1d00:d731:16bc > ff02::1:ff91:af26: ICMP6, neighbor solicitation, who has fe80::5803:a1b9:fb91:af26, length 32
23:05:04.756470 IP6 fe80::9477:b783:149c:805c > ff02::1:fffd:d4: ICMP6, neighbor solicitation, who has fe80::1018:350b:18fd:d4, length 32
23:05:04.759542 IP 172.16.82.110.53599 > 255.255.255.255.10019: UDP, length 128
23:05:04.773680 IP6 fe80::6430:184a:c613:536f > ff02::1:ff91:af26: ICMP6, neighbor solicitation, who has fe80::5803:a1b9:fb91:af26, length 32
23:05:04.811665 IP6 fe80::2805:320b:8765:3b03 > ff02::1:fffd:d4: ICMP6, neighbor solicitation, who has fe80::1018:350b:18fd:d4, length 32
23:05:04.833885 IP6 fe80::933:3a0:cf4a:868d > ff02::1:fffd:d4: ICMP6, neighbor solicitation, who has fe80::1018:350b:18fd:d4, length 32
23:05:04.834855 IP6 fe80::a119:10c4:b1ea:cb51 > ff02::1:ff91:af26: ICMP6, neighbor solicitation, who has fe80::5803:a1b9:fb91:af26, length 32
23:05:04.856362 IP6 fe80::3199:1e6b:94af:3ae0 > ff02::1:fffd:d4: ICMP6, neighbor solicitation, who has fe80::1018:350b:18fd:d4, length 32
23:05:04.871467 IP 172.16.82.116.51867 > 255.255.255.255.10007: UDP, length 128
23:05:04.883400 IP 172.16.82.116.51868 > 255.255.255.255.10019: UDP, length 128
23:05:04.885370 IP 172.16.82.180.59141 > 239.255.255.250.1900: UDP, length 133
23:05:04.886843 IP6 fe80::3978:b61b:56ab:d7ed.546 > ff02::1:2.547: UDP, length 89
23:05:04.916079 IP6 fe80::bd95:f1d:854f:5fe1 > ff02::1:fffd:d4: ICMP6, neighbor solicitation, who has fe80::1018:350b:18fd:d4, length 32
23:05:04.942042 IP6 fe80::8d0d:8b6:3623:e26e > ff02::1:fffd:d4: ICMP6, neighbor solicitation, who has fe80::1018:350b:18fd:d4, length 32
23:05:04.949327 IP 172.16.82.103.64521 > 255.255.255.255.10019: UDP, length 128
23:05:04.954015 IP 172.16.82.103.64522 > 255.255.255.255.10007: UDP, length 128
23:05:04.958933 IP6 fe80::2158:ba2e:7ca3:c004 > ff02::1:ff91:af26: ICMP6, neighbor solicitation, who has fe80::5803:a1b9:fb91:af26, length 32
23:05:05.034545 IP 172.16.82.69.50528 > 239.255.255.250.1900: UDP, length 133
23:05:05.058851 ARP, Request who-has 169.254.0.212 tell 172.16.82.148, length 46
23:05:05.064799 IP6 fe80::d050:581:b3eb:5c66.546 > ff02::1:2.547: UDP, length 89
23:05:05.085903 IP6 fe80::108d:dbc7:68be:64e8 > ff02::1:fffd:d4: ICMP6, neighbor solicitation, who has fe80::1018:350b:18fd:d4, length 32
23:05:05.087748 IP6 fe80::9467:3fc9:1447:e718 > ff02::1:ff91:af26: ICMP6, neighbor solicitation, who has fe80::5803:a1b9:fb91:af26, length 32
23:05:05.090626 IP 172.16.83.65.52611 > 239.255.255.250.1900: UDP, length 133
23:05:05.095020 IP6 fe80::d953:461d:f6dc:1216 > ff02::1:ff91:af26: ICMP6, neighbor solicitation, who has fe80::5803:a1b9:fb91:af26, length 32
23:05:05.112211 IP6 fe80::d3b:858:d02d:1e52 > ff02::1:fffd:d4: ICMP6, neighbor solicitation, who has fe80::1018:350b:18fd:d4, length 32
23:05:05.117608 IP 172.16.82.236.137 > 172.16.83.255.137: UDP, length 50
23:05:05.120651 IP6 fe80::c173:39de:d01e:e02d > ff02::1:fffd:d4: ICMP6, neighbor solicitation, who has fe80::1018:350b:18fd:d4, length 32
23:05:05.127532 IP 172.16.83.93.137 > 172.16.83.255.137: UDP, length 50
23:05:05.131241 IP6 fe80::e9e1:d2d9:d09b:1973 > ff02::1:fffd:d4: ICMP6, neighbor solicitation, who has fe80::1018:350b:18fd:d4, length 32
23:05:05.135273 ARP, Request who-has 172.16.83.254 tell 172.16.82.236, length 46
23:05:05.169965 IP6 fe80::e59c:f009:554a:495e > ff02::1:ff91:af26: ICMP6, neighbor solicitation, who has fe80::5803:a1b9:fb91:af26, length 32
23:05:05.170014 IP 172.16.82.202.137 > 172.16.83.255.137: UDP, length 50
23:05:05.172714 IP6 fe80::b9ad:49e6:4d1a:35a9 > ff02::1:fffd:d4: ICMP6, neighbor solicitation, who has fe80::1018:350b:18fd:d4, length 32
23:05:05.174872 ARP, Request who-has 172.16.82.220 tell 172.16.82.190, length 46
23:05:05.196436 IP 172.16.82.92.50799 > 255.255.255.255.10007: UDP, length 128
23:05:05.215999 IP6 fe80::f0f2:d933:13:2d5f > ff02::1:fffd:d4: ICMP6, neighbor solicitation, who has fe80::1018:350b:18fd:d4, length 32
23:05:05.232304 IP6 fe80::9467:3fc9:1447:e718 > ff02::1:ffaf:3ae0: ICMP6, neighbor solicitation, who has fe80::3199:1e6b:94af:3ae0, length 32
23:05:05.232433 IP6 fe80::9467:3fc9:1447:e718 > ff02::1:ff91:af26: ICMP6, neighbor solicitation, who has fe80::5803:a1b9:fb91:af26, length 32
23:05:05.232674 ARP, Request who-has 172.16.83.254 tell 172.16.82.225, length 46
23:05:05.233422 IP6 fe80::3199:1e6b:94af:3ae0 > ff02::1:ff47:e718: ICMP6, neighbor solicitation, who has fe80::9467:3fc9:1447:e718, length 32
23:05:05.242406 IP 172.16.82.100.60693 > 239.255.255.250.1900: UDP, length 133
23:05:05.249629 IP6 fe80::b506:5cbc:41f9:fc1f > ff02::1:fffd:d4: ICMP6, neighbor solicitation, who has fe80::1018:350b:18fd:d4, length 32
23:05:05.279732 IP6 fe80::45e5:c83c:215a:eebe > ff02::1:ff91:af26: ICMP6, neighbor solicitation, who has fe80::5803:a1b9:fb91:af26, length 32
23:05:05.286306 IP6 fe80::8d0d:8b6:3623:e26e.57435 > ff02::1:3.5355: UDP, length 28
23:05:05.286370 IP 172.16.82.164.61385 > 224.0.0.252.5355: UDP, length 28
23:05:05.286672 IP6 fe80::8d0d:8b6:3623:e26e.60569 > ff02::1:3.5355: UDP, length 28
23:05:05.286696 IP 172.16.82.164.49773 > 224.0.0.252.5355: UDP, length 28
23:05:05.286976 IP6 fe80::8d0d:8b6:3623:e26e.50416 > ff02::1:3.5355: UDP, length 28
23:05:05.287017 IP 172.16.82.164.60393 > 224.0.0.252.5355: UDP, length 28
23:05:05.304314 IP6 fe80::618f:2710:ce92:4aba > ff02::1:ff91:af26: ICMP6, neighbor solicitation, who has fe80::5803:a1b9:fb91:af26, length 32
23:05:05.320187 IP 172.16.82.210.137 > 172.16.83.255.137: UDP, length 50
23:05:05.357820 ARP, Request who-has 172.16.82.132 tell 172.16.83.25, length 46
23:05:05.357861 IP6 fe80::dd6b:c527:9802:7240 > ff02::1:fff4:a799: ICMP6, neighbor solicitation, who has fe80::54af:a5ad:a2f4:a799, length 32
23:05:05.357872 ARP, Request who-has 172.16.82.39 tell 172.16.83.25, length 46
23:05:05.357876 ARP, Request who-has 172.16.82.148 tell 172.16.83.25, length 46
23:05:05.357892 IP6 fe80::dd6b:c527:9802:7240 > ff02::1:ffc3:1870: ICMP6, neighbor solicitation, who has fe80::c5a4:399:5ac3:1870, length 32
23:05:05.357911 IP6 fe80::dd6b:c527:9802:7240 > ff02::1:ff6a:88e9: ICMP6, neighbor solicitation, who has fe80::cd90:fad8:126a:88e9, length 32
23:05:05.357920 ARP, Request who-has 172.16.82.2 tell 172.16.83.25, length 46
23:05:05.358379 IP6 fe80::54af:a5ad:a2f4:a799 > ff02::1:ff02:7240: ICMP6, neighbor solicitation, who has fe80::dd6b:c527:9802:7240, length 32
23:05:05.358523 IP6 fe80::c5a4:399:5ac3:1870 > ff02::1:ff02:7240: ICMP6, neighbor solicitation, who has fe80::dd6b:c527:9802:7240, length 32
23:05:05.358624 IP6 fe80::cd90:fad8:126a:88e9 > ff02::1:ff02:7240: ICMP6, neighbor solicitation, who has fe80::dd6b:c527:9802:7240, length 32
23:05:05.361429 IP6 fe80::5071:fb5e:1eb4:2937 > ff02::1:fffd:d4: ICMP6, neighbor solicitation, who has fe80::1018:350b:18fd:d4, length 32
23:05:05.368641 IP 172.16.82.236.137 > 172.16.83.255.137: UDP, length 50
23:05:05.372274 IP6 fe80::4af:aeb2:170a:5284.54960 > ff02::1:3.5355: UDP, length 22
23:05:05.372520 IP 172.16.82.202.54354 > 224.0.0.252.5355: UDP, length 22
23:05:05.386119 IP6 fe80::8d0d:8b6:3623:e26e.57435 > ff02::1:3.5355: UDP, length 28
23:05:05.386133 IP6 fe80::8d0d:8b6:3623:e26e.60569 > ff02::1:3.5355: UDP, length 28
23:05:05.386137 IP 172.16.82.164.49773 > 224.0.0.252.5355: UDP, length 28
23:05:05.386141 IP 172.16.82.164.61385 > 224.0.0.252.5355: UDP, length 28
23:05:05.387124 IP6 fe80::8d0d:8b6:3623:e26e.50416 > ff02::1:3.5355: UDP, length 28
23:05:05.387131 IP 172.16.82.164.60393 > 224.0.0.252.5355: UDP, length 28
23:05:05.402438 IP6 fe80::3199:1e6b:94af:3ae0 > ff02::1:ff8c:2405: ICMP6, neighbor solicitation, who has fe80::f85b:d742:d78c:2405, length 32
23:05:05.418664 IP6 fe80::a8c0:4e9c:b638:147a > ff02::1:fffd:d4: ICMP6, neighbor solicitation, who has fe80::1018:350b:18fd:d4, length 32
23:05:05.430880 IP6 fe80::f03c:5c67:dfc4:e43 > ff02::1:fffd:d4: ICMP6, neighbor solicitation, who has fe80::1018:350b:18fd:d4, length 32
23:05:05.432600 IP 172.16.82.73.62182 > 239.255.255.250.1900: UDP, length 133
23:05:05.437224 IP6 fe80::5cc:4375:5217:31f7 > ff02::1:fffd:d4: ICMP6, neighbor solicitation, who has fe80::1018:350b:18fd:d4, length 32
23:05:05.460149 IP6 fe80::108d:dbc7:68be:64e8 > ff02::1:ff91:af26: ICMP6, neighbor solicitation, who has fe80::5803:a1b9:fb91:af26, length 32
23:05:05.472081 IP6 fe80::4af:aeb2:170a:5284.54960 > ff02::1:3.5355: UDP, length 22
23:05:05.472165 IP 172.16.82.202.54354 > 224.0.0.252.5355: UDP, length 22
23:05:05.487830 IP6 fe80::933:3a0:cf4a:868d > ff02::1:fffd:d4: ICMP6, neighbor solicitation, who has fe80::1018:350b:18fd:d4, length 32
23:05:05.492380 IP 172.16.82.110.53600 > 255.255.255.255.10007: UDP, length 128
23:05:05.492501 IP 172.16.82.251.52459 > 255.255.255.255.10007: UDP, length 128
23:05:05.505038 IP6 fe80::4af:aeb2:170a:5284.546 > ff02::1:2.547: UDP, length 92
23:05:05.548143 IP6 fe80::89fa:2f51:1af4:e790 > ff02::1:ff91:af26: ICMP6, neighbor solicitation, who has fe80::5803:a1b9:fb91:af26, length 32
23:05:05.566991 IP 172.16.82.225.57524 > 239.255.255.250.1900: UDP, length 133
23:05:05.567578 ARP, Request who-has 172.16.82.225 tell 172.16.82.42, length 46
23:05:05.567696 ARP, Request who-has 172.16.82.225 tell 172.16.82.151, length 46
23:05:05.567943 ARP, Request who-has 172.16.82.225 tell 172.16.82.47, length 46
23:05:05.568655 ARP, Request who-has 172.16.82.225 tell 172.16.82.32, length 46
23:05:05.586565 IP 172.16.82.164.137 > 172.16.83.255.137: UDP, length 50
23:05:05.586575 IP 172.16.82.164.137 > 172.16.83.255.137: UDP, length 50
23:05:05.587500 IP 172.16.82.164.137 > 172.16.83.255.137: UDP, length 50
23:05:05.588057 IP6 fe80::55bd:31a6:9e4c:a4d > ff02::1:fffd:d4: ICMP6, neighbor solicitation, who has fe80::1018:350b:18fd:d4, length 32
23:05:05.596246 IP6 fe80::c5a4:399:5ac3:1870 > ff02::1:fffd:d4: ICMP6, neighbor solicitation, who has fe80::1018:350b:18fd:d4, length 32
23:05:05.603492 IP 172.16.82.255.17500 > 255.255.255.255.17500: UDP, length 112
