21:52:29.383443 IP 127.0.0.1.35094 > 127.0.0.1.25: tcp 0
21:52:29.383462 IP 127.0.0.1.25 > 127.0.0.1.35094: tcp 0
21:52:29.383474 IP 127.0.0.1.35094 > 127.0.0.1.25: tcp 0
21:52:29.577087 IP 127.0.0.1.25 > 127.0.0.1.35094: tcp 48
21:52:29.577168 IP 127.0.0.1.35094 > 127.0.0.1.25: tcp 0
21:52:29.577446 IP 127.0.0.1.35094 > 127.0.0.1.25: tcp 18
21:52:29.577454 IP 127.0.0.1.25 > 127.0.0.1.35094: tcp 0
21:52:29.577522 IP 127.0.0.1.25 > 127.0.0.1.35094: tcp 142
21:52:29.578094 IP 127.0.0.1.35094 > 127.0.0.1.25: tcp 21
21:52:29.578158 IP 127.0.0.1.25 > 127.0.0.1.35094: tcp 14
21:52:29.578201 IP 127.0.0.1.35094 > 127.0.0.1.25: tcp 12
21:52:29.578288 IP 127.0.0.1.25 > 127.0.0.1.35094: tcp 40
21:52:29.578323 IP 127.0.0.1.35094 > 127.0.0.1.25: tcp 6
21:52:29.578358 IP 127.0.0.1.25 > 127.0.0.1.35094: tcp 14
21:52:29.580380 IP 127.0.0.1.35094 > 127.0.0.1.25: tcp 0
21:52:29.580685 IP 127.0.0.1.25 > 127.0.0.1.35094: tcp 0
21:52:29.580704 IP 127.0.0.1.35094 > 127.0.0.1.25: tcp 0
21:52:37.215435 IP 127.0.0.1.38701 > 127.0.0.1.50007: UDP, length 5
21:52:44.480130 IP 127.0.0.1.38701 > 127.0.0.1.50007: UDP, length 7
21:52:58.801394 IP 127.0.0.1.36268 > 127.0.0.1.8000: tcp 0
21:52:58.801410 IP 127.0.0.1.8000 > 127.0.0.1.36268: tcp 0
21:52:58.801419 IP 127.0.0.1.36268 > 127.0.0.1.8000: tcp 0
21:52:58.801743 IP 127.0.0.1.36269 > 127.0.0.1.8000: tcp 0
21:52:58.801751 IP 127.0.0.1.8000 > 127.0.0.1.36269: tcp 0
21:52:58.801757 IP 127.0.0.1.36269 > 127.0.0.1.8000: tcp 0
21:52:58.880779 IP 127.0.0.1.36268 > 127.0.0.1.8000: tcp 369
21:52:58.880867 IP 127.0.0.1.8000 > 127.0.0.1.36268: tcp 0
21:52:58.881381 IP 127.0.0.1.8000 > 127.0.0.1.36268: tcp 17
21:52:58.881393 IP 127.0.0.1.36268 > 127.0.0.1.8000: tcp 0
21:52:58.881417 IP 127.0.0.1.8000 > 127.0.0.1.36268: tcp 38
21:52:58.881423 IP 127.0.0.1.36268 > 127.0.0.1.8000: tcp 0
21:52:58.881453 IP 127.0.0.1.8000 > 127.0.0.1.36268: tcp 37
21:52:58.881459 IP 127.0.0.1.36268 > 127.0.0.1.8000: tcp 0
21:52:58.881477 IP 127.0.0.1.8000 > 127.0.0.1.36268: tcp 40
21:52:58.881482 IP 127.0.0.1.36268 > 127.0.0.1.8000: tcp 0
21:52:58.881496 IP 127.0.0.1.8000 > 127.0.0.1.36268: tcp 21
21:52:58.881501 IP 127.0.0.1.36268 > 127.0.0.1.8000: tcp 0
21:52:58.881515 IP 127.0.0.1.8000 > 127.0.0.1.36268: tcp 2
21:52:58.881521 IP 127.0.0.1.36268 > 127.0.0.1.8000: tcp 0
21:52:58.881539 IP 127.0.0.1.8000 > 127.0.0.1.36268: tcp 224
21:52:58.881545 IP 127.0.0.1.36268 > 127.0.0.1.8000: tcp 0
21:52:59.207927 IP 127.0.0.1.36268 > 127.0.0.1.8000: tcp 320
21:52:59.208546 IP 127.0.0.1.8000 > 127.0.0.1.36268: tcp 29
21:52:59.208569 IP 127.0.0.1.36268 > 127.0.0.1.8000: tcp 0
21:52:59.208596 IP 127.0.0.1.8000 > 127.0.0.1.36268: tcp 38
21:52:59.208604 IP 127.0.0.1.36268 > 127.0.0.1.8000: tcp 0
21:52:59.208638 IP 127.0.0.1.8000 > 127.0.0.1.36268: tcp 37
21:52:59.208645 IP 127.0.0.1.36268 > 127.0.0.1.8000: tcp 0
21:52:59.208664 IP 127.0.0.1.8000 > 127.0.0.1.36268: tcp 25
21:52:59.208671 IP 127.0.0.1.36268 > 127.0.0.1.8000: tcp 0
21:52:59.208688 IP 127.0.0.1.8000 > 127.0.0.1.36268: tcp 19
21:52:59.208694 IP 127.0.0.1.36268 > 127.0.0.1.8000: tcp 0
21:52:59.208712 IP 127.0.0.1.8000 > 127.0.0.1.36268: tcp 2
21:52:59.208719 IP 127.0.0.1.36268 > 127.0.0.1.8000: tcp 0
21:52:59.208736 IP 127.0.0.1.8000 > 127.0.0.1.36268: tcp 195
21:52:59.208750 IP 127.0.0.1.36268 > 127.0.0.1.8000: tcp 0
21:52:59.208792 IP 127.0.0.1.8000 > 127.0.0.1.36268: tcp 0
21:52:59.210471 IP 127.0.0.1.36268 > 127.0.0.1.8000: tcp 0
21:52:59.210516 IP 127.0.0.1.8000 > 127.0.0.1.36268: tcp 0
21:53:06.208918 IP 127.0.0.1.36269 > 127.0.0.1.8000: tcp 415
21:53:06.208970 IP 127.0.0.1.8000 > 127.0.0.1.36269: tcp 0
21:53:06.209598 IP 127.0.0.1.8000 > 127.0.0.1.36269: tcp 17
21:53:06.209619 IP 127.0.0.1.36269 > 127.0.0.1.8000: tcp 0
21:53:06.209660 IP 127.0.0.1.8000 > 127.0.0.1.36269: tcp 38
21:53:06.209672 IP 127.0.0.1.36269 > 127.0.0.1.8000: tcp 0
21:53:06.209726 IP 127.0.0.1.8000 > 127.0.0.1.36269: tcp 37
21:53:06.209739 IP 127.0.0.1.36269 > 127.0.0.1.8000: tcp 0
21:53:06.209769 IP 127.0.0.1.8000 > 127.0.0.1.36269: tcp 26
21:53:06.209780 IP 127.0.0.1.36269 > 127.0.0.1.8000: tcp 0
21:53:06.209819 IP 127.0.0.1.8000 > 127.0.0.1.36269: tcp 21
21:53:06.209830 IP 127.0.0.1.36269 > 127.0.0.1.8000: tcp 0
21:53:06.209880 IP 127.0.0.1.8000 > 127.0.0.1.36269: tcp 46
21:53:06.209891 IP 127.0.0.1.36269 > 127.0.0.1.8000: tcp 0
21:53:06.209918 IP 127.0.0.1.8000 > 127.0.0.1.36269: tcp 2
21:53:06.209927 IP 127.0.0.1.36269 > 127.0.0.1.8000: tcp 0
21:53:06.209978 IP 127.0.0.1.8000 > 127.0.0.1.36269: tcp 554
21:53:06.209993 IP 127.0.0.1.36269 > 127.0.0.1.8000: tcp 0
21:53:06.377503 IP 127.0.0.1.36269 > 127.0.0.1.8000: tcp 320
21:53:06.377995 IP 127.0.0.1.8000 > 127.0.0.1.36269: tcp 29
21:53:06.378012 IP 127.0.0.1.36269 > 127.0.0.1.8000: tcp 0
21:53:06.378032 IP 127.0.0.1.8000 > 127.0.0.1.36269: tcp 38
21:53:06.378038 IP 127.0.0.1.36269 > 127.0.0.1.8000: tcp 0
21:53:06.378066 IP 127.0.0.1.8000 > 127.0.0.1.36269: tcp 37
21:53:06.378071 IP 127.0.0.1.36269 > 127.0.0.1.8000: tcp 0
21:53:06.378086 IP 127.0.0.1.8000 > 127.0.0.1.36269: tcp 25
21:53:06.378091 IP 127.0.0.1.36269 > 127.0.0.1.8000: tcp 0
21:53:06.378104 IP 127.0.0.1.8000 > 127.0.0.1.36269: tcp 19
21:53:06.378109 IP 127.0.0.1.36269 > 127.0.0.1.8000: tcp 0
21:53:06.378123 IP 127.0.0.1.8000 > 127.0.0.1.36269: tcp 2
21:53:06.378128 IP 127.0.0.1.36269 > 127.0.0.1.8000: tcp 0
21:53:06.378141 IP 127.0.0.1.8000 > 127.0.0.1.36269: tcp 195
21:53:06.378147 IP 127.0.0.1.36269 > 127.0.0.1.8000: tcp 0
21:53:06.378184 IP 127.0.0.1.8000 > 127.0.0.1.36269: tcp 0
21:53:06.379304 IP 127.0.0.1.36269 > 127.0.0.1.8000: tcp 0
21:53:06.379333 IP 127.0.0.1.8000 > 127.0.0.1.36269: tcp 0
21:53:07.017397 IP 127.0.0.1.36271 > 127.0.0.1.8000: tcp 0
21:53:07.017416 IP 127.0.0.1.8000 > 127.0.0.1.36271: tcp 0
21:53:07.017428 IP 127.0.0.1.36271 > 127.0.0.1.8000: tcp 0
21:53:07.017647 IP 127.0.0.1.36272 > 127.0.0.1.8000: tcp 0
21:53:07.017658 IP 127.0.0.1.8000 > 127.0.0.1.36272: tcp 0
