02:42:51.683805 IP 172.16.82.10.17500 > 172.16.83.255.17500: UDP, length 121
02:42:51.787086 IP6 fe80::e4a4:f:6e97:f686.546 > ff02::1:2.547: UDP, length 88
02:42:51.801968 IP6 fe80::719d:76c7:d04d:92cc > ff02::1:ffaf:3ae0: ICMP6, neighbor solicitation, who has fe80::3199:1e6b:94af:3ae0, length 32
02:42:51.922746 IP 172.16.82.20.17500 > 255.255.255.255.17500: UDP, length 213
02:42:51.923171 IP 172.16.82.20.17500 > 172.16.83.255.17500: UDP, length 213
02:42:51.994364 IP 74.125.236.114.443 > 172.16.82.20.35262: tcp 98
02:42:51.994398 IP 172.16.82.20.35262 > 74.125.236.114.443: tcp 0
02:42:51.994405 IP 74.125.236.114.443 > 172.16.82.20.35262: tcp 0
02:42:51.994731 IP 172.16.82.20.35262 > 74.125.236.114.443: tcp 0
02:42:51.994852 IP 74.125.236.114.443 > 172.16.82.20.35262: tcp 0
02:42:52.229039 IP6 fe80::b4c7:3b4b:915:9cc4 > ff02::1:ffaf:3ae0: ICMP6, neighbor solicitation, who has fe80::3199:1e6b:94af:3ae0, length 32
02:42:52.426362 IP 172.16.83.5.64509 > 255.255.255.255.10019: UDP, length 128
02:42:52.428213 IP 172.16.83.5.64511 > 255.255.255.255.10007: UDP, length 128
02:42:52.432266 IP 172.16.82.103.56744 > 255.255.255.255.10019: UDP, length 128
02:42:52.432370 IP 172.16.82.103.56745 > 255.255.255.255.10007: UDP, length 128
02:42:52.544844 STP 802.1d, Config, Flags [Topology change], bridge-id 8016.00:12:43:31:26:80.8006, length 43
02:42:52.761670 IP6 fe80::b4c7:3b4b:915:9cc4 > ff02::1:ffaf:3ae0: ICMP6, neighbor solicitation, who has fe80::3199:1e6b:94af:3ae0, length 32
02:42:52.763010 IP6 fe80::719d:76c7:d04d:92cc > ff02::1:ffaf:3ae0: ICMP6, neighbor solicitation, who has fe80::3199:1e6b:94af:3ae0, length 32
02:42:52.893294 IP 172.16.82.165.17500 > 255.255.255.255.17500: UDP, length 241
02:42:52.896598 IP 172.16.82.165.17500 > 172.16.83.255.17500: UDP, length 241
02:42:52.908182 IP6 fe80::8a1:8a5b:ad90:3416 > ff02::1:ffaf:3ae0: ICMP6, neighbor solicitation, who has fe80::3199:1e6b:94af:3ae0, length 32
02:42:52.908193 ARP, Request who-has 172.16.83.254 tell 172.16.82.22, length 46
02:42:52.917852 IP6 fe80::b9ad:49e6:4d1a:35a9 > ff02::1:ffaf:3ae0: ICMP6, neighbor solicitation, who has fe80::3199:1e6b:94af:3ae0, length 32
02:42:53.173004 IP 172.16.82.213.17500 > 255.255.255.255.17500: UDP, length 132
02:42:53.173544 IP 172.16.82.213.17500 > 172.16.83.255.17500: UDP, length 132
02:42:53.188988 IP 172.16.82.22.64595 > 239.255.255.250.1900: UDP, length 133
02:42:53.384280 ARP, Request who-has 172.16.82.22 tell 172.16.82.183, length 46
02:42:53.430394 IP 172.16.83.5.64513 > 255.255.255.255.10019: UDP, length 128
02:42:53.430537 IP 172.16.83.5.64514 > 255.255.255.255.10007: UDP, length 128
02:42:53.436818 IP 172.16.82.103.56746 > 255.255.255.255.10019: UDP, length 128
02:42:53.436956 IP 172.16.82.103.56747 > 255.255.255.255.10007: UDP, length 128
02:42:53.466069 IP 172.16.82.150.53666 > 239.255.255.250.1900: UDP, length 133
02:42:53.521219 IP6 fe80::b9ad:49e6:4d1a:35a9 > ff02::1:ffaf:3ae0: ICMP6, neighbor solicitation, who has fe80::3199:1e6b:94af:3ae0, length 32
02:42:53.633573 IP 74.125.236.108.443 > 172.16.82.20.45166: tcp 61
02:42:53.633610 IP 172.16.82.20.45166 > 74.125.236.108.443: tcp 0
02:42:53.633619 IP 74.125.236.108.443 > 172.16.82.20.45166: tcp 37
02:42:53.633965 IP 172.16.82.20.45166 > 74.125.236.108.443: tcp 0
02:42:53.634084 IP 74.125.236.108.443 > 172.16.82.20.45166: tcp 0
02:42:53.763038 IP6 fe80::719d:76c7:d04d:92cc > ff02::1:ffaf:3ae0: ICMP6, neighbor solicitation, who has fe80::3199:1e6b:94af:3ae0, length 32
02:42:53.763388 IP6 fe80::b4c7:3b4b:915:9cc4 > ff02::1:ffaf:3ae0: ICMP6, neighbor solicitation, who has fe80::3199:1e6b:94af:3ae0, length 32
02:42:53.904560 IP6 fe80::8a1:8a5b:ad90:3416 > ff02::1:ffaf:3ae0: ICMP6, neighbor solicitation, who has fe80::3199:1e6b:94af:3ae0, length 32
02:42:53.907292 IP 74.125.236.125.443 > 172.16.82.20.58291: tcp 61
02:42:53.907320 IP 172.16.82.20.58291 > 74.125.236.125.443: tcp 0
02:42:53.907356 IP 74.125.236.125.443 > 172.16.82.20.58291: tcp 37
02:42:53.907594 IP 172.16.82.20.58291 > 74.125.236.125.443: tcp 0
02:42:53.907743 IP 74.125.236.125.443 > 172.16.82.20.58291: tcp 0
02:42:54.045008 ARP, Request who-has 172.16.82.183 tell 172.16.82.239, length 46
02:42:54.063899 ARP, Request who-has 172.16.82.239 tell 172.16.82.183, length 46
02:42:54.256266 IP6 fe80::e59c:f009:554a:495e.546 > ff02::1:2.547: UDP, length 91
02:42:54.301224 ARP, Request who-has 172.16.83.254 tell 172.16.82.206, length 46
02:42:54.312624 ARP, Reply 172.16.83.254 is-at 54:75:d0:70:d2:3f, length 46
02:42:54.313578 IP 172.16.68.31.53 > 172.16.82.206.56317: UDP, length 93
02:42:54.315636 IP 172.16.82.174.64035 > 239.255.255.250.1900: UDP, length 133
02:42:54.365913 IP6 fe80::e59c:f009:554a:495e.62646 > ff02::1:3.5355: UDP, length 24
02:42:54.366140 IP 172.16.82.206.49815 > 224.0.0.252.5355: UDP, length 24
02:42:54.430780 IP6 fe80::9d9b:974e:b475:2b16 > ff02::1:ffaf:3ae0: ICMP6, neighbor solicitation, who has fe80::3199:1e6b:94af:3ae0, length 32
02:42:54.440497 IP 172.16.82.103.56748 > 255.255.255.255.10019: UDP, length 128
02:42:54.441144 IP 172.16.82.103.56749 > 255.255.255.255.10007: UDP, length 128
02:42:54.443025 IP 172.16.83.5.64517 > 255.255.255.255.10019: UDP, length 128
02:42:54.444528 IP 172.16.83.5.64519 > 255.255.255.255.10007: UDP, length 128
02:42:54.466203 IP6 fe80::e59c:f009:554a:495e.62646 > ff02::1:3.5355: UDP, length 24
02:42:54.466286 IP 172.16.82.206.49815 > 224.0.0.252.5355: UDP, length 24
02:42:54.499110 IP6 fe80::f03c:5c67:dfc4:e43 > ff02::1:ffaf:3ae0: ICMP6, neighbor solicitation, who has fe80::3199:1e6b:94af:3ae0, length 32
02:42:54.503790 IP6 fe80::f03c:5c67:dfc4:e43 > ff02::1:ffaf:3ae0: ICMP6, neighbor solicitation, who has fe80::3199:1e6b:94af:3ae0, length 32
02:42:54.505441 IP6 fe80::f03c:5c67:dfc4:e43 > ff02::1:ffaf:3ae0: ICMP6, neighbor solicitation, who has fe80::3199:1e6b:94af:3ae0, length 32
02:42:54.506267 IP6 fe80::f03c:5c67:dfc4:e43 > ff02::1:ffaf:3ae0: ICMP6, neighbor solicitation, who has fe80::3199:1e6b:94af:3ae0, length 32
02:42:54.509215 IP6 fe80::f03c:5c67:dfc4:e43 > ff02::1:ffaf:3ae0: ICMP6, neighbor solicitation, who has fe80::3199:1e6b:94af:3ae0, length 32
02:42:54.510541 IP6 fe80::f03c:5c67:dfc4:e43 > ff02::1:ffaf:3ae0: ICMP6, neighbor solicitation, who has fe80::3199:1e6b:94af:3ae0, length 32
02:42:54.520299 IP6 fe80::b9ad:49e6:4d1a:35a9 > ff02::1:ffaf:3ae0: ICMP6, neighbor solicitation, who has fe80::3199:1e6b:94af:3ae0, length 32
02:42:54.525629 IP6 fe80::f03c:5c67:dfc4:e43 > ff02::1:ffaf:3ae0: ICMP6, neighbor solicitation, who has fe80::3199:1e6b:94af:3ae0, length 32
02:42:54.526491 IP6 fe80::f03c:5c67:dfc4:e43 > ff02::1:ffaf:3ae0: ICMP6, neighbor solicitation, who has fe80::3199:1e6b:94af:3ae0, length 32
02:42:54.527056 IP6 fe80::f03c:5c67:dfc4:e43 > ff02::1:ffaf:3ae0: ICMP6, neighbor solicitation, who has fe80::3199:1e6b:94af:3ae0, length 32
02:42:54.527149 IP6 fe80::f03c:5c67:dfc4:e43 > ff02::1:ffaf:3ae0: ICMP6, neighbor solicitation, who has fe80::3199:1e6b:94af:3ae0, length 32
02:42:54.527443 IP6 fe80::f03c:5c67:dfc4:e43 > ff02::1:ffaf:3ae0: ICMP6, neighbor solicitation, who has fe80::3199:1e6b:94af:3ae0, length 32
02:42:54.527484 IP6 fe80::f03c:5c67:dfc4:e43 > ff02::1:ffaf:3ae0: ICMP6, neighbor solicitation, who has fe80::3199:1e6b:94af:3ae0, length 32
02:42:54.527782 IP6 fe80::f03c:5c67:dfc4:e43 > ff02::1:ffaf:3ae0: ICMP6, neighbor solicitation, who has fe80::3199:1e6b:94af:3ae0, length 32
02:42:54.527793 IP6 fe80::f03c:5c67:dfc4:e43 > ff02::1:ffaf:3ae0: ICMP6, neighbor solicitation, who has fe80::3199:1e6b:94af:3ae0, length 32
02:42:54.537856 STP 802.1d, Config, Flags [Topology change], bridge-id 8016.00:12:43:31:26:80.8006, length 43
02:42:54.546721 IP 172.16.82.22.1900 > 239.255.255.250.1900: UDP, length 444
02:42:54.547110 IP6 fe80::8a1:8a5b:ad90:3416.1900 > ff02::c.1900: UDP, length 452
02:42:54.547358 IP 172.16.82.22.1900 > 239.255.255.250.1900: UDP, length 491
02:42:54.547643 IP6 fe80::8a1:8a5b:ad90:3416.1900 > ff02::c.1900: UDP, length 499
02:42:54.547813 IP 172.16.82.22.1900 > 239.255.255.250.1900: UDP, length 435
02:42:54.548041 IP6 fe80::8a1:8a5b:ad90:3416.1900 > ff02::c.1900: UDP, length 443
02:42:54.548261 IP 172.16.82.22.1900 > 239.255.255.250.1900: UDP, length 499
02:42:54.548473 IP6 fe80::8a1:8a5b:ad90:3416.1900 > ff02::c.1900: UDP, length 507
02:42:54.698163 IP6 fe80::e59c:f009:554a:495e > ff02::16: HBH ICMP6, multicast listener report v2, 1 group record(s), length 28
02:42:54.726374 IP6 fe80::e59c:f009:554a:495e > ff02::16: HBH ICMP6, multicast listener report v2, 1 group record(s), length 28
02:42:54.727020 IP6 fe80::e59c:f009:554a:495e.63227 > ff02::1:3.5355: UDP, length 29
02:42:54.727237 IP 172.16.82.206.54221 > 224.0.0.252.5355: UDP, length 29
02:42:54.729046 IP 0.0.0.0.68 > 255.255.255.255.67: UDP, length 312
02:42:54.729055 IP6 fe80::e59c:f009:554a:495e.50963 > ff02::1:3.5355: UDP, length 22
02:42:54.729252 IP 172.16.82.206.50728 > 224.0.0.252.5355: UDP, length 22
02:42:54.737865 IP 172.16.83.254.67 > 255.255.255.255.68: UDP, length 301
02:42:54.757179 ARP, Request who-has 172.16.83.254 tell 172.16.82.206, length 46
02:42:54.758076 ARP, Request who-has 172.16.83.254 tell 172.16.82.206, length 46
02:42:54.769805 IP 172.16.82.206.137 > 172.16.83.255.137: UDP, length 68
02:42:54.769935 IP 172.16.82.206.137 > 172.16.83.255.137: UDP, length 68
02:42:54.770011 IP 172.16.82.206.137 > 172.16.83.255.137: UDP, length 68
02:42:54.827086 IP6 fe80::e59c:f009:554a:495e.63227 > ff02::1:3.5355: UDP, length 29
02:42:54.827128 IP 172.16.82.206.54221 > 224.0.0.252.5355: UDP, length 29
02:42:54.829063 IP6 fe80::e59c:f009:554a:495e.50963 > ff02::1:3.5355: UDP, length 22
02:42:54.829113 IP 172.16.82.206.50728 > 224.0.0.252.5355: UDP, length 22
02:42:54.904846 IP6 fe80::8a1:8a5b:ad90:3416 > ff02::1:ffaf:3ae0: ICMP6, neighbor solicitation, who has fe80::3199:1e6b:94af:3ae0, length 32
02:42:54.955313 IP6 fe80::f981:28db:a739:56a8.546 > ff02::1:2.547: UDP, length 89
02:42:55.013357 IP 172.16.82.206.137 > 172.16.83.255.137: UDP, length 50
02:42:55.024116 IP 172.16.82.206.63366 > 239.255.255.250.1900: UDP, length 133
02:42:55.024483 ARP, Request who-has 172.16.82.206 tell 172.16.82.47, length 46
02:42:55.025936 ARP, Request who-has 172.16.82.206 tell 172.16.82.149, length 46
02:42:55.027209 IP6 fe80::e59c:f009:554a:495e > ff02::16: HBH ICMP6, multicast listener report v2, 1 group record(s), length 28
02:42:55.027395 IP6 fe80::e59c:f009:554a:495e > ff02::16: HBH ICMP6, multicast listener report v2, 1 group record(s), length 28
02:42:55.027920 IP6 fe80::e59c:f009:554a:495e.56794 > ff02::1:3.5355: UDP, length 29
02:42:55.028057 IP 172.16.82.206.50031 > 224.0.0.252.5355: UDP, length 29
02:42:55.029270 IP 172.16.82.206.137 > 172.16.83.255.137: UDP, length 50
02:42:55.049324 IP6 fe80::9d9b:974e:b475:2b16 > ff02::1:ffaf:3ae0: ICMP6, neighbor solicitation, who has fe80::3199:1e6b:94af:3ae0, length 32
02:42:55.128246 IP6 fe80::e59c:f009:554a:495e.56794 > ff02::1:3.5355: UDP, length 29
02:42:55.128281 IP 172.16.82.206.50031 > 224.0.0.252.5355: UDP, length 29
02:42:55.193207 IP6 fe80::e59c:f009:554a:495e > ff02::16: HBH ICMP6, multicast listener report v2, 1 group record(s), length 28
02:42:55.358133 IP6 fe80::f03c:5c67:dfc4:e43 > ff02::1:ffaf:3ae0: ICMP6, neighbor solicitation, who has fe80::3199:1e6b:94af:3ae0, length 32
02:42:55.445336 IP 172.16.82.103.56750 > 255.255.255.255.10007: UDP, length 128
02:42:55.445835 IP 172.16.82.103.56751 > 255.255.255.255.10019: UDP, length 128
02:42:55.446258 IP 172.16.83.5.64521 > 255.255.255.255.10019: UDP, length 128
02:42:55.448826 IP 172.16.83.5.64523 > 255.255.255.255.10007: UDP, length 128
02:42:55.519235 IP 172.16.82.206.137 > 172.16.83.255.137: UDP, length 68
02:42:55.519256 IP 172.16.82.206.137 > 172.16.83.255.137: UDP, length 68
02:42:55.520181 IP 172.16.82.206.137 > 172.16.83.255.137: UDP, length 68
02:42:55.693173 IP6 fe80::e59c:f009:554a:495e > ff02::2: ICMP6, router solicitation, length 16
02:42:55.763048 IP 172.16.82.206.137 > 172.16.83.255.137: UDP, length 50
02:42:55.779209 IP 172.16.82.206.137 > 172.16.83.255.137: UDP, length 50
02:42:55.787252 IP6 fe80::e4a4:f:6e97:f686.546 > ff02::1:2.547: UDP, length 88
02:42:55.879351 ARP, Request who-has 172.16.82.182 tell 172.16.82.148, length 46
02:42:55.936337 IP 172.16.82.165.1534 > 172.16.83.255.1534: UDP, length 8
02:42:55.962703 IP 172.16.82.206.63366 > 239.255.255.250.1900: UDP, length 133
02:42:55.987310 IP 172.16.82.206.63366 > 239.255.255.250.1900: UDP, length 133
02:42:56.037480 IP 172.16.82.206.63366 > 239.255.255.250.1900: UDP, length 133
02:42:56.051339 IP6 fe80::9d9b:974e:b475:2b16 > ff02::1:ffaf:3ae0: ICMP6, neighbor solicitation, who has fe80::3199:1e6b:94af:3ae0, length 32
02:42:56.185034 IP 172.16.82.22.64595 > 239.255.255.250.1900: UDP, length 133
02:42:56.269187 IP 172.16.82.206.137 > 172.16.83.255.137: UDP, length 68
02:42:56.269209 IP 172.16.82.206.137 > 172.16.83.255.137: UDP, length 68
02:42:56.270160 IP 172.16.82.206.137 > 172.16.83.255.137: UDP, length 68
02:42:56.356596 IP6 fe80::e59c:f009:554a:495e.55758 > ff02::1:3.5355: UDP, length 22
02:42:56.356727 IP 172.16.82.206.52322 > 224.0.0.252.5355: UDP, length 22
02:42:56.358146 IP6 fe80::f03c:5c67:dfc4:e43 > ff02::1:ffaf:3ae0: ICMP6, neighbor solicitation, who has fe80::3199:1e6b:94af:3ae0, length 32
02:42:56.379464 IP6 fe80::e59c:f009:554a:495e.63706 > ff02::1:3.5355: UDP, length 28
02:42:56.379606 IP 172.16.82.206.63257 > 224.0.0.252.5355: UDP, length 28
02:42:56.383523 IP6 fe80::e59c:f009:554a:495e.51653 > ff02::1:3.5355: UDP, length 28
02:42:56.383665 IP 172.16.82.206.60102 > 224.0.0.252.5355: UDP, length 28
02:42:56.384728 IP6 fe80::e59c:f009:554a:495e.49741 > ff02::1:3.5355: UDP, length 28
02:42:56.384854 IP 172.16.82.206.63543 > 224.0.0.252.5355: UDP, length 28
02:42:56.426517 ARP, Request who-has 172.16.82.182 tell 172.16.82.239, length 46
02:42:56.449545 IP 172.16.82.103.56753 > 255.255.255.255.10007: UDP, length 128
02:42:56.449557 IP 172.16.82.103.56752 > 255.255.255.255.10019: UDP, length 128
02:42:56.457513 IP6 fe80::e59c:f009:554a:495e.55758 > ff02::1:3.5355: UDP, length 22
02:42:56.457546 IP 172.16.82.206.52322 > 224.0.0.252.5355: UDP, length 22
02:42:56.458539 IP 172.16.83.5.64525 > 255.255.255.255.10019: UDP, length 128
02:42:56.469497 IP 172.16.83.5.64527 > 255.255.255.255.10007: UDP, length 128
02:42:56.479325 IP6 fe80::e59c:f009:554a:495e.63706 > ff02::1:3.5355: UDP, length 28
02:42:56.479375 IP 172.16.82.206.63257 > 224.0.0.252.5355: UDP, length 28
02:42:56.483381 IP6 fe80::e59c:f009:554a:495e.51653 > ff02::1:3.5355: UDP, length 28
02:42:56.483439 IP 172.16.82.206.60102 > 224.0.0.252.5355: UDP, length 28
02:42:56.488915 IP6 fe80::e59c:f009:554a:495e.49741 > ff02::1:3.5355: UDP, length 28
02:42:56.488963 IP 172.16.82.206.63543 > 224.0.0.252.5355: UDP, length 28
02:42:56.501796 IP 172.16.82.150.53666 > 239.255.255.250.1900: UDP, length 133
02:42:56.513044 IP 172.16.82.206.137 > 172.16.83.255.137: UDP, length 50
02:42:56.529034 IP 172.16.82.206.137 > 172.16.83.255.137: UDP, length 50
02:42:56.541426 STP 802.1d, Config, Flags [Topology change], bridge-id 8016.00:12:43:31:26:80.8006, length 43
02:42:56.592384 IP 172.16.82.20.40758 > 172.16.68.12.53: UDP, length 34
02:42:56.593381 IP 172.16.68.12.53 > 172.16.82.20.40758: UDP, length 118
02:42:56.593601 IP 172.16.82.20.55480 > 74.125.236.119.80: tcp 0
02:42:56.593642 IP 172.16.82.20.55481 > 74.125.236.119.80: tcp 0
02:42:56.593795 IP 74.125.236.119.80 > 172.16.82.20.55480: tcp 0
02:42:56.593816 IP 172.16.82.20.55480 > 74.125.236.119.80: tcp 0
02:42:56.593970 IP 74.125.236.119.80 > 172.16.82.20.55481: tcp 0
02:42:56.593979 IP 172.16.82.20.55481 > 74.125.236.119.80: tcp 0
02:42:56.657573 IP 172.16.82.206.137 > 172.16.83.255.137: UDP, length 50
02:42:56.672715 IP 172.16.82.20.55480 > 74.125.236.119.80: tcp 1021
02:42:56.673095 IP 74.125.236.119.80 > 172.16.82.20.55480: tcp 0
02:42:56.679402 IP 172.16.82.206.137 > 172.16.83.255.137: UDP, length 50
02:42:56.683404 IP 172.16.82.206.137 > 172.16.83.255.137: UDP, length 50
02:42:56.689547 IP 172.16.82.206.137 > 172.16.83.255.137: UDP, length 50
02:42:56.791100 IP 74.125.236.119.80 > 172.16.82.20.55480: tcp 574
02:42:56.791128 IP 172.16.82.20.55480 > 74.125.236.119.80: tcp 0
02:42:56.793429 IP 172.16.82.20.35287 > 172.16.68.12.53: UDP, length 33
02:42:56.793666 IP 172.16.82.20.49086 > 172.16.68.12.53: UDP, length 33
02:42:56.793935 IP 172.16.82.20.44745 > 172.16.68.12.53: UDP, length 43
02:42:56.794067 IP 172.16.82.20.34300 > 74.125.236.119.443: tcp 0
02:42:56.794219 IP 74.125.236.119.443 > 172.16.82.20.34300: tcp 0
02:42:56.794241 IP 172.16.82.20.34300 > 74.125.236.119.443: tcp 0
02:42:56.794331 IP 172.16.82.20.50762 > 172.16.68.12.53: UDP, length 33
02:42:56.794865 IP 172.16.82.20.34300 > 74.125.236.119.443: tcp 188
02:42:56.795036 IP 74.125.236.119.443 > 172.16.82.20.34300: tcp 0
02:42:56.795791 IP 172.16.68.12.53 > 172.16.82.20.35287: UDP, length 230
02:42:56.795868 IP 172.16.68.12.53 > 172.16.82.20.44745: UDP, length 120
02:42:56.795924 IP 172.16.68.12.53 > 172.16.82.20.50762: UDP, length 209
02:42:56.796132 IP 172.16.68.12.53 > 172.16.82.20.49086: UDP, length 78
02:42:56.796568 IP 172.16.82.20.41301 > 74.125.236.105.443: tcp 0
02:42:56.796712 IP 74.125.236.105.443 > 172.16.82.20.41301: tcp 0
02:42:56.796739 IP 172.16.82.20.41301 > 74.125.236.105.443: tcp 0
02:42:56.796964 IP 172.16.82.20.37529 > 172.16.68.12.53: UDP, length 33
02:42:56.797245 IP 172.16.82.20.41301 > 74.125.236.105.443: tcp 187
02:42:56.797384 IP 74.125.236.105.443 > 172.16.82.20.41301: tcp 0
02:42:56.797716 IP 172.16.68.12.53 > 172.16.82.20.37529: UDP, length 49
02:42:56.996426 IP 74.125.236.105.443 > 172.16.82.20.41301: tcp 1412
02:42:56.996456 IP 172.16.82.20.41301 > 74.125.236.105.443: tcp 0
02:42:56.996827 IP 74.125.236.105.443 > 172.16.82.20.41301: tcp 1110
02:42:56.996838 IP 172.16.82.20.41301 > 74.125.236.105.443: tcp 0
02:42:57.019059 IP 172.16.82.206.137 > 172.16.83.255.137: UDP, length 68
02:42:57.019078 IP 172.16.82.206.137 > 172.16.83.255.137: UDP, length 68
02:42:57.019999 IP 172.16.82.206.137 > 172.16.83.255.137: UDP, length 68
02:42:57.027126 IP 74.125.236.119.443 > 172.16.82.20.34300: tcp 1412
02:42:57.027144 IP 172.16.82.20.34300 > 74.125.236.119.443: tcp 0
02:42:57.027360 IP 74.125.236.119.443 > 172.16.82.20.34300: tcp 505
02:42:57.027365 IP 172.16.82.20.34300 > 74.125.236.119.443: tcp 0
02:42:57.037826 IP 172.16.82.20.34300 > 74.125.236.119.443: tcp 203
02:42:57.037988 IP 74.125.236.119.443 > 172.16.82.20.34300: tcp 0
02:42:57.038272 IP 172.16.82.20.34300 > 74.125.236.119.443: tcp 958
02:42:57.038585 IP 74.125.236.119.443 > 172.16.82.20.34300: tcp 0
02:42:57.076674 IP 74.125.236.119.443 > 172.16.82.20.34300: tcp 226
02:42:57.112893 IP 172.16.82.20.34300 > 74.125.236.119.443: tcp 0
02:42:57.113043 IP 74.125.236.119.443 > 172.16.82.20.34300: tcp 45
02:42:57.113058 IP 172.16.82.20.34300 > 74.125.236.119.443: tcp 0
02:42:57.119336 IP6 fe80::bc4e:6ef1:284d:8ee > ff02::1:ffaf:3ae0: ICMP6, neighbor solicitation, who has fe80::3199:1e6b:94af:3ae0, length 32
02:42:57.197503 IP 172.16.82.20.41301 > 74.125.236.105.443: tcp 158
02:42:57.197693 IP 74.125.236.105.443 > 172.16.82.20.41301: tcp 0
02:42:57.216834 IP 74.125.236.119.443 > 172.16.82.20.34300: tcp 234
02:42:57.216857 IP 172.16.82.20.34300 > 74.125.236.119.443: tcp 0
02:42:57.217308 IP 74.125.236.119.443 > 172.16.82.20.34300: tcp 1460
02:42:57.217315 IP 172.16.82.20.34300 > 74.125.236.119.443: tcp 0
02:42:57.217388 IP 74.125.236.119.443 > 172.16.82.20.34300: tcp 1240
02:42:57.217394 IP 172.16.82.20.34300 > 74.125.236.119.443: tcp 0
02:42:57.217513 IP 74.125.236.119.443 > 172.16.82.20.34300: tcp 1460
02:42:57.217518 IP 172.16.82.20.34300 > 74.125.236.119.443: tcp 0
02:42:57.217769 IP 74.125.236.119.443 > 172.16.82.20.34300: tcp 1460
02:42:57.217776 IP 172.16.82.20.34300 > 74.125.236.119.443: tcp 0
02:42:57.217891 IP 74.125.236.119.443 > 172.16.82.20.34300: tcp 1460
02:42:57.217896 IP 172.16.82.20.34300 > 74.125.236.119.443: tcp 0
02:42:57.218013 IP 74.125.236.119.443 > 172.16.82.20.34300: tcp 1460
02:42:57.218020 IP 172.16.82.20.34300 > 74.125.236.119.443: tcp 0
02:42:57.218138 IP 74.125.236.119.443 > 172.16.82.20.34300: tcp 1460
02:42:57.218143 IP 172.16.82.20.34300 > 74.125.236.119.443: tcp 0
02:42:57.218260 IP 74.125.236.119.443 > 172.16.82.20.34300: tcp 1460
02:42:57.218265 IP 172.16.82.20.34300 > 74.125.236.119.443: tcp 0
02:42:57.218281 IP 74.125.236.119.443 > 172.16.82.20.34300: tcp 285
02:42:57.218284 IP 172.16.82.20.34300 > 74.125.236.119.443: tcp 0
02:42:57.226659 IP6 fe80::6c14:c2ef:2e1f:72ee > ff02::1:ffaf:3ae0: ICMP6, neighbor solicitation, who has fe80::3199:1e6b:94af:3ae0, length 32
02:42:57.237601 IP 74.125.236.105.443 > 172.16.82.20.41301: tcp 271
02:42:57.237628 IP 172.16.82.20.41301 > 74.125.236.105.443: tcp 0
02:42:57.254863 IP 74.125.236.119.443 > 172.16.82.20.34300: tcp 179
02:42:57.254902 IP 172.16.82.20.34300 > 74.125.236.119.443: tcp 0
02:42:57.255332 IP 74.125.236.119.443 > 172.16.82.20.34300: tcp 1350
02:42:57.255336 IP 172.16.82.20.34300 > 74.125.236.119.443: tcp 0
02:42:57.255457 IP 74.125.236.119.443 > 172.16.82.20.34300: tcp 1460
02:42:57.255462 IP 172.16.82.20.34300 > 74.125.236.119.443: tcp 0
02:42:57.255742 IP 74.125.236.119.443 > 172.16.82.20.34300: tcp 1419
02:42:57.255747 IP 172.16.82.20.34300 > 74.125.236.119.443: tcp 0
02:42:57.255870 IP 74.125.236.119.443 > 172.16.82.20.34300: tcp 1460
02:42:57.255875 IP 172.16.82.20.34300 > 74.125.236.119.443: tcp 0
02:42:57.255993 IP 74.125.236.119.443 > 172.16.82.20.34300: tcp 1460
02:42:57.256049 IP 74.125.236.119.443 > 172.16.82.20.34300: tcp 656
02:42:57.256053 IP 172.16.82.20.34300 > 74.125.236.119.443: tcp 0
02:42:57.279100 IP 74.125.236.119.443 > 172.16.82.20.34300: tcp 1350
02:42:57.279161 IP 172.16.82.20.34300 > 74.125.236.119.443: tcp 0
02:42:57.279316 IP 74.125.236.119.443 > 172.16.82.20.34300: tcp 1460
02:42:57.279438 IP 74.125.236.119.443 > 172.16.82.20.34300: tcp 1460
02:42:57.279445 IP 172.16.82.20.34300 > 74.125.236.119.443: tcp 0
02:42:57.279503 IP 74.125.236.119.443 > 172.16.82.20.34300: tcp 790
02:42:57.279517 IP 172.16.82.20.34300 > 74.125.236.119.443: tcp 0
02:42:57.283903 IP6 fe80::e59c:f009:554a:495e.64287 > ff02::1:3.5355: UDP, length 22
02:42:57.284018 IP 172.16.82.206.53929 > 224.0.0.252.5355: UDP, length 22
02:42:57.286477 IP6 fe80::e59c:f009:554a:495e.51843 > ff02::1:3.5355: UDP, length 28
02:42:57.286558 IP6 fe80::e59c:f009:554a:495e.60626 > ff02::1:3.5355: UDP, length 28
02:42:57.286600 IP 172.16.82.206.50970 > 224.0.0.252.5355: UDP, length 28
02:42:57.286685 IP 172.16.82.206.60814 > 224.0.0.252.5355: UDP, length 28
02:42:57.286800 IP6 fe80::e59c:f009:554a:495e.51064 > ff02::1:3.5355: UDP, length 28
02:42:57.286922 IP 172.16.82.206.62152 > 224.0.0.252.5355: UDP, length 28
02:42:57.339340 IP 172.16.82.174.64035 > 239.255.255.250.1900: UDP, length 133
02:42:57.384099 IP6 fe80::e59c:f009:554a:495e.64287 > ff02::1:3.5355: UDP, length 22
02:42:57.384136 IP 172.16.82.206.53929 > 224.0.0.252.5355: UDP, length 22
02:42:57.386226 IP6 fe80::e59c:f009:554a:495e.51064 > ff02::1:3.5355: UDP, length 28
02:42:57.386250 IP6 fe80::e59c:f009:554a:495e.60626 > ff02::1:3.5355: UDP, length 28
02:42:57.386253 IP 172.16.82.206.62152 > 224.0.0.252.5355: UDP, length 28
02:42:57.386257 IP 172.16.82.206.60814 > 224.0.0.252.5355: UDP, length 28
02:42:57.386315 IP6 fe80::e59c:f009:554a:495e.51843 > ff02::1:3.5355: UDP, length 28
02:42:57.386345 IP 172.16.82.206.50970 > 224.0.0.252.5355: UDP, length 28
02:42:57.407196 IP 172.16.82.206.137 > 172.16.83.255.137: UDP, length 50
02:42:57.429188 IP 172.16.82.206.137 > 172.16.83.255.137: UDP, length 50
02:42:57.433207 IP 172.16.82.206.137 > 172.16.83.255.137: UDP, length 50
02:42:57.439180 IP 172.16.82.206.137 > 172.16.83.255.137: UDP, length 50
02:42:57.454668 IP 172.16.82.103.56754 > 255.255.255.255.10007: UDP, length 128
02:42:57.454725 IP 172.16.82.103.56755 > 255.255.255.255.10019: UDP, length 128
02:42:57.463404 IP 172.16.83.5.64529 > 255.255.255.255.10019: UDP, length 128
02:42:57.477001 IP 172.16.82.20.55480 > 74.125.236.119.80: tcp 932
02:42:57.477509 IP 74.125.236.119.80 > 172.16.82.20.55480: tcp 0
02:42:57.479539 IP 172.16.83.5.64531 > 255.255.255.255.10007: UDP, length 128
02:42:57.480633 IP 74.125.236.103.443 > 172.16.82.20.35969: tcp 61
02:42:57.480653 IP 172.16.82.20.35969 > 74.125.236.103.443: tcp 0
02:42:57.480678 IP 74.125.236.103.443 > 172.16.82.20.35969: tcp 37
02:42:57.481081 IP 172.16.82.20.35969 > 74.125.236.103.443: tcp 0
02:42:57.481194 IP 74.125.236.103.443 > 172.16.82.20.35969: tcp 0
02:42:57.490095 IP 172.16.82.20.42704 > 199.7.51.190.80: tcp 0
02:42:57.490143 IP 172.16.82.20.42706 > 199.7.51.190.80: tcp 0
02:42:57.490243 IP 199.7.51.190.80 > 172.16.82.20.42704: tcp 0
02:42:57.490269 IP 199.7.51.190.80 > 172.16.82.20.42706: tcp 0
02:42:57.576900 IP 74.125.236.119.80 > 172.16.82.20.55480: tcp 440
02:42:57.576925 IP 172.16.82.20.55480 > 74.125.236.119.80: tcp 0
02:42:57.584582 IP 172.16.82.206.137 > 172.16.83.255.137: UDP, length 50
02:42:57.586394 IP 172.16.82.206.137 > 172.16.83.255.137: UDP, length 50
02:42:57.586475 IP 172.16.82.206.137 > 172.16.83.255.137: UDP, length 50
02:42:57.586542 IP 172.16.82.206.137 > 172.16.83.255.137: UDP, length 50
02:42:57.616796 IP 172.16.82.120.68 > 255.255.255.255.67: UDP, length 300
02:42:57.626109 IP 172.16.82.120.137 > 172.16.83.255.137: UDP, length 50
02:42:57.626903 IP 172.16.82.120.137 > 172.16.83.255.137: UDP, length 50
02:42:57.627652 IP 172.16.82.120.137 > 172.16.83.255.137: UDP, length 50
02:42:57.628516 IP 172.16.82.120.137 > 172.16.83.255.137: UDP, length 50
02:42:57.644455 IP 172.16.82.120.137 > 172.16.83.255.137: UDP, length 50
02:42:57.812911 IP 172.16.82.20.34300 > 74.125.236.119.443: tcp 222
02:42:57.850713 IP 74.125.236.119.443 > 172.16.82.20.34300: tcp 0
02:42:57.874908 IP 172.16.82.20.34300 > 74.125.236.119.443: tcp 273
02:42:57.875082 IP 74.125.236.119.443 > 172.16.82.20.34300: tcp 0
02:42:57.889389 CDPv2, ttl: 180s, Device-ID 'hostel3-240.pdc.jiit', length 359
02:42:57.891803 IP 172.16.82.20.34300 > 74.125.236.119.443: tcp 313
02:42:57.891989 IP 74.125.236.119.443 > 172.16.82.20.34300: tcp 0
02:42:57.893103 IP6 fe80::bc4e:6ef1:284d:8ee > ff02::1:ffaf:3ae0: ICMP6, neighbor solicitation, who has fe80::3199:1e6b:94af:3ae0, length 32
02:42:57.976332 IP 64.4.23.165.443 > 172.16.82.170.51727: tcp 0
02:42:57.978015 IP 74.125.236.119.443 > 172.16.82.20.34300: tcp 92
02:42:57.978038 IP 172.16.82.20.34300 > 74.125.236.119.443: tcp 0
02:42:57.978176 IP 74.125.236.119.443 > 172.16.82.20.34300: tcp 33
02:42:57.978184 IP 172.16.82.20.34300 > 74.125.236.119.443: tcp 0
02:42:57.992701 IP 74.125.236.119.443 > 172.16.82.20.34300: tcp 85
02:42:57.992724 IP 172.16.82.20.34300 > 74.125.236.119.443: tcp 0
02:42:57.992933 IP 74.125.236.119.443 > 172.16.82.20.34300: tcp 462
02:42:57.992945 IP 172.16.82.20.34300 > 74.125.236.119.443: tcp 0
02:42:57.993926 IP 74.125.236.119.443 > 172.16.82.20.34300: tcp 68
02:42:57.993940 IP 172.16.82.20.34300 > 74.125.236.119.443: tcp 0
02:42:58.006430 IP 172.16.82.20.34300 > 74.125.236.119.443: tcp 113
02:42:58.006580 IP 74.125.236.119.443 > 172.16.82.20.34300: tcp 0
02:42:58.038138 IP 172.16.82.20.34300 > 74.125.236.119.443: tcp 37
02:42:58.038276 IP 74.125.236.119.443 > 172.16.82.20.34300: tcp 0
02:42:58.058065 IP 74.125.236.119.443 > 172.16.82.20.34300: tcp 140
02:42:58.096879 IP 172.16.82.20.34300 > 74.125.236.119.443: tcp 0
02:42:58.097185 IP 74.125.236.119.443 > 172.16.82.20.34300: tcp 70
02:42:58.097199 IP 172.16.82.20.34300 > 74.125.236.119.443: tcp 0
02:42:58.108948 IP 74.125.236.119.443 > 172.16.82.20.34300: tcp 64
02:42:58.108973 IP 172.16.82.20.34300 > 74.125.236.119.443: tcp 0
02:42:58.109111 IP 74.125.236.119.443 > 172.16.82.20.34300: tcp 33
02:42:58.109117 IP 172.16.82.20.34300 > 74.125.236.119.443: tcp 0
02:42:58.157222 IP 172.16.82.206.137 > 172.16.83.255.137: UDP, length 50
02:42:58.179203 IP 172.16.82.206.137 > 172.16.83.255.137: UDP, length 50
02:42:58.183185 IP 172.16.82.206.137 > 172.16.83.255.137: UDP, length 50
02:42:58.189198 IP 172.16.82.206.137 > 172.16.83.255.137: UDP, length 50
02:42:58.216280 IP6 fe80::6c14:c2ef:2e1f:72ee > ff02::1:ffaf:3ae0: ICMP6, neighbor solicitation, who has fe80::3199:1e6b:94af:3ae0, length 32
02:42:58.256157 IP6 fe80::e59c:f009:554a:495e.546 > ff02::1:2.547: UDP, length 91
02:42:58.334246 IP 172.16.82.206.137 > 172.16.83.255.137: UDP, length 50
02:42:58.336193 IP 172.16.82.206.137 > 172.16.83.255.137: UDP, length 50
02:42:58.336249 IP 172.16.82.206.137 > 172.16.83.255.137: UDP, length 50
02:42:58.336272 IP 172.16.82.206.137 > 172.16.83.255.137: UDP, length 50
02:42:58.369392 IP 172.16.82.20.34300 > 74.125.236.119.443: tcp 281
02:42:58.375370 IP 172.16.82.120.137 > 172.16.83.255.137: UDP, length 50
02:42:58.376295 IP 172.16.82.120.137 > 172.16.83.255.137: UDP, length 50
02:42:58.377250 IP 172.16.82.120.137 > 172.16.83.255.137: UDP, length 50
02:42:58.378252 IP 172.16.82.120.137 > 172.16.83.255.137: UDP, length 50
02:42:58.394291 IP 172.16.82.120.137 > 172.16.83.255.137: UDP, length 50
02:42:58.406778 IP 74.125.236.119.443 > 172.16.82.20.34300: tcp 0
02:42:58.459094 IP 172.16.82.103.56756 > 255.255.255.255.10007: UDP, length 128
02:42:58.460037 IP 172.16.82.103.56757 > 255.255.255.255.10019: UDP, length 128
02:42:58.470085 IP 172.16.83.5.64533 > 255.255.255.255.10019: UDP, length 128
02:42:58.487411 IP 74.125.236.119.443 > 172.16.82.20.34300: tcp 52
02:42:58.487434 IP 172.16.82.20.34300 > 74.125.236.119.443: tcp 0
02:42:58.487678 IP 74.125.236.119.443 > 172.16.82.20.34300: tcp 460
02:42:58.487688 IP 172.16.82.20.34300 > 74.125.236.119.443: tcp 0
02:42:58.489351 IP 172.16.83.5.64535 > 255.255.255.255.10007: UDP, length 128
02:42:58.535097 STP 802.1d, Config, Flags [Topology change], bridge-id 8016.00:12:43:31:26:80.8006, length 43
02:42:58.653546 
02:42:58.740546 IP 74.125.236.119.443 > 172.16.82.20.34300: tcp 1350
02:42:58.740580 IP 172.16.82.20.34300 > 74.125.236.119.443: tcp 0
02:42:58.740664 IP 74.125.236.119.443 > 172.16.82.20.34300: tcp 1460
02:42:58.740672 IP 172.16.82.20.34300 > 74.125.236.119.443: tcp 0
02:42:58.740787 IP 74.125.236.119.443 > 172.16.82.20.34300: tcp 1460
02:42:58.740798 IP 172.16.82.20.34300 > 74.125.236.119.443: tcp 0
02:42:58.741032 IP 74.125.236.119.443 > 172.16.82.20.34300: tcp 1460
02:42:58.741043 IP 172.16.82.20.34300 > 74.125.236.119.443: tcp 0
02:42:58.741155 IP 74.125.236.119.443 > 172.16.82.20.34300: tcp 1460
02:42:58.741164 IP 172.16.82.20.34300 > 74.125.236.119.443: tcp 0
02:42:58.741277 IP 74.125.236.119.443 > 172.16.82.20.34300: tcp 1460
02:42:58.741285 IP 172.16.82.20.34300 > 74.125.236.119.443: tcp 0
02:42:58.741397 IP 74.125.236.119.443 > 172.16.82.20.34300: tcp 1460
02:42:58.741406 IP 172.16.82.20.34300 > 74.125.236.119.443: tcp 0
02:42:58.741523 IP 74.125.236.119.443 > 172.16.82.20.34300: tcp 1460
02:42:58.741531 IP 172.16.82.20.34300 > 74.125.236.119.443: tcp 0
02:42:58.741646 IP 74.125.236.119.443 > 172.16.82.20.34300: tcp 1460
02:42:58.741653 IP 172.16.82.20.34300 > 74.125.236.119.443: tcp 0
02:42:58.741766 IP 74.125.236.119.443 > 172.16.82.20.34300: tcp 1460
02:42:58.741775 IP 172.16.82.20.34300 > 74.125.236.119.443: tcp 0
02:42:58.741787 IP 74.125.236.119.443 > 172.16.82.20.34300: tcp 175
02:42:58.741792 IP 172.16.82.20.34300 > 74.125.236.119.443: tcp 0
02:42:58.771342 IP 172.16.82.206.68 > 255.255.255.255.67: UDP, length 300
02:42:58.855380 ARP, Request who-has 172.16.82.182 tell 172.16.82.148, length 46
02:42:58.871501 IP 172.16.82.20.34300 > 74.125.236.119.443: tcp 343
02:42:58.871782 IP 74.125.236.119.443 > 172.16.82.20.34300: tcp 0
02:42:58.893205 IP6 fe80::bc4e:6ef1:284d:8ee > ff02::1:ffaf:3ae0: ICMP6, neighbor solicitation, who has fe80::3199:1e6b:94af:3ae0, length 32
02:42:58.989838 ARP, Request who-has 172.16.82.182 tell 172.16.82.239, length 46
02:42:59.016870 IP 74.125.236.119.443 > 172.16.82.20.34300: tcp 48
02:42:59.016901 IP 172.16.82.20.34300 > 74.125.236.119.443: tcp 0
02:42:59.017060 IP 74.125.236.119.443 > 172.16.82.20.34300: tcp 33
02:42:59.017073 IP 172.16.82.20.34300 > 74.125.236.119.443: tcp 0
02:42:59.037261 IP 172.16.82.206.63366 > 239.255.255.250.1900: UDP, length 133
02:42:59.076506 IP 172.16.82.20.34300 > 74.125.236.119.443: tcp 288
02:42:59.076708 IP 74.125.236.119.443 > 172.16.82.20.34300: tcp 0
02:42:59.084240 IP 172.16.82.206.137 > 172.16.83.255.137: UDP, length 50
02:42:59.086189 IP 172.16.82.206.137 > 172.16.83.255.137: UDP, length 50
02:42:59.086221 IP 172.16.82.206.137 > 172.16.83.255.137: UDP, length 50
02:42:59.086243 IP 172.16.82.206.137 > 172.16.83.255.137: UDP, length 50
02:42:59.125412 IP 172.16.82.120.137 > 172.16.83.255.137: UDP, length 50
02:42:59.126345 IP 172.16.82.120.137 > 172.16.83.255.137: UDP, length 50
02:42:59.127329 IP 172.16.82.120.137 > 172.16.83.255.137: UDP, length 50
02:42:59.128327 IP 172.16.82.120.137 > 172.16.83.255.137: UDP, length 50
02:42:59.144331 IP 172.16.82.120.137 > 172.16.83.255.137: UDP, length 50
02:42:59.185059 IP 172.16.82.22.64595 > 239.255.255.250.1900: UDP, length 133
02:42:59.192222 IP 74.125.236.119.443 > 172.16.82.20.34300: tcp 52
02:42:59.192257 IP 172.16.82.20.34300 > 74.125.236.119.443: tcp 0
02:42:59.192495 IP 74.125.236.119.443 > 172.16.82.20.34300: tcp 456
02:42:59.192503 IP 172.16.82.20.34300 > 74.125.236.119.443: tcp 0
02:42:59.216347 IP6 fe80::6c14:c2ef:2e1f:72ee > ff02::1:ffaf:3ae0: ICMP6, neighbor solicitation, who has fe80::3199:1e6b:94af:3ae0, length 32
02:42:59.269703 IP 172.16.82.20.55480 > 74.125.236.119.80: tcp 941
02:42:59.270027 IP 74.125.236.119.80 > 172.16.82.20.55480: tcp 0
02:42:59.369876 IP 172.16.82.20.34300 > 74.125.236.119.443: tcp 37
02:42:59.370043 IP 74.125.236.119.443 > 172.16.82.20.34300: tcp 0
02:42:59.370191 IP 74.125.236.119.80 > 172.16.82.20.55480: tcp 447
02:42:59.370204 IP 172.16.82.20.55480 > 74.125.236.119.80: tcp 0
02:42:59.378337 ARP, Request who-has 172.16.82.182 tell 172.16.82.148, length 46
02:42:59.408214 IP 74.125.236.119.443 > 172.16.82.20.34300: tcp 37
02:42:59.408235 IP 172.16.82.20.34300 > 74.125.236.119.443: tcp 0
02:42:59.460968 IP 74.125.236.119.443 > 172.16.82.20.34300: tcp 1350
02:42:59.460979 IP 172.16.82.20.34300 > 74.125.236.119.443: tcp 0
02:42:59.461089 IP 74.125.236.119.443 > 172.16.82.20.34300: tcp 1460
02:42:59.461097 IP 172.16.82.20.34300 > 74.125.236.119.443: tcp 0
02:42:59.461211 IP 74.125.236.119.443 > 172.16.82.20.34300: tcp 1460
02:42:59.461219 IP 172.16.82.20.34300 > 74.125.236.119.443: tcp 0
02:42:59.461426 IP 74.125.236.119.443 > 172.16.82.20.34300: tcp 1460
02:42:59.461435 IP 172.16.82.20.34300 > 74.125.236.119.443: tcp 0
02:42:59.461547 IP 74.125.236.119.443 > 172.16.82.20.34300: tcp 1460
02:42:59.461555 IP 172.16.82.20.34300 > 74.125.236.119.443: tcp 0
02:42:59.461671 IP 74.125.236.119.443 > 172.16.82.20.34300: tcp 1460
02:42:59.461679 IP 172.16.82.20.34300 > 74.125.236.119.443: tcp 0
02:42:59.461793 IP 74.125.236.119.443 > 172.16.82.20.34300: tcp 1460
02:42:59.461800 IP 172.16.82.20.34300 > 74.125.236.119.443: tcp 0
02:42:59.461919 IP 74.125.236.119.443 > 172.16.82.20.34300: tcp 1460
02:42:59.461926 IP 172.16.82.20.34300 > 74.125.236.119.443: tcp 0
02:42:59.462043 IP 74.125.236.119.443 > 172.16.82.20.34300: tcp 1460
02:42:59.462051 IP 172.16.82.20.34300 > 74.125.236.119.443: tcp 0
02:42:59.462165 IP 74.125.236.119.443 > 172.16.82.20.34300: tcp 1460
02:42:59.462172 IP 172.16.82.20.34300 > 74.125.236.119.443: tcp 0
02:42:59.462249 IP 74.125.236.119.443 > 172.16.82.20.34300: tcp 1003
02:42:59.462257 IP 172.16.82.20.34300 > 74.125.236.119.443: tcp 0
02:42:59.463772 IP 172.16.82.103.56758 > 255.255.255.255.10019: UDP, length 128
02:42:59.464393 IP 172.16.82.103.56759 > 255.255.255.255.10007: UDP, length 128
02:42:59.491973 IP 172.16.83.5.64537 > 255.255.255.255.10019: UDP, length 128
02:42:59.501517 IP 172.16.82.150.53666 > 239.255.255.250.1900: UDP, length 133
02:42:59.501926 IP 172.16.83.5.64539 > 255.255.255.255.10007: UDP, length 128
02:42:59.537536 DTPv1, length 38
02:42:59.537675 00:12:43:31:26:86 01:00:0c:cc:cc:cc 66: 
02:42:59.537950 IP 172.16.82.20.34300 > 74.125.236.119.443: tcp 354
02:42:59.538184 IP 74.125.236.119.443 > 172.16.82.20.34300: tcp 0
02:42:59.683301 IP 74.125.236.119.443 > 172.16.82.20.34300: tcp 48
02:42:59.683328 IP 172.16.82.20.34300 > 74.125.236.119.443: tcp 0
02:42:59.683456 IP 74.125.236.119.443 > 172.16.82.20.34300: tcp 33
02:42:59.683467 IP 172.16.82.20.34300 > 74.125.236.119.443: tcp 0
02:42:59.693207 IP6 fe80::e59c:f009:554a:495e > ff02::2: ICMP6, router solicitation, length 16
02:42:59.840152 IP 172.16.82.206.137 > 172.16.83.255.137: UDP, length 50
02:42:59.841126 IP 172.16.82.206.137 > 172.16.83.255.137: UDP, length 50
02:42:59.841277 IP 172.16.82.206.137 > 172.16.83.255.137: UDP, length 50
02:42:59.875081 IP 172.16.82.20.34300 > 74.125.236.119.443: tcp 293
02:42:59.875294 IP 74.125.236.119.443 > 172.16.82.20.34300: tcp 0
02:42:59.880899 IP 172.16.82.120.137 > 172.16.83.255.137: UDP, length 50
02:42:59.880935 IP 172.16.82.120.137 > 172.16.83.255.137: UDP, length 50
02:42:59.896269 IP 172.16.82.120.137 > 172.16.83.255.137: UDP, length 50
02:42:59.926904 ARP, Request who-has 172.16.82.182 tell 172.16.82.239, length 46
02:42:59.986334 IP 74.125.236.119.443 > 172.16.82.20.34300: tcp 51
02:42:59.986358 IP 172.16.82.20.34300 > 74.125.236.119.443: tcp 0
02:42:59.986603 IP 74.125.236.119.443 > 172.16.82.20.34300: tcp 457
02:42:59.986613 IP 172.16.82.20.34300 > 74.125.236.119.443: tcp 0
02:43:00.027980 IP 172.16.82.20.34300 > 74.125.236.119.443: tcp 81
02:43:00.028140 IP 74.125.236.119.443 > 172.16.82.20.34300: tcp 0
02:43:00.142696 IP 74.125.236.119.443 > 172.16.82.20.34300: tcp 52
02:43:00.142721 IP 172.16.82.20.34300 > 74.125.236.119.443: tcp 0
02:43:00.142933 IP 74.125.236.119.443 > 172.16.82.20.34300: tcp 490
02:43:00.142942 IP 172.16.82.20.34300 > 74.125.236.119.443: tcp 0
02:43:00.143462 IP 74.125.236.119.443 > 172.16.82.20.34300: tcp 68
02:43:00.143472 IP 172.16.82.20.34300 > 74.125.236.119.443: tcp 0
02:43:00.166536 IP 172.16.82.20.34300 > 74.125.236.119.443: tcp 132
02:43:00.166692 IP 74.125.236.119.443 > 172.16.82.20.34300: tcp 0
02:43:00.175003 IP 172.16.82.20.34300 > 74.125.236.119.443: tcp 296
02:43:00.175228 IP 74.125.236.119.443 > 172.16.82.20.34300: tcp 0
02:43:00.268234 IP 74.125.236.119.443 > 172.16.82.20.34300: tcp 70
02:43:00.304877 IP 172.16.82.20.34300 > 74.125.236.119.443: tcp 0
02:43:00.305008 IP 74.125.236.119.443 > 172.16.82.20.34300: tcp 33
02:43:00.305022 IP 172.16.82.20.34300 > 74.125.236.119.443: tcp 0
02:43:00.323644 IP 74.125.236.119.443 > 172.16.82.20.34300: tcp 50
02:43:00.323661 IP 172.16.82.20.34300 > 74.125.236.119.443: tcp 0
02:43:00.323854 IP 74.125.236.119.443 > 172.16.82.20.34300: tcp 408
02:43:00.323866 IP 172.16.82.20.34300 > 74.125.236.119.443: tcp 0
02:43:00.325031 IP 74.125.236.119.443 > 172.16.82.20.34300: tcp 68
02:43:00.325047 IP 172.16.82.20.34300 > 74.125.236.119.443: tcp 0
02:43:00.325180 IP 74.125.236.119.443 > 172.16.82.20.34300: tcp 68
02:43:00.325190 IP 172.16.82.20.34300 > 74.125.236.119.443: tcp 0
02:43:00.372386 IP 172.16.82.20.55480 > 74.125.236.119.80: tcp 944
02:43:00.372823 IP 74.125.236.119.80 > 172.16.82.20.55480: tcp 0
02:43:00.378451 ARP, Request who-has 172.16.82.182 tell 172.16.82.148, length 46
02:43:00.398944 IP 172.16.82.20.34300 > 74.125.236.119.443: tcp 349
02:43:00.399188 IP 74.125.236.119.443 > 172.16.82.20.34300: tcp 0
02:43:00.437433 IP 172.16.82.20.34300 > 74.125.236.119.443: tcp 116
02:43:00.437609 IP 74.125.236.119.443 > 172.16.82.20.34300: tcp 0
02:43:00.443561 IP 172.16.82.20.55480 > 74.125.236.119.80: tcp 0
02:43:00.443710 IP 74.125.236.119.80 > 172.16.82.20.55480: tcp 0
02:43:00.443731 IP 172.16.82.20.55480 > 74.125.236.119.80: tcp 0
02:43:00.448431 IP 172.16.82.20.34300 > 74.125.236.119.443: tcp 297
02:43:00.448640 IP 74.125.236.119.443 > 172.16.82.20.34300: tcp 0
02:43:00.468807 IP 172.16.82.103.56760 > 255.255.255.255.10007: UDP, length 128
