22:37:27.752885 IP 127.0.0.1.59318 > 127.0.0.1.25: tcp 0
22:37:27.752905 IP 127.0.0.1.25 > 127.0.0.1.59318: tcp 0
22:37:27.752918 IP 127.0.0.1.59318 > 127.0.0.1.25: tcp 0
22:37:27.766106 IP 127.0.0.1.25 > 127.0.0.1.59318: tcp 48
22:37:27.766172 IP 127.0.0.1.59318 > 127.0.0.1.25: tcp 0
22:37:27.766448 IP 127.0.0.1.59318 > 127.0.0.1.25: tcp 18
22:37:27.766455 IP 127.0.0.1.25 > 127.0.0.1.59318: tcp 0
22:37:27.766499 IP 127.0.0.1.25 > 127.0.0.1.59318: tcp 142
22:37:27.767141 IP 127.0.0.1.59318 > 127.0.0.1.25: tcp 38
22:37:27.781203 IP 127.0.0.1.25 > 127.0.0.1.59318: tcp 14
22:37:27.781374 IP 127.0.0.1.59318 > 127.0.0.1.25: tcp 25
22:37:27.781590 IP 127.0.0.1.25 > 127.0.0.1.59318: tcp 66
22:37:27.781635 IP 127.0.0.1.59318 > 127.0.0.1.25: tcp 6
22:37:27.781683 IP 127.0.0.1.25 > 127.0.0.1.59318: tcp 14
22:37:27.798377 IP 127.0.0.1.59318 > 127.0.0.1.25: tcp 0
22:37:27.798576 IP 127.0.0.1.25 > 127.0.0.1.59318: tcp 0
22:37:27.798598 IP 127.0.0.1.59318 > 127.0.0.1.25: tcp 0
22:37:29.707613 IP 127.0.0.1.44949 > 127.0.0.1.50007: UDP, length 14
22:37:40.512269 IP 127.0.0.1.59316 > 127.0.0.1.25: tcp 5
22:37:40.512308 IP 127.0.0.1.25 > 127.0.0.1.59316: tcp 0
22:37:40.512409 IP 127.0.0.1.25 > 127.0.0.1.59316: tcp 41
22:37:40.512423 IP 127.0.0.1.59316 > 127.0.0.1.25: tcp 0
22:37:42.920125 IP 127.0.0.1.59316 > 127.0.0.1.25: tcp 6
22:37:42.920244 IP 127.0.0.1.25 > 127.0.0.1.59316: tcp 41
22:37:42.920260 IP 127.0.0.1.59316 > 127.0.0.1.25: tcp 0
22:37:45.376047 IP 127.0.0.1.59316 > 127.0.0.1.25: tcp 6
22:37:45.376167 IP 127.0.0.1.25 > 127.0.0.1.59316: tcp 41
22:37:45.376183 IP 127.0.0.1.59316 > 127.0.0.1.25: tcp 0
22:37:55.001364 IP 127.0.0.1.59319 > 127.0.0.1.25: tcp 0
22:37:55.001383 IP 127.0.0.1.25 > 127.0.0.1.59319: tcp 0
22:37:55.001410 IP 127.0.0.1.59319 > 127.0.0.1.25: tcp 0
22:37:55.001744 IP 127.0.0.1.25 > 127.0.0.1.59319: tcp 48
22:37:55.001788 IP 127.0.0.1.59319 > 127.0.0.1.25: tcp 0
22:37:55.002211 IP 127.0.0.1.59319 > 127.0.0.1.25: tcp 18
22:37:55.002224 IP 127.0.0.1.25 > 127.0.0.1.59319: tcp 0
22:37:55.002324 IP 127.0.0.1.25 > 127.0.0.1.59319: tcp 142
22:37:55.003479 IP 127.0.0.1.59319 > 127.0.0.1.25: tcp 23
22:37:55.003954 IP 127.0.0.1.25 > 127.0.0.1.59319: tcp 14
22:37:55.004112 IP 127.0.0.1.59319 > 127.0.0.1.25: tcp 13
22:37:55.004247 IP 127.0.0.1.25 > 127.0.0.1.59319: tcp 54
22:37:55.004354 IP 127.0.0.1.59319 > 127.0.0.1.25: tcp 6
22:37:55.004410 IP 127.0.0.1.25 > 127.0.0.1.59319: tcp 14
22:37:55.007740 IP 127.0.0.1.59319 > 127.0.0.1.25: tcp 0
22:37:55.007907 IP 127.0.0.1.25 > 127.0.0.1.59319: tcp 0
22:37:55.007924 IP 127.0.0.1.59319 > 127.0.0.1.25: tcp 0
22:38:03.194999 IP 127.0.0.1.44949 > 127.0.0.1.50007: UDP, length 5
22:38:10.962359 IP 127.0.0.1.44949 > 127.0.0.1.50007: UDP, length 2
22:38:24.940956 IP 127.0.0.1.44949 > 127.0.0.1.50007: UDP, length 6
22:38:30.499384 IP 127.0.0.1.44949 > 127.0.0.1.50007: UDP, length 3
22:38:32.945712 IP 127.0.0.1.44949 > 127.0.0.1.50007: UDP, length 6
22:38:34.994213 IP 127.0.0.1.44949 > 127.0.0.1.50007: UDP, length 6
22:38:51.832868 IP 127.0.0.1.59320 > 127.0.0.1.25: tcp 0
22:38:51.832887 IP 127.0.0.1.25 > 127.0.0.1.59320: tcp 0
22:38:51.832910 IP 127.0.0.1.59320 > 127.0.0.1.25: tcp 0
22:38:51.833247 IP 127.0.0.1.25 > 127.0.0.1.59320: tcp 48
22:38:51.833290 IP 127.0.0.1.59320 > 127.0.0.1.25: tcp 0
22:38:51.833711 IP 127.0.0.1.59320 > 127.0.0.1.25: tcp 18
22:38:51.833723 IP 127.0.0.1.25 > 127.0.0.1.59320: tcp 0
22:38:51.833838 IP 127.0.0.1.25 > 127.0.0.1.59320: tcp 142
22:38:51.835048 IP 127.0.0.1.59320 > 127.0.0.1.25: tcp 33
22:38:51.835528 IP 127.0.0.1.25 > 127.0.0.1.59320: tcp 14
22:38:51.835741 IP 127.0.0.1.59320 > 127.0.0.1.25: tcp 23
22:38:51.835874 IP 127.0.0.1.25 > 127.0.0.1.59320: tcp 64
22:38:51.836002 IP 127.0.0.1.59320 > 127.0.0.1.25: tcp 6
22:38:51.836053 IP 127.0.0.1.25 > 127.0.0.1.59320: tcp 14
22:38:51.839723 IP 127.0.0.1.59320 > 127.0.0.1.25: tcp 0
22:38:51.839916 IP 127.0.0.1.25 > 127.0.0.1.59320: tcp 0
22:38:51.839936 IP 127.0.0.1.59320 > 127.0.0.1.25: tcp 0
22:39:38.864123 IP 127.0.0.1.59316 > 127.0.0.1.25: tcp 22
22:39:38.864277 IP 127.0.0.1.25 > 127.0.0.1.59316: tcp 39
22:39:38.864293 IP 127.0.0.1.59316 > 127.0.0.1.25: tcp 0
22:39:48.432156 IP 127.0.0.1.59316 > 127.0.0.1.25: tcp 20
22:39:48.432307 IP 127.0.0.1.25 > 127.0.0.1.59316: tcp 36
22:39:48.432325 IP 127.0.0.1.59316 > 127.0.0.1.25: tcp 0
22:40:14.936224 IP 127.0.0.1.59316 > 127.0.0.1.25: tcp 6
22:40:14.936367 IP 127.0.0.1.25 > 127.0.0.1.59316: tcp 27
22:40:14.936384 IP 127.0.0.1.59316 > 127.0.0.1.25: tcp 0
22:40:20.960185 IP 127.0.0.1.59316 > 127.0.0.1.25: tcp 6
22:40:20.960301 IP 127.0.0.1.25 > 127.0.0.1.59316: tcp 39
22:40:20.960317 IP 127.0.0.1.59316 > 127.0.0.1.25: tcp 0
22:40:23.256259 IP 127.0.0.1.59316 > 127.0.0.1.25: tcp 6
22:40:23.256376 IP 127.0.0.1.25 > 127.0.0.1.59316: tcp 41
22:40:23.256392 IP 127.0.0.1.59316 > 127.0.0.1.25: tcp 0
22:40:34.104218 IP 127.0.0.1.59316 > 127.0.0.1.25: tcp 24
22:40:34.104340 IP 127.0.0.1.25 > 127.0.0.1.59316: tcp 39
22:40:34.104357 IP 127.0.0.1.59316 > 127.0.0.1.25: tcp 0
22:40:45.280157 IP 127.0.0.1.59316 > 127.0.0.1.25: tcp 24
22:40:45.285675 IP 127.0.0.1.25 > 127.0.0.1.59316: tcp 14
22:40:45.285710 IP 127.0.0.1.59316 > 127.0.0.1.25: tcp 0
22:40:55.768138 IP 127.0.0.1.59316 > 127.0.0.1.25: tcp 18
22:40:55.768840 IP 127.0.0.1.25 > 127.0.0.1.59316: tcp 56
22:40:55.768864 IP 127.0.0.1.59316 > 127.0.0.1.25: tcp 0
22:41:09.728936 IP 127.0.0.1.59336 > 127.0.0.1.25: tcp 0
22:41:09.728955 IP 127.0.0.1.25 > 127.0.0.1.59336: tcp 0
22:41:09.728978 IP 127.0.0.1.59336 > 127.0.0.1.25: tcp 0
22:41:09.742452 IP 127.0.0.1.25 > 127.0.0.1.59336: tcp 48
22:41:09.742511 IP 127.0.0.1.59336 > 127.0.0.1.25: tcp 0
22:41:09.742789 IP 127.0.0.1.59336 > 127.0.0.1.25: tcp 18
22:41:09.742796 IP 127.0.0.1.25 > 127.0.0.1.59336: tcp 0
22:41:09.742862 IP 127.0.0.1.25 > 127.0.0.1.59336: tcp 142
